id,url,score,body,date
ck0pgyz,https://www.reddit.com/r/Tunisia/comments/2ek4r5/,3,"Howdy!

Before anything, welcome to /r/Tunisia /u/tafcha (and since I suck at arabic I don't even know what that means, even if I heard it a few times).

Not even there are country, town, state, etc.. subreddits, there are also [country circlejerks subreddits](http://www.reddit.com/r/AskReddit/comments/25uswh/what_are_some_awesome_things_im_missing_out_in/chkyqzm) (which I personally find hilarious).

But wait, there is more ! Even if you must have stumbled upon the darker and/or unknown places of Reddit (according to your ""random subreddit policy""), if you like discovering new/interesting subs you can go to /r/wowthissubexists :)

As for this sub, /u/Enti_San (who is a mod of this subreddit, as you can see in the sidebar) pretty much explained everything, so I don't have much to add. Oh, and I unfortunately missed the meet-ups.

Cheers!

EDIT: two typos",2014-08-26 06:30:35
ckevnmk,https://www.reddit.com/r/Tunisia/comments/2djbyx/,3,"Tunisia is awesome for everybody , except Tunisians.",2014-09-11 00:05:31
ckipfhi,https://www.reddit.com/r/Tunisia/comments/2gb4th/,3,"في تونس تلاكم

علّيسة تريد أرنج",2014-09-15 06:40:23
ckoqrme,https://www.reddit.com/r/Tunisia/comments/2h21j4/,3,"not true , communication companies tried to make skype and viper a payed service but government did not allow them ",2014-09-21 21:29:47
cl0h2tx,https://www.reddit.com/r/Tunisia/comments/2i9z9m/,3,"I had some great Tunisian wine when I was there, I was surprised.",2014-10-04 21:16:18
clp9yrd,https://www.reddit.com/r/Tunisia/comments/2kstk8/,3,ask Enti_San to find you a good 'Ârrafa' :D,2014-10-31 16:37:46
cmb30b2,https://www.reddit.com/r/Tunisia/comments/2n7jna/,3,"those are letters that can not be pronounced in  english, french... so we replace them with the number that loks like them:   
3 is ع  
7 is ح   
5 is خ (this is maybe also because 5 in arabic stats with خ )  
8 is غ and so on  
If you don't actually know how these letters sound you can listen to them using th ""listen"" feature in [google translate](https://translate.google.com.tn/) .",2014-11-23 23:51:50
cmdy5v0,https://www.reddit.com/r/Tunisia/comments/2nh5u5/,3,"sorry to say but BIG MISTAKE , and as i think there is no medical marijuana in tunisia , also tunisia is a little bit shaken by the political situation , situation is not stable here ",2014-11-26 22:19:03
cmei6yx,https://www.reddit.com/r/Tunisia/comments/2nh5u5/,3,"First of all, Tunisia is far less worse than the impression you get by reading about it. Marijuana is indeed illegal, and punishable by law by one year in prison and around 300 dollars fine, but you can get around. Key is to keep a low profile on your consuming and not carry it around. 'nyways, it isn't our topic.  

However, the fact she's moving to another whole country with a guy she just met is alarming.  

 * Once the euphoria of ""an exotic culture that isn't rooted in consumerism"" will fade away, I'm not sure she's gonna like living in here, especially if neither her nor her husband have an over-decent income.

* She must be careful with her future husband's family. If she doesn't have money, she risks ending up being mistreated. (Nothing Hostel-like, but she won't find the company that pleasant.)

* Be careful of citizenship-diggers. It's sad, but most of my countrymen seek in fast marriages as a paved track to end up in a western country.  

My advice to you is to roll along, as the more you try to reason with her the more in love she'll think she is with the dude. Check on her on a regular basis, and be ready to pick her up from the airport, once she'll get a hold on reality.
",2014-11-27 15:34:21
cmicgap,https://www.reddit.com/r/Tunisia/comments/2nt4rr/,3,"currency too weak to compete so why bother , thats the nomber one reason .",2014-12-01 23:39:10
cmitq9i,https://www.reddit.com/r/Tunisia/comments/2o0icd/,3,"Non ne t'inquiètes pas, le français parlé en Tunisie est standard, je ne pense pas que tu auras des difficultés. Passes de bonnes vacances (en avance). :D",2014-12-02 13:30:09
cn14ogr,https://www.reddit.com/r/Tunisia/comments/2pvm0z/,3,"Oh yeees tunisians go vote, you have the freedom to choose one of our very best two candidates. One is supported by the people who want the old banned with blood and suffering system. And the other is mentally ill, total freak and not able to even make a right decision in the right time.

I'm not voting for any of them this time and none would tell me if you don't vote you can't fight for your rights because I would instead blame the people who actually voted (for anyone of both) for choosing a fool.",2014-12-21 06:38:07
cf1o9d0,https://www.reddit.com/r/Tunisia/comments/1wdv7z/,2,"No you have nothing to worry about on that front. Not as a tourist at any rate. You can get whatever bed you want.

I have lived in Sousse, Tunisia, 15 years including tumultuous late teens. The age of consent thing is pretty lax even to locals, at least in coastal cities, as long as there is no rape or pregnancy involved. Also there can be problems if girl isn't virgin in her wedding night, but even then it is not something the police enforces... otherwise they won't be doing much else.

TL;DR: Nothing to worry about as a tourist. Only potential hassle to local couples.",2014-01-29 08:01:02
cf7jete,https://www.reddit.com/r/Tunisia/comments/1x195c/,2,whereabouts are you moving to?,2014-02-05 09:33:33
cf7kkpm,https://www.reddit.com/r/Tunisia/comments/1x195c/,2,Tunis.,2014-02-05 11:39:41
cf8qevb,https://www.reddit.com/r/Tunisia/comments/1x6f5x/,2,"yeah...you will find a lot of things to eat..mainly beans (chick beans, white beans) and vegetables.
you have to try couscous while you are there.
I'm Tunisian.",2014-02-06 19:28:14
cfmqcji,https://www.reddit.com/r/Tunisia/comments/1ymkw7/,2,"Je t'en prie, alors pour ce qui est du logement et si tu cherches un appart dans le centre-ville je te conseillerais de choisir un quartier au alentours c'est bien plus safe pour une fille seule que Bab Souika(ça ne reste que mon avis vaut mieux demander à d'autre) et au alentours je peux te conseiller El Manar (je dirais qu'avec le métro ça devient proche du centre-ville) et c'est pour moi un quartier safe pour une fille seule. Il y'a aussi Bab El Khadhra et Bab Saadoun qui sont plus proches mais je n'ai sincérement pas une grande idée sur ce qui est de la ""safety"" dans ces quartiers-là.

Pour la carte bancaire je pense que ce n'est pas si difficile d'ouvrir un compte en banque en Tunisie(enfin je sais que ce n'est pas si difficile si on est tunisien) après ça peut prendre un peu plus de temps quand t'es une étrangère mais je vois pas vraiment l'importance d'une carte bancaire, tu laisses ton argent chez toi et tu prends juste le necessaire et t'as pas de problème après c'est juste un avis à toi de voir.",2014-02-23 19:29:36
cg8hoxj,https://www.reddit.com/r/Tunisia/comments/210m3c/,2,Very well done.,2014-03-21 19:17:28
cgc82nb,https://www.reddit.com/r/Tunisia/comments/20xtpm/,2,Happy 58th Independence Day from my side2,2014-03-26 07:58:54
cgn1n0o,https://www.reddit.com/r/Tunisia/comments/22bjl7/,2,"reddit is not much popular in Tunisia. Sidi Bouzid is a city in the middle of Tunisa with high number of unemployment and people with  nothing to do in their lives. It is very common that there are many people with the same name/last name, I doubt the Tunisian police would help in this, neither would the FBI (out of the US).",2014-04-08 09:56:29
cgnini9,https://www.reddit.com/r/Tunisia/comments/22bjl7/,2,"Thanks for your reply! The bank has cancelled the transactions, and I have changed passwords on ALL accounts. Was just looking for some advice. Figured with it being outside of the US, there was not much to do. Thanks again!",2014-04-08 21:28:57
cgqse52,https://www.reddit.com/r/Tunisia/comments/22vj7u/,2,"A couple of years back i bought an old chest of drawers from a junk market.
When i had brought it home and was about to put it in my room, I found this letter in one of the drawers. As i'm a swede who don't know any arabic at all, i put it back in the drawer and almost forgot about it, until today when i cleaned my room and found it again.
Any help will be very appreciated!",2014-04-12 20:26:00
cgyabqe,https://www.reddit.com/r/Tunisia/comments/22vj7u/,2,Damn..,2014-04-21 18:38:31
ch36qfa,https://www.reddit.com/r/Tunisia/comments/23vv1v/,2,Ma mère (medecin générale) a dit que le travail existe et il y'a manque de psychologues (exemple : Djerba a un seul psychologue).le salaire moyen ethatique est ~Dt900-1000.,2014-04-27 08:38:09
ch43sxo,https://www.reddit.com/r/Tunisia/comments/23vv1v/,2,Derien ^^. Oui par mois.,2014-04-28 13:47:50
chjpx9h,https://www.reddit.com/r/Tunisia/comments/25msfw/,2,"Cannabis seems like THE topic for people to suck on. I'm telling you Cannabis, so hot right now, Cannabis.",2014-05-16 18:48:01
chraupy,https://www.reddit.com/r/Tunisia/comments/25msfw/,2,"Friday evening, he got freed and the case was dismissed

Source (French) 
http://www.lecourrierdelatlas.com/721823052014Acquittes-Azyz-Amami-et-Sabri-Ben-Mlouka-sont-libres.html",2014-05-26 07:25:20
ci23zuc,https://www.reddit.com/r/Tunisia/comments/22vj7u/,2,"I agree, it is pretty cool. ",2014-06-08 11:31:54
ci38rlw,https://www.reddit.com/r/Tunisia/comments/27n9zj/,2,"Hi there.
It really depends on what your work is and what you are going to use the internet for generally.
Your best option though would be getting a 4mbps internet which might not be good to you ( depends on where you're from ) but it's good enough generally and quite stable.
I also think there are companies that have offers for temporary use (6 weeks in your case).
Just google these names and you choose for yourself :

Hexabyte

GlobalNet

Topnet


Edit: DO NOT GET A 3G INTERNET WHATSOEVER. You're gonna struggle with latency if that's something you're concerned about, it has countless other issues that i'm not going to even bother going through.

Source : Personal experience.",2014-06-09 20:02:06
ci4kyyu,https://www.reddit.com/r/Tunisia/comments/27n9zj/,2,"You could actually get something like this [Orange Tunisie Clé 3G MAX](http://www.orange.tn/fixe-et-internet/cid3559-cl-e-3g-e372.html) or by choosing one of these options [Forfait Internet Everywhere](http://www.orange.tn/fixe-et-internet/la-cl-e-3g/cid3235-forfait-internet-everywhere-pro.html). The speed varies it could go up to 42Mbps. All you have to do is go to one of Orange stores and buy one of these USB drivers that would allow you to have internet anywhere you would go. 

Prices also vary with the speed.",2014-06-11 05:29:31
ci4scnn,https://www.reddit.com/r/Tunisia/comments/27n9zj/,2,"about Djerba you need either adsl connection of at least 4Mbps or ,my personal favorite, regarding speed is the Clé 3G ~~tunisiana~~ Ooredoo it has good speed ( depends a bit on where you are in Djerba ) , it's limited though (35 Dt for 40 Gigabytes + 1 Gigabyte free from 10 pm to 8 am ,wich is a good amount, for one month ) but it has no contract or anything you pay it cash every time and you may reuse it anytime you come to work here. Works well if you want flexible internet and do not use a metric ton of it.",2014-06-11 14:15:26
ci53jkm,https://www.reddit.com/r/Tunisia/comments/27jhj4/,2,"Shall we send messages in the ""active"" users' inboxes maybe they're just not here for now.",2014-06-11 20:37:08
ci57si6,https://www.reddit.com/r/Tunisia/comments/27jhj4/,2,Ill try why not,2014-06-11 23:07:54
ci58cgb,https://www.reddit.com/r/Tunisia/comments/27jhj4/,2,"Guys this is a great idea , but throughout these two weeks I i will pass my exam.",2014-06-11 23:29:51
ci58jwc,https://www.reddit.com/r/Tunisia/comments/27jhj4/,2,"k this is my second account my main is not for use atm (work stuff) but ill will be directing some of the tunisian social network users to reddit , i have been using it for over a year , and it is a nice place to interact with others .",2014-06-11 23:38:01
ci5h5su,https://www.reddit.com/r/Tunisia/comments/27jhj4/,2,Well I think we should just go for a coffee this time. Festival would have been great if we could go in bigger number.,2014-06-12 05:42:17
ci5h9zs,https://www.reddit.com/r/Tunisia/comments/27jhj4/,2,"G3nzo we will be meeting in Tunis most likely for coffee, if you could spare like two hours on Saturday that would be great! Let us know when will you be free.",2014-06-12 05:48:47
ci5hbnt,https://www.reddit.com/r/Tunisia/comments/27jhj4/,2,"LOMOsenpai, that would be great! thank you! Will you be free to come on Saturday, we are most likely going to gather up for a nice café. If you have any suggestions, let us know!",2014-06-12 05:51:28
ci5hfqs,https://www.reddit.com/r/Tunisia/comments/27jhj4/,2,3la 3ajla?,2014-06-12 05:58:18
ci5j4ae,https://www.reddit.com/r/Tunisia/comments/27jhj4/,2,Check my reply to /u/Enti_San ;),2014-06-12 08:12:57
ci5j77w,https://www.reddit.com/r/Tunisia/comments/27jhj4/,2,"lol ""Jukebox"" are featured in both events ([link](https://www.facebook.com/events/300318740136428/))",2014-06-12 08:20:12
ci5jf19,https://www.reddit.com/r/Tunisia/comments/27jhj4/,2,Some hardworking fellas :D,2014-06-12 08:40:55
ci5jvwr,https://www.reddit.com/r/Tunisia/comments/27jhj4/,2,"Smug's sounds good.

EDIT : [RSVP](http://www.meetup.com/reddit/Tunis-TN/1170232/) here.",2014-06-12 09:28:09
ci5s933,https://www.reddit.com/r/Tunisia/comments/27jhj4/,2,"not sure ,have exams :D",2014-06-12 16:44:33
ci5u1ek,https://www.reddit.com/r/Tunisia/comments/27jhj4/,2,"SpaceLord, we think we will be joining you to that event! I think we could use some Joujma for our reddit meet up :D",2014-06-12 17:42:51
ci5wpd5,https://www.reddit.com/r/Tunisia/comments/27jhj4/,2,"Great 8-)

You should edit your post now : )",2014-06-12 19:11:11
ci6ikll,https://www.reddit.com/r/Tunisia/comments/27z6xv/,2,"Thank you, that makes me feel a bit better =] Based on what everyone has said here and what my friend has said I've decided to go with him to Tunisia! Adventure!",2014-06-13 13:10:10
ci6ilvn,https://www.reddit.com/r/Tunisia/comments/27z6xv/,2,"Yes, I will be staying with my friend's family and I'm very excited for that. I'm very excited to try all of the grandmother's Tunisian food!

Thanks for your reply, this helps put me at ease. I've decided to go to Tunisia with my friend =] ",2014-06-13 13:12:01
ci7bkz3,https://www.reddit.com/r/Tunisia/comments/27jhj4/,2,[deleted],2014-06-14 12:02:28
ci7bp8c,https://www.reddit.com/r/Tunisia/comments/27jhj4/,2,".... no reddit meet up this year ? :/ 

Edit/ well all I can say is it sucks. The event was supposed to start in 2 hours... I can't believe they did a last minute cancellation, well Hopefully for the best.",2014-06-14 12:13:30
ci7btmx,https://www.reddit.com/r/Tunisia/comments/27jhj4/,2,"You give up fast, don't ya ?  
Well I'm still down for the meetup, it's only that our initial plans have to be reconsidered since the concert has been cancelled.",2014-06-14 12:24:16
ci7bwk8,https://www.reddit.com/r/Tunisia/comments/27jhj4/,2,that's the spirit :D,2014-06-14 12:31:12
ci7c1jd,https://www.reddit.com/r/Tunisia/comments/284gtf/,2,"You know what pisses me off? I've been living in Tunisia for 3,5 months now, and I work on the issue of parity, so I get to meet a lot of officials and civil society members and ask them questions about women in Tunisia. And almost every single one of them told me that there were no issue with women in Tunisia, no barrier to overcome, and equality of chances with men at birth.

That may be half true for a very small minority of well educated women who grew up in rich neighborhoods in progressist families. And still, their freedom is half the one men have (like in ""no walking in the street late at night, no dressing the way you want to, no smoking in public places etc.""). But poor Eya never had any kind of freedom, she was just a token of his father's honor, and trying to act like she was a normal human being, like being a woman was not the predeterminent that would decide all her life, killed her.

Face it Tunisian people : your country might be one of the most advanced in terms of women's right in the arabic world, but most of the population still has very retrograd mentalities regarding women, and there is still a lot of work to achieve in order to get closer to equality.",2014-06-14 12:42:54
ci7c77j,https://www.reddit.com/r/Tunisia/comments/27z6xv/,2,"First of all, the chances of you getting some tropical disease or being kidnapped are close to null :). You can be reassured about that.

I've been living in Tunisia for 4 months now and I would totally recommand that you visit the country! It has lots of beautiful places and landscape. I personnaly hate big hotels by the seaside with all comfort and pools, but if that's what you're into you can totally find that in Hammamet or Sousse. Personally I would recommand that you go in Tozeur (but it's getting very hot here in the summer) and visit the desert, hav a camel ride etc. Otherwise, there are some really neat roman ruins in Tunisia, my favorites are in Dougga (1,5 hours from Tunis by car/louage) and El Gem (more like 3 hours from Tunis).

Aside the tourist attraction, Tunisia is very different depending on where you go. Tunis is not that different from Europe and has all the noise and the mess of a capital city. Sousse is similar. It depends on where your friend lives. But anyway, food is good and cheap, you can find descent clothes for almost nothing in the market and fruits are cheap and amazing. 

Now something your need to be warned about : yes Tunisian are very nice, very helpful and polite and generous. But there are many, many rude boys on the street. If parts of your skin is showing, if you wear make-up, if you're blonde or just if you're a young girl, etc. You will be observed and catcalled. A lot. And that's not pleasant at all, I had a very hard time dealing with this at the beginning of my stay here. That being said, if you are with a man they usually they you alone.",2014-06-14 12:55:28
ci7clwc,https://www.reddit.com/r/Tunisia/comments/27jhj4/,2,"Alrighty! well Me and theeldorado have confirmed that we could meet up around 4:30 pm at 716, a café in LAC2. Do you think you could join us there ? :D send sms or call me on 96.085.431",2014-06-14 13:26:24
ci7cxa8,https://www.reddit.com/r/Tunisia/comments/27jhj4/,2,"yeah I'm definitely in. Still i have a little issue with the timing here: i have a job interview scheduled for 5pm but i'm still reluctant on whether i should go or not. That and the fact that 4pm is still too damn hot for us to do anything ""productive"" unless we're gonna just chill under an air conditioner :P

Anyway, i'm still undecided on the job interview ordeal, but in the worse case scenario i'll join you guys around 6pm, so don't be assholes and use up all the fun by yourselves :p",2014-06-14 13:48:29
ci7d2a2,https://www.reddit.com/r/Tunisia/comments/27jhj4/,2,Okey it's on foe me.,2014-06-14 13:57:42
ci7hf38,https://www.reddit.com/r/Tunisia/comments/27jhj4/,2,"In her defense, her parents didn't leave until late.",2014-06-14 17:34:15
ci95z2d,https://www.reddit.com/r/Tunisia/comments/284gtf/,2,"I don't think there is anything came from a religion basis in the sccident. The man is a crazy bastard and there's no reason to do such a thing to a kid, especially his daughter. 

You may have convinced me there. Looks like you're not just a tourist only looking for having some fun. What places did you visit here in Tunisia?",2014-06-16 20:00:07
ciai8mb,https://www.reddit.com/r/Tunisia/comments/27jhj4/,2,"It is quite alright there no worries! It was actually fun, 4 of us attended, we had great talk, discussed everything from video games, music, movies, space, science, philosophy, it was great! we will be planing another one in June, probably not this weekend. Let me know when you are free, so that next time we plan for a meet up you can join us!",2014-06-18 05:54:36
cialktf,https://www.reddit.com/r/Tunisia/comments/28g5ce/,2,"Lower prices, in credibility maybe.",2014-06-18 10:29:24
ciantzs,https://www.reddit.com/r/Tunisia/comments/28g5ce/,2,That website is pretty cool.,2014-06-18 13:06:20
cibno4n,https://www.reddit.com/r/Tunisia/comments/28jype/,2,Maybe you should contact your embassy/consulate to get more details in this matter. Honestly i don't and i can't find any information about it. Good luck.,2014-06-19 15:31:25
cibo9eo,https://www.reddit.com/r/Tunisia/comments/28jype/,2,I did and they aren't open. Tomorrow is a holiday here so they won't be open tomorrow either.,2014-06-19 15:52:44
cichaci,https://www.reddit.com/r/Tunisia/comments/28n4dq/,2,Okey that's interesting!,2014-06-20 14:19:35
cid4akm,https://www.reddit.com/r/Tunisia/comments/28n4dq/,2,omg really? :D I am soo going!,2014-06-21 05:15:48
cid4bjz,https://www.reddit.com/r/Tunisia/comments/28n4dq/,2,Ok I am in! Anyone else interested to go? :D,2014-06-21 05:17:15
cida5zw,https://www.reddit.com/r/Tunisia/comments/28n4dq/,2,Alright i can be there around 18h30.,2014-06-21 13:41:00
cide2av,https://www.reddit.com/r/Tunisia/comments/28q9mk/,2,"Thank you, yes I did use my GoPro :)",2014-06-21 16:59:30
cidefrl,https://www.reddit.com/r/Tunisia/comments/28q9mk/,2,"Nice footage, glad you enjoyed your stay. Are you planning to visit more places here?",2014-06-21 17:15:16
cieqpnx,https://www.reddit.com/r/Tunisia/comments/28nkk3/,2,HOLY SHIT ! No one has ever done that before. Gaucho Prince and Break are totally loyal to us consumers. ,2014-06-23 10:47:49
ciezd3i,https://www.reddit.com/r/Tunisia/comments/28q9mk/,2,how much did it cost you? and for how long you stayed there? seems like 5* hotel.,2014-06-23 17:31:26
cifn4mo,https://www.reddit.com/r/Tunisia/comments/28n4dq/,2,it's - it's - - heaven though!,2014-06-24 11:05:02
cifr8lk,https://www.reddit.com/r/Tunisia/comments/28q9mk/,2,"Only £700 for me and my girlfriend a weeks all inclusive, absolute bargain!",2014-06-24 14:37:58
ciqbbll,https://www.reddit.com/r/Tunisia/comments/2a0co3/,2,"""Keeping up with the Jomaas"" coming this fall!",2014-07-07 02:29:20
cir0nax,https://www.reddit.com/r/Tunisia/comments/2a0co3/,2,Is this gonna become the new Karbool ?,2014-07-07 21:48:06
ciwjo81,https://www.reddit.com/r/Tunisia/comments/2am6l4/,2,Welcome bud,2014-07-13 22:32:37
ciwpk36,https://www.reddit.com/r/Tunisia/comments/2am6l4/,2,any meeting this year ? ,2014-07-14 02:26:20
ciwzofm,https://www.reddit.com/r/Tunisia/comments/2am6l4/,2,AFAIK they did the meeting back in June.,2014-07-14 12:48:26
cj0tmci,https://www.reddit.com/r/Tunisia/comments/2b00ug/,2,"[HighSchool of The Dead](http://www.animeseason.com/gakuen-mokushiroku-high-school-of-the-dead/), I believe it was in the Ep08.",2014-07-18 11:45:14
cj1mm2f,https://www.reddit.com/r/Tunisia/comments/2b23g0/,2,Please note that the video has been removed since it can be interpreted as a video that is inciting on Jihad and is prone to Islamists. Posting such videos could get you banned next time. If you would like to open a thread discussing Jihad  you will be welcome to. But posting anything that could incite violence even it was supportive to Gaza and Palestine will not be tolerated on this subreddit. Again you may open a discussion thread. Just no videos inciting on Violence/Jihad.,2014-07-19 06:48:48
cj1mqaj,https://www.reddit.com/r/Tunisia/comments/2b00ug/,2,"That is very cool. Actually the anime Monster mentions Tunisia and Sidi Bou Said in it too. I forgot what episode it was. 

PS: found it! [Here it is](http://www.youtube.com/watch?v=iuki8JJ2bvg#t=15)  and it mentions it again [here](http://www.youtube.com/watch?v=iuki8JJ2bvg#t=394)",2014-07-19 06:56:26
cj1nu3m,https://www.reddit.com/r/Tunisia/comments/2b00ug/,2,Tuneeeja,2014-07-19 08:17:23
cj29nin,https://www.reddit.com/r/Tunisia/comments/2b4fvs/,2,The gov is using ISP to track down suspicious pages now. They MUST seize the ppl behind this and punish them. The first minister himself said that whoever cheered for chaanbi attack will be punished when evidence are available.,2014-07-20 02:57:08
cj2ch4v,https://www.reddit.com/r/Tunisia/comments/2b00ug/,2,In what context was this said?,2014-07-20 05:04:37
cj2cim1,https://www.reddit.com/r/Tunisia/comments/2am6l4/,2,Hello! I'm glad there is a subreddit for Tunisia with like-minded people :),2014-07-20 05:06:43
cj2mgag,https://www.reddit.com/r/Tunisia/comments/2b00ug/,2,"Oh well if that's why, I think it's far fetched. No one would connect the two things quickly. Thanks",2014-07-20 16:26:34
cj3u73y,https://www.reddit.com/r/Tunisia/comments/2b8khv/,2,"Hello and welcome to our community mimotifo, please note that there are some rules to respect around this subreddit one of which is to not make snarky comments ;) which I am hoping was not your intention with  that reply. 

and I am from Sousse. ",2014-07-21 22:09:43
cj3ug82,https://www.reddit.com/r/Tunisia/comments/2b00ug/,2,lol BF is going to enjoy this one.,2014-07-21 22:18:03
cj3uilu,https://www.reddit.com/r/Tunisia/comments/2b00ug/,2,"Dude, that is so cool.  I love comic books.  (I'm the BF of Enti_san)  I will try my best to track this down to read.  I will do my best to scan it for others to read here too if I can find it.  [You can check this out for all Tunisian references in DC Comics](http://dc.wikia.com/wiki/Category:Tunisia/Appearances)",2014-07-21 22:20:12
cj753ov,https://www.reddit.com/r/Tunisia/comments/2bnm72/,2,Sweet!,2014-07-25 03:43:04
cj7wjte,https://www.reddit.com/r/Tunisia/comments/2bhrc0/,2,"http://yakayaka.org/media/k2/items/cache/b1f40bd2796c35fa8062d0f6df09e4fd_L.jpg

Translation ""this to protect you from the evil terrorists""",2014-07-25 23:19:41
cj81h7f,https://www.reddit.com/r/Tunisia/comments/2b8khv/,2,La goulette,2014-07-26 02:40:03
