id,url,score,body,date
cj8jo09,https://www.reddit.com/r/Tunisia/comments/2bslha/,2,"I know about that incident but it seems that is an issue on the mtgox security implementation not the bitcoin protocol itself. BitCoin is still going strong (quickly check  r/bitcoin and you'll realize that + all the new businesses that are accepting payment with bitcoin and are very happy with it).

BitCoin has a very secure structure (namely the blockchain) that verifies each and every transaction  that happens on the network. 

I acknowledge that some have been victims of theft and lost their bitcoins. Most of them gave blinding trust to online wallets (coinbase for example which many discourage because they keep YOUR your private key to themselves and act like a traditionnal bank) and do not do backups for their private keys..

Bitcoin is now like the wild west, infrastructure is getting better and stronger as technology improves. I think BitCoin is a good investment.
",2014-07-26 19:38:40
cjauedb,https://www.reddit.com/r/Tunisia/comments/2b8khv/,2,Reporting from Sousse!,2014-07-29 08:43:30
cjgkjpl,https://www.reddit.com/r/Tunisia/comments/2cjld9/,2,I'm tunisian and about to start studying in uni here in Tunis in september. There is absolutely no need to worry about anything especially if its just a short vacation. The events at chaanbi are few and far between and have earned considerable media coverage due to the rarity of such events. So make sure to pass by and enjoy your time !,2014-08-04 14:55:30
cjhzfia,https://www.reddit.com/r/Tunisia/comments/2cjld9/,2,"i wouldn't advise it , traveling by plane is safer and faster .
and for now with the hole situation of libya its best to avoid traveling close to the border in a taxi or any other land transportation.",2014-08-05 22:54:28
cjhziq6,https://www.reddit.com/r/Tunisia/comments/2c6zvh/,2,wow i didn't even know that thanks for the info,2014-08-05 22:57:48
cji1lmn,https://www.reddit.com/r/Tunisia/comments/2cjld9/,2,thanks! unfortunately flights from Annaba are very expensive... but I'll be back in Algeria (and hopefully Tunisia) in the future :),2014-08-06 00:13:53
cjje0wg,https://www.reddit.com/r/Tunisia/comments/2cnio8/,2,"Hey!

The way from Tunis to Sahara is full of great cities :)

You can visit Nabeul, Hammamet, Sousse, Monastir, Mahdia, ElJem and others cities.. Am sure that you'll like cities that I mentioned..",2014-08-07 10:41:09
cjk232a,https://www.reddit.com/r/Tunisia/comments/2cnio8/,2,Thanks for the recommendations! ,2014-08-08 00:34:32
cjpoapu,https://www.reddit.com/r/Tunisia/comments/2dgzym/,2,"For teaching English, AMIDEAST is your best bet.",2014-08-14 02:30:35
cjpw88f,https://www.reddit.com/r/Tunisia/comments/2cnio8/,2,"Hello ! 

As a Star Wars fan, I would recommend you to visit the Mos Espa set  (Tatooine) in Tozeur if you want to walk in Darth Vader's Footsteps :P

Here's a link to give you an idea about that place :

http://www.losapos.com/starwarstunisia

Also Carthage and Sidi Bousaid are two great places to visit if you want to know more about Tunisia's history and culture (They are in Tunis)

Have a nice stay !",2014-08-14 09:20:03
cjr54a5,https://www.reddit.com/r/Tunisia/comments/2djbyx/,2,"Of course!  I'm from Montreal, Canada.",2014-08-15 17:07:55
cjrejn0,https://www.reddit.com/r/Tunisia/comments/2djbyx/,2,any time :D,2014-08-15 21:57:14
cjtgtvj,https://www.reddit.com/r/Tunisia/comments/2djbyx/,2,Happy that you enjoyed your vacation :) ,2014-08-18 10:35:40
cjupyq8,https://www.reddit.com/r/Tunisia/comments/2c6zvh/,2,"Man that is really awesome, I never knew that I love Doctor Who",2014-08-19 17:28:00
cjutlne,https://www.reddit.com/r/Tunisia/comments/2c6zvh/,2,I know right! Such a shame the new series didnt quite make its way to Tunisia. i only know a couple of Whovians and I wish there were more. There's always something fundamentally interesting to discuss with a Whovian!,2014-08-19 19:12:59
ck0fnn8,https://www.reddit.com/r/Tunisia/comments/2ek4r5/,2,"*tafcha* not *Tafcha* plz.

&gt;as long as you don't start a hate/racist/violent or seemingly inviting to hatred/racism/violence speech.

Don't worry , althoug reddit provides some sort of anonymity (not as much as [4chan](http://4chan.org) ) which leads to it being exploited by trolls/haters/racists... i'm not any of those  ^i ^think ^my ^user ^name ^is ^to ^blame ^for ^making ^me ^look ^like ^one ^of ^those ^specially ^a ^troll

Anyway , i'm looking forward to discussing stuff with you guys specially that i discovored that most of the people here (if not all) have the same interest (games,anime,cats ...) and looking more forward to grab my popcorn for those sensitive topics. 

And mostly excited for the annual meetup , next year hopefully since i came here a little bit late.",2014-08-25 23:53:38
ck0p7ex,https://www.reddit.com/r/Tunisia/comments/2ek4r5/,2,"We can still meet before the reddit's global meet up day, if you have any suggestions on where to meet or a nice event to attend, don't hesitate to start your post and such.",2014-08-26 06:13:35
ck0zgi2,https://www.reddit.com/r/Tunisia/comments/2ek4r5/,2,"In Thailand they pronounce 5 ""ha"" so 5555555 means ""hahahahahahaha""",2014-08-26 16:09:25
ck2wnd9,https://www.reddit.com/r/Tunisia/comments/2dhcpt/,2,"i think i can recommend you a nice place: Cubana (Berges du Lac) a kinda latino restaurant, they make really yummy tacos and burritos! tried it twice wasn't disappointed at all and im sure they can give you recipes! owner is an awesome guy",2014-08-28 16:28:00
ck7zs16,https://www.reddit.com/r/Tunisia/comments/2fcfsl/,2,I'm in!,2014-09-03 13:58:59
cka7q83,https://www.reddit.com/r/Tunisia/comments/2fkr3b/,2,shit's cool!,2014-09-05 20:32:32
ckcdflr,https://www.reddit.com/r/Tunisia/comments/2fso6h/,2,I saw the city on the way to Insat (uni). Kinda feels cool to see things posted on reddit regarding your local area! ,2014-09-08 11:31:31
ckcenie,https://www.reddit.com/r/Tunisia/comments/2fso6h/,2,I'm in,2014-09-08 12:52:18
ckceqf1,https://www.reddit.com/r/Tunisia/comments/2fso6h/,2,"Awesome, it seems like it will be at least 5 of us.  6 if you bring the Mrs.  Hopefully we can get a few more.  /u/Enti_san it's usually meant for kids but, meh, it looks very interesting to me.  If nothing, can get a nice show in the Planetarium.",2014-09-08 12:56:51
ckcequa,https://www.reddit.com/r/Tunisia/comments/2fso6h/,2,:D  So will you be coming?,2014-09-08 12:57:30
ckcer0m,https://www.reddit.com/r/Tunisia/comments/2fso6h/,2,Sweet.  I'll give more information when I find out more.,2014-09-08 12:57:46
ckcf2ql,https://www.reddit.com/r/Tunisia/comments/2fso6h/,2,Yep madinet el ouloum!,2014-09-08 13:15:03
ckciu81,https://www.reddit.com/r/Tunisia/comments/2fso6h/,2,I'm in too,2014-09-08 15:45:21
ckhvh7h,https://www.reddit.com/r/Tunisia/comments/2gb4th/,2,Never heard of Elissa.,2014-09-14 10:24:08
ckhxxib,https://www.reddit.com/r/Tunisia/comments/2gb4th/,2,A virtual operator run by TT,2014-09-14 13:43:37
ckhyx2c,https://www.reddit.com/r/Tunisia/comments/2gb4th/,2,Ok thanks,2014-09-14 14:34:04
cki9kyz,https://www.reddit.com/r/Tunisia/comments/2gb4th/,2,Totally agree...  If they could only improve their services...for all that money they get they should be much better.,2014-09-14 20:33:45
ckm8ihy,https://www.reddit.com/r/Tunisia/comments/2gb4th/,2,tafcha,2014-09-18 22:51:46
cknmpaj,https://www.reddit.com/r/Tunisia/comments/2djbyx/,2,Come back soon!,2014-09-20 15:31:19
ckpiu0z,https://www.reddit.com/r/Tunisia/comments/2h42bc/,2,"&gt;Mount Ech Chanbi   

oh my god i want to go there so bad !!",2014-09-22 18:35:17
ckq6ij7,https://www.reddit.com/r/Tunisia/comments/2h42bc/,2,\o\o\o\o\o/o/o/o/o/,2014-09-23 11:30:21
ckqj47l,https://www.reddit.com/r/Tunisia/comments/2h7pg2/,2,"oh shit this is actually jawharafm! does this mean we're like involved in social media now ? is this subreddit getting popular ? cuz if it is, i'm leaving.",2014-09-23 19:21:23
ckqpp0b,https://www.reddit.com/r/Tunisia/comments/2h42bc/,2,[deleted],2014-09-23 22:46:31
ckxpgn8,https://www.reddit.com/r/Tunisia/comments/2h42bc/,2,Want to go to there.,2014-10-01 19:10:33
cl8fhw5,https://www.reddit.com/r/Tunisia/comments/2j51c8/,2,un site tunisien pour poster et consulter des annonces sur tunisie (petite annonces),2014-10-13 18:47:57
clk4oat,https://www.reddit.com/r/Tunisia/comments/2kct3r/,2,[Things went pretty smoothly in here](http://i.imgur.com/vRA0mCQ.jpg).,2014-10-26 12:55:45
clo8v35,https://www.reddit.com/r/Tunisia/comments/2ks9li/,2,Nahdha,2014-10-30 15:39:37
clojtik,https://www.reddit.com/r/Tunisia/comments/2ks9li/,2,"There are a lot of people i knew by face that went to fight in Syria from the bled (Sidi Bouzid), but i still didn't hear of anyone going to fight with Isis *yet* .
",2014-10-30 21:08:07
clp3vlf,https://www.reddit.com/r/Tunisia/comments/2kstk8/,2,I might be there.,2014-10-31 12:59:32
cm8ery7,https://www.reddit.com/r/Tunisia/comments/2mvgn2/,2,Why do you feel it needs to change? The current theme includes the flag in several places.,2014-11-20 22:55:41
cmdkdj8,https://www.reddit.com/r/Tunisia/comments/2nb8xi/,2,"Thank you, I'll try and search for the Berber culture, then.",2014-11-26 14:31:47
cmeurjt,https://www.reddit.com/r/Tunisia/comments/2neld1/,2,You sure? What if they sneak back in through the mountains or the desert?,2014-11-27 23:41:14
cmgn9lb,https://www.reddit.com/r/Tunisia/comments/2nt4rr/,2,"This pisses me off too, international credit card stuff that is. I had the same problem when using  steam some years ago so i asked around and most of what i got  was roughly that: the country relies on a supply of currency(dollars euros...international ones) that can be used in international transaction but since it's not easily replenish-able (it comes from exports and money sent back from Tunisians living abroad like to their families and such) they choose to give priority to  companies especially big exporters and make very strict rules surrounding it. basically what i got was: country can't afford it.",2014-11-30 03:00:44
cmiv7p9,https://www.reddit.com/r/Tunisia/comments/2nt4rr/,2,"Yup. It is more because other countries don't allow you in rather than the government don't allow you out. The Tunisian Dinar is so weak it is not allowed to be exchanged with other currencies. For example if you want to send Dinars to someone let say in France, the French government won't accept dinars from Tunisia. So Tunisia should convert those Dinars to Euros before sending them which will eat all of the national reserve of hard currencies if allowed.",2014-12-02 14:39:25
cmixw8p,https://www.reddit.com/r/Tunisia/comments/2nt4rr/,2,"i see, thanks for the information ",2014-12-02 16:13:38
cmiylgd,https://www.reddit.com/r/Tunisia/comments/2o0icd/,2,"Tunisian go the extra mile to get there message through or to understand what you're saying , you don't need Arabic , the majority of Tunisian speak French and a great percentage especially young people speak English 

bonus tip : we love to hear foreigners say Tunisian words like[ 'aslama' and 'eyaychik'](http://www.tripadvisor.co.uk/Travel-g293753-s604/Tunisia:Important.Phrases.html) ",2014-12-02 16:35:06
cmj0ru6,https://www.reddit.com/r/Tunisia/comments/2o0icd/,2,ye canadian is the perfect nationalty to survive in our climat :) ,2014-12-02 17:40:22
cmj8noj,https://www.reddit.com/r/Tunisia/comments/2o0icd/,2,"Shoukran! Or, should I say: eyaychik! What sort of other differences can I expect in the Arabic dialect? All the Arabic greetings I've learned I learned from Lebanese folks.",2014-12-02 21:21:10
cmjaz3k,https://www.reddit.com/r/Tunisia/comments/2o0icd/,2,"we watch a lot of Lebanese  drama series ,we understand very well the dialect, so you could use everything you learned :) , feel free to ask about how the words are pronounced or how to say something in the Tunisian dialect ( we get amused by foreigners butchering the pronunciation , so feel free to practice  :p  

if you are looking for the full Tunisian experience, you should venture out of the tourist zones and visit more than one city , visit the markets , eat every Tunisian food ( you must try the [Lablabi](http://en.wikipedia.org/wiki/Lablabi) )",2014-12-02 22:23:37
cmuv566,https://www.reddit.com/r/Tunisia/comments/2h42bc/,2,Most Tunisians Don't Know About*,2014-12-14 21:40:15
cmxuept,https://www.reddit.com/r/Tunisia/comments/2pgb0c/,2,gr8 fking work,2014-12-17 19:42:40
cn3pic8,https://www.reddit.com/r/Tunisia/comments/2q1gbl/,2,"I do have some lingual help at my disposal (my wife) but she works during the day and can't do everything herself.  I'm trying to learn the language but it's difficult when I'm working too.  I'm a mod here because I have experience building up subs and helping run them too.  In the future I am hoping to plan some stuff for the sub to do to build an even greater community here.

Yes, if you do stalk me, you'll probably see that I married a Tunisian.  She was unable to come to the US, so I moved here. =)",2014-12-23 23:19:13
cn4p8pl,https://www.reddit.com/r/Tunisia/comments/2qb689/,2,"so close to that shape being an audi logo
",2014-12-25 02:14:15
ceezypp,https://www.reddit.com/r/Tunisia/comments/1tj6tf/,1,How old are you?,2014-01-01 22:04:34
cefcw2a,https://www.reddit.com/r/Tunisia/comments/1tj6tf/,1,25,2014-01-02 08:20:31
ceuvwsi,https://www.reddit.com/r/Tunisia/comments/1uq4au/,1,Any follow-up news to this?,2014-01-21 06:15:58
cevz3ca,https://www.reddit.com/r/Tunisia/comments/1vutgd/,1,"Links:

* [Event's website](http://www.dunes-electroniques.com/)
* [Twitter](https://twitter.com/DunesElectro)

And this is [where](http://img.gawkerassets.com/img/19dc5ayqj77xxjpg/ku-xlarge.jpg) it will happen.",2014-01-22 15:36:04
cf0tf7i,https://www.reddit.com/r/Tunisia/comments/1w0x12/,1,"Pats fan here, and lived in Tunisia 15 years. Currently in Europe though.

The odds are the only NFL fans in Tunisia would be North American expats. The good news is with you moving to the capital, that's the most likely place to find them, the US ambassy/consulate might be able to hook you up with some, check their facebook page, if so inclined.

I would recommend nfl gamepass. Although one of the Canal+ channels that you can get in Tunisia may show the games, odds are it wont be your team's games and the commentary would be horrendous (and French).",2014-01-28 09:06:40
cf0txm8,https://www.reddit.com/r/Tunisia/comments/1w0x12/,1,You won't find one.,2014-01-28 10:04:15
cf3582h,https://www.reddit.com/r/Tunisia/comments/1u92yz/,1,:),2014-01-30 23:53:45
cf358gw,https://www.reddit.com/r/Tunisia/comments/1tj6tf/,1,tunis :P,2014-01-30 23:54:12
cf3jzr9,https://www.reddit.com/r/Tunisia/comments/1wmzkv/,1,"'dilemma'  (""a situation in which a difficult choice has to be made between two or more alternatives, esp. equally undesirable ones."") I cannot see how Child Labour is a dilemma. It is not as if the choice between accepting child labour or opposing it, is difficult.

With that out of the way, you could look into women rights. In the very new constitution, the state on one hand 'guaranties the equality between man and woman' but on the other hand is 'protector of the sacred' and 'Islam is the state religion'... in the Quran when it comes to inheritance or legally bearing witness a man is worth 2 women. 

Also the new constitution has something about the '[human] life being sacred' , that could be used to oppose abortion.

I hope this helps. You can look up the exact articles of the constitution, and verses of the Quran as references.",2014-01-31 13:31:44
cf77pl3,https://www.reddit.com/r/Tunisia/comments/1wdbul/,1,Did you mean answer your questions?,2014-02-05 00:23:18
cf7kenr,https://www.reddit.com/r/Tunisia/comments/1x195c/,1,"I might still be here, i love board games, but really havent had much luck finding people to play with. Ive got carcasonne and agricola wit me.",2014-02-05 11:22:03
cf8qv9b,https://www.reddit.com/r/Tunisia/comments/1x6f5x/,1,and lenses as well ;),2014-02-06 19:43:45
cf930qh,https://www.reddit.com/r/Tunisia/comments/1x195c/,1,"I'm not a tunisian, what makes you ask that?",2014-02-07 02:54:40
cfd9nv1,https://www.reddit.com/r/Tunisia/comments/1xllpp/,1,what was the context?,2014-02-12 06:34:12
cfmpc62,https://www.reddit.com/r/Tunisia/comments/1ymkw7/,1,"Merci beaucoup pour tes conseils, surtout pour la carte sim. Je suis en train de chercher un appart, si possible dans le centre puisque mon job est dans le coin, mais je me demandais si ces quartiers, notamment Bab Souika et Bab El Bhar, sont safe/agréables pour une fille seule ? Sinon, quel quartier me conseillerez vous ? (Je ne souhaite pas allez dans les banlieues ""chics"")

Ah et oui une dernière chose : est-ce que c'est facile d'ouvrir un compte en banque en Tunisie, et est-ce que vous pensez qu'il est nécessaire d'en avoir un (en plus de ma CB française) pour y vivre 4 mois ? Et est-ce facile d'ouvrir un compte en banque là-bas (je sais qu'en France c'est assez compliqué en terme de papiers à remplir, alors qu'au Canada par exemple c'est aussi facile que d'acheter un café) ?

Voilà, je suis désolée pour toutes ces questions mais je commence à un peu paniquer étant donné qu'il me reste vraiment peu de temps avant mon départ et j'ai l'impression de ne pas être prête.",2014-02-23 18:51:13
cfnd6w3,https://www.reddit.com/r/Tunisia/comments/1ymkw7/,1,"Merci beaucoup ! J'attendrai d'être à Tunis pour avoir les réponses à toutes mes questions, et je reviendrai peut-être vers toi si une autre question me viens à l'esprit d'ici là.",2014-02-24 13:52:16
cfuvdga,https://www.reddit.com/r/Tunisia/comments/1zm6dg/,1,slm 3likom,2014-03-05 10:08:47
cg4m21y,https://www.reddit.com/r/Tunisia/comments/20m72i/,1,"
iAnnonce est une agence de publicité gratuit de services dédiée à la création, la planification, et de la publicité (et parfois d'autres formes de promotion) de manutention pour ses clients
Avec   IAnnonces vous pouvez acheter ou vendre vos biens et vos services en ligne gratuitement :des immobiliers, des autos et motos, des équipements multimédias, etc. 
",2014-03-17 08:04:54
cgc8bdd,https://www.reddit.com/r/Tunisia/comments/210m3c/,1,Well imo it isn't that good in dancing but anything else was good.,2014-03-26 08:22:52
cgp2l16,https://www.reddit.com/r/Tunisia/comments/1w0x12/,1,"Joe's American Sports Bar near Lac 1 is about as close as you'll get, I'd say.",2014-04-10 17:02:15
cgqs1fj,https://www.reddit.com/r/Tunisia/comments/1rkawf/,1,"In Tunis I saw a large intersection with traffic lights that everyone just ignored, in this picture the people atleast stop.",2014-04-12 20:09:14
cgr7zu8,https://www.reddit.com/r/Tunisia/comments/22vj7u/,1,"Not as exciting as i hoped, but thank you very much!",2014-04-13 12:00:54
cgr99qy,https://www.reddit.com/r/Tunisia/comments/22vj7u/,1,what were you hoping for? some treasure map? :D,2014-04-13 13:44:52
cgsd95g,https://www.reddit.com/r/Tunisia/comments/22vj7u/,1,"Yeah, a treasure hidden somewhere in Sweden or something.. :(",2014-04-14 20:06:01
cgu51hv,https://www.reddit.com/r/Tunisia/comments/234k6h/,1,"They're both 'fast food'. After much searching I found this which is a makloub: http://therearebetterthingsahead.wordpress.com/2013/05/10/things-we-love-makloub/

And this video which is pretty close to what I remember as a Farcie: https://www.youtube.com/watch?v=vm0GsQASSQE

Maybe they are called something different ?",2014-04-16 19:08:28
cgw2xf3,https://www.reddit.com/r/Tunisia/comments/234k6h/,1,"I have never seen baguette farcie before in tunisia but I'm pretty familiar with makloub.  I'm not sure exactly what the dough is made of but I'm positive it's different from standard pizza dough you may look up lebaneese bread/dough because they are similar. If you are still interested in tunisian fast food,  you should totally try ""tunisian plate"" and ""lableby"" wich are delicious and really easy to make at home. ",2014-04-18 22:06:12
ch2hr2o,https://www.reddit.com/r/Tunisia/comments/234k6h/,1,"No it is actually called ""baguette farcie"" and it's delicious! No clue about the recipes though sorry.",2014-04-26 11:15:27
ch3gpu6,https://www.reddit.com/r/Tunisia/comments/23vv1v/,1,merci beaucoup :) 900-1000 c'est par mois? (désolé ici nous sommes payés aux 2 semaines ou à la semaine),2014-04-27 18:39:58
ci1dyuz,https://www.reddit.com/r/Tunisia/comments/25gf08/,1,He is a very cool guy.,2014-06-07 09:50:11
ci1e0uf,https://www.reddit.com/r/Tunisia/comments/22vj7u/,1,"The picture was taken in Lybia and apparently this guy is lybian probably living in Kairouan. Such a find is pretty cool actually, you just found out about a shred of someone's life that was dating from about 47 years or so.  I think it is amazing! ",2014-06-07 09:57:03
ci4rwzb,https://www.reddit.com/r/Tunisia/comments/27jhj4/,1,i'm going to be really disappointed if only the three of us come this time. ,2014-06-11 13:56:13
ci4v52y,https://www.reddit.com/r/Tunisia/comments/27jhj4/,1,mod said so,2014-06-11 16:00:57
ci4we56,https://www.reddit.com/r/Tunisia/comments/27jhj4/,1,Well can't help it if we don't have anyone interested in joining us. Perhaps some random expatriates would be happy to join? Maybe it is because I m not making any free offers this time? Lol,2014-06-11 16:43:57
ci56al4,https://www.reddit.com/r/Tunisia/comments/27jhj4/,1,Well that canbe a good idea  would you like to do it?,2014-06-11 22:10:56
ci58r35,https://www.reddit.com/r/Tunisia/comments/1wdbul/,1,Yes. Fuck.,2014-06-11 23:45:57
ci5idkd,https://www.reddit.com/r/Tunisia/comments/27jhj4/,1,[deleted],2014-06-12 07:09:02
ci5iy3t,https://www.reddit.com/r/Tunisia/comments/27jhj4/,1,[wat?](http://i.imgur.com/BHBVsbm.gif?1?2554),2014-06-12 07:58:00
ci5iykr,https://www.reddit.com/r/Tunisia/comments/27jhj4/,1,[deleted],2014-06-12 07:59:06
ci5iyv6,https://www.reddit.com/r/Tunisia/comments/27jhj4/,1,what's the concert,2014-06-12 07:59:45
ci5rh0n,https://www.reddit.com/r/Tunisia/comments/27jhj4/,1,if i can hitch a ride ill come for sure :p ,2014-06-12 16:17:52
ci5sdr6,https://www.reddit.com/r/Tunisia/comments/27jhj4/,1,"It's gonna be on the roof too, cool music, nice view. why not though.",2014-06-12 16:48:40
ci5se1g,https://www.reddit.com/r/Tunisia/comments/27jhj4/,1,[deleted],2014-06-12 16:48:56
ci5zb1i,https://www.reddit.com/r/Tunisia/comments/27jhj4/,1,done!,2014-06-12 20:35:36
ci5zhyz,https://www.reddit.com/r/Tunisia/comments/27yk73/,1,It always amazes me how great that port would have been and how things have evolved from back then to today. : http://tourisme-en-tunisie.blogone.fr/files/2012/07/Port-punique-de-Carthage.jpg,2014-06-12 20:42:12
ci6ijnj,https://www.reddit.com/r/Tunisia/comments/27z6xv/,1,"Ah, don't worry about food! We're staying with my friend's grandmother, they moved to the western world, worked their asses off, and then retired back to Tunisia and built this badass giant house so I'm pretty excited for that. He said that the grandma will cook me whatever I want, so I'm super excited to try all of her Tunisian food!

What everyone is telling me here matches up to what my friend was telling me, so that's very comforting =] ",2014-06-13 13:08:44
ci6ktqr,https://www.reddit.com/r/Tunisia/comments/27z6xv/,1,"I'm happy for you, have a nice stay and ask for ""mlokheya"".",2014-06-13 14:48:00
ci7bshi,https://www.reddit.com/r/Tunisia/comments/27jhj4/,1,"The event got cancelled unfortunately :/ , we can still go to the 716; Smug's or Cosmitto Café. Call me or send message on 96.085.431 to confirm!",2014-06-14 12:21:32
ci7bvxx,https://www.reddit.com/r/Tunisia/comments/27jhj4/,1,"The event got cancelled unfortunately :/ , we can still go to the 716; Smug's or Cosmitto Café. Call me or send message on 96.085.431 to confirm!",2014-06-14 12:29:44
ci7cm6s,https://www.reddit.com/r/Tunisia/comments/27jhj4/,1,"&gt; Alrighty! well Me and theeldorado have confirmed that we could meet up around 4:30 pm at 716, a café in LAC2. Do you think you could join us there ? :D send sms or call me on 96.085.431

Yay or nay?",2014-06-14 13:26:57
ci7cmid,https://www.reddit.com/r/Tunisia/comments/27jhj4/,1,"&gt; Alrighty! well Me and theeldorado have confirmed that we could meet up around 4:30 pm at 716, a café in LAC2. Do you think you could join us there ? :D send sms or call me on 96.085.431

Yay or nay?",2014-06-14 13:27:33
ci7cmsz,https://www.reddit.com/r/Tunisia/comments/27jhj4/,1,"&gt; Alrighty! well Me and theeldorado have confirmed that we could meet up around 4:30 pm at 716, a café in LAC2. Do you think you could join us there ? :D send sms or call me on 96.085.431

Yay or nay?",2014-06-14 13:28:09
ci7cnbp,https://www.reddit.com/r/Tunisia/comments/27jhj4/,1,Okey then am in,2014-06-14 13:29:16
ci7cs4t,https://www.reddit.com/r/Tunisia/comments/27jhj4/,1,YAY,2014-06-14 13:38:39
ci7d0dx,https://www.reddit.com/r/Tunisia/comments/27jhj4/,1,Noted! no worries! and yes GO to your job interview don't miss it! ,2014-06-14 13:54:17
ci7d3cc,https://www.reddit.com/r/Tunisia/comments/27jhj4/,1,"ok then! 4:30 pm at 716, LAC2! yay! ",2014-06-14 13:59:32
