id,url,score,body,date
ci7d67q,https://www.reddit.com/r/Tunisia/comments/284gtf/,1,"Yes I agree with you, the western world still has a lot to work on about gender equality a well. And as you said, the matter of discrimination against women lays on deep rooted ideas conveyed by tradition and religion. And there are indeed women like you who had the chance to be given as much opportunities as their male counterparts.

But what really bothers me is how tunisian people act like ""the tunisian woman"" only needs hersalf to succeed, like she is in no way treated differently that men in society.

Another thing, but it seems that it does not really bother tunisian women (I myself found this scandalous) is like women have no access to the public space. The ratio of men to women in the street in something like 5/1, and gets close to 20/1 at night. There are no equivalent of popular cafés for women, where they could socialize with other people of their community, or just CHILL like men are doing all day long. I don't no, but it frustrates me so much to see how women's lives are so different to men's lves here. I believe that in order to be considered the same way (espacially in politics), they must have the exact same opportunities about everything during their lives. 

Not saying that you cannot have a good life when you are a woman and follow the traditions, it certainly please some women. But what if you want to do something else?",2014-06-14 14:04:48
ci7dfx7,https://www.reddit.com/r/Tunisia/comments/284gtf/,1,"Isn't that actually partially due to how men are in nature? Women are actually very hard workers, they/we already have their own private places to chill, where no men are allowed, have you ever been to a women's Hammam or to a Beauty Salon, some women spend hours just chilling, talking and taking good care of themselves, then they would do plenty of shopping, go to some nice cafés to chill, meet friends etc without having any social standards to ""respect"". Women do smoke/drink freely out in the cafés. I don't think that we really NEED to have a special popular women café to prove that we are equal to men. Take this for example,  a couple who are married, they don't always spend their time together right? The guy would most likely want to spend some time watching football with other guys, the lady will most likely go to a place where she could get her hair fixed, nails done then buying a nice dress. They probably do have different preferences but I can assure you most women would not want to spend their relaxing time in a place full of smoke and rubbish talk. 

Again we could discuss this more if you would like to, we are meeting starting 4:30 pm at [716 café Lac 2](http://www.reddit.com/r/Tunisia/comments/27jhj4/reddit_global_meet_up_day_2014_it_has_been_a_year/)",2014-06-14 14:21:33
ci7drs0,https://www.reddit.com/r/Tunisia/comments/27jhj4/,1,Perfect,2014-06-14 14:41:09
ci7f2hz,https://www.reddit.com/r/Tunisia/comments/27jhj4/,1,Yer late,2014-06-14 15:47:56
ci7ge62,https://www.reddit.com/r/Tunisia/comments/27jhj4/,1,Howdy there .we are at the 716 cafe in Lac 2 if you would like to join us! ,2014-06-14 16:48:41
ci7ivhc,https://www.reddit.com/r/Tunisia/comments/284gtf/,1,We are still there if you would like to join! We are 4 at the moment!,2014-06-14 18:38:55
ci7jd12,https://www.reddit.com/r/Tunisia/comments/284gtf/,1,Well we could plan for one for sure!mmaybe in two weeks ?,2014-06-14 19:00:47
ci8tyjq,https://www.reddit.com/r/Tunisia/comments/284gtf/,1,"Reading your comment makes me think I don't belong to this country anymore :D, I think 3 months aren't enough to know how people live in our society and I am not saying that your point is totally wrong, but you can take a look at some stats about women's right in Tunisia (links will be added below cos I'm using the mobile app).
In addition, I can't find your comment suitable to the context of the posted link, the accident should have provoked a child abuse conversation here imo.",2014-06-16 12:24:38
ci8zcyy,https://www.reddit.com/r/Tunisia/comments/284gtf/,1,"I think three month living in a society is better than numbers to understand how it works. I don't pretend to understand tunisian society perfectly and to know better than other people what works how. But there is a huge amount of things I observed and heard here that I could have never heard about being abroad, and I am giving my point of view about these facts.

Also, Eya's assassination is symptomatic of a certain view of what women are in the interpretation of the Kuran that is popular in the region. She wasn't killed because she was a child but because she was a little girl and a daughter. So I do not see how it would not be appropriate to comment about women's situation in Tunisia bellow this article.",2014-06-16 16:25:43
ci9n1sp,https://www.reddit.com/r/Tunisia/comments/28bcd1/,1,"Actually I've seen one of these in a music festival, but I think it was used by the police to secure the minister of tourism when she came for the opening. I'll see if there is anything against quadcopters, especially with all these 'terrorist' acts and the security policy used by the Interior Ministry. ",2014-06-17 07:10:40
ci9yfwk,https://www.reddit.com/r/Tunisia/comments/28dvh6/,1,jaim,2014-06-17 17:30:36
ciake2u,https://www.reddit.com/r/Tunisia/comments/28dvh6/,1,k,2014-06-18 08:34:16
cid86z4,https://www.reddit.com/r/Tunisia/comments/28n4dq/,1,That's allready three of us! Should we meet before the concert starts? I think I'll go buy my ticket today.,2014-06-21 10:43:18
cidbuiv,https://www.reddit.com/r/Tunisia/comments/28n4dq/,1,"I will be buying mine tomorrow I think they will be open after noon ... I m in Sousse for the weekend , enjoying a very nice beach day ;) and yes I can be there around 5 pm or 5:30 tell me where would you like to meet. 

PS: If you would like to, we can meet at [Claridge café](https://www.facebook.com/CafeClaridge), or [Seventh  Sky](https://fr.foursquare.com/v/seventh-sky/4cf7e5fd72752c0f9ec7dcb4) it is not too far away from where the concert will be held!",2014-06-21 15:16:08
cidc7ut,https://www.reddit.com/r/Tunisia/comments/28jype/,1,"I don't think you would have any problems with that , just keep your medicine in your suitcase. Next time though always have your medical prescription with you, just in case you needed that, you run out of your medicine or had to give proof that it was medicine prescribed for you. Have a nice trip and enjoy your stay in Tunisia! ",2014-06-21 15:34:46
ciddk0j,https://www.reddit.com/r/Tunisia/comments/28q9mk/,1,"I love the video, I m glad you enjoyed your trip! Did you use the go pro cam for the footage?",2014-06-21 16:37:08
cierpxt,https://www.reddit.com/r/Tunisia/comments/28n4dq/,1,Seventh Sky? * __ * I'll try to get off early if you're going there.,2014-06-23 12:13:32
cieyg9z,https://www.reddit.com/r/Tunisia/comments/28n4dq/,1,"I can join you around 5 - 5:30 ! I bought my ticket today, they told me the doors open at 6 and the show starts at 7",2014-06-23 17:03:00
cifict1,https://www.reddit.com/r/Tunisia/comments/28n4dq/,1,Yep! I bought my ticket as well! we can meet around 5 pm at one of those places that I mentioned (Seventh Sky or Claridge Café) Have you been there before? tell me ahead if you need any directions.,2014-06-24 04:52:21
cifidqj,https://www.reddit.com/r/Tunisia/comments/28n4dq/,1,Yay! make sure to buy your ticket too!,2014-06-24 04:53:42
ciflo5v,https://www.reddit.com/r/Tunisia/comments/28n4dq/,1,"I've been to neither of them, but /u/flesmih seems to have a preference for seven sky! :)",2014-06-24 08:43:21
cigo0u6,https://www.reddit.com/r/Tunisia/comments/28n4dq/,1,(also /u/Enti_San ) I'll be at seventh sky around 5:15. I'm easy to spot : I have blond hair and will be wearing a light blue dress.,2014-06-25 14:05:34
cikr4pz,https://www.reddit.com/r/Tunisia/comments/29c6ah/,1,"Well you don't have to speak Arabic, French will be enough. And by the way I really hope it doesn't start during Ramadan because you surely gonna struggle with the service and food...

I don't really know Sfax as a city but if you're staying in a hotel it could be better, and you can go to [Sousse](https://www.google.com/maps/dir/Sfax,+Tunisia/Sousse,+Tunisia/@35.2794881,10.1102854,9z/data=!3m1!4b1!4m13!4m12!1m5!1m1!1s0x13002cda1486c695:0x22dfe0a62c50ce6f!2m2!1d10.7666667!2d34.7333333!1m5!1m1!1s0x130275759ac9d10d:0x698e3915682cef7d!2m2!1d10.608395!2d35.825603) or [Hammamet](https://www.google.com/maps/dir/Sfax,+Tunisia/Hammamet,+Tunisia/@35.5696179,9.8515186,9z/data=!3m1!4b1!4m13!4m12!1m5!1m1!1s0x13002cda1486c695:0x22dfe0a62c50ce6f!2m2!1d10.7666667!2d34.7333333!1m5!1m1!1s0x12fd61fc0dac1583:0x8f1c841291df5ff!2m2!1d10.6166667!2d36.4) during weekends, cool places to be and lots of tourists especially in Hammamet and Sousse. Could be a good destinations if you want to enjoy clubbing etc... In this case if you want to call an Agency you better contact [Traveltodo](http://www.traveltodo.com/) because it is the best one in my opinion.

And don't forget to get yourself an [internet connection](http://www.orange.tn/promotions/pid840-promotion-cl-3g-pr-pay-bonus.html) of course, you're gonna need that if you're coming alone.

Feel free to ask any question if you made up your mind.",2014-06-30 11:48:12
cin0wpk,https://www.reddit.com/r/Tunisia/comments/29oji7/,1," i happy that you enjoyed your stay in our beloved country

i wish that you visit us again , next time you could visit hammamet ,djerba or douz",2014-07-02 22:28:19
cioh819,https://www.reddit.com/r/Tunisia/comments/29rc99/,1,"I will give it a try, thanks for the link.",2014-07-04 16:17:29
cipw3c5,https://www.reddit.com/r/Tunisia/comments/29yyrf/,1,thank god i'm not a smoker,2014-07-06 16:09:46
ciqba3z,https://www.reddit.com/r/Tunisia/comments/2a0co3/,1,[deleted],2014-07-07 02:27:39
cixeu9m,https://www.reddit.com/r/Tunisia/comments/27z6xv/,1,"I don't blame you or your upbringing but the media for stereotyping us to these crazies or terrorists and rarely ever show the normal people, i assure most Muslims are peaceful as it can be , just avoid the fanatics or radicals who want to impose their opinions everywhere and you can spot them a mile away.

Tunisia has so many options for tourism and it will be a pleasant plentiful trip once you get past your irrational fears, i just hope your friend knows what hes doing , good luck.",2014-07-14 21:21:01
ciyyh8y,https://www.reddit.com/r/Tunisia/comments/2am6l4/,1,How about a breaking-fast meetup since it's Ramadan?,2014-07-16 13:20:21
ciz5gue,https://www.reddit.com/r/Tunisia/comments/2am6l4/,1,"that'll be cool 
post a thread in the subreddit ",2014-07-16 17:18:09
cizv4j3,https://www.reddit.com/r/Tunisia/comments/2axtkr/,1,Read some tweets about people celebrating last night. Which is what the fuck!,2014-07-17 11:12:43
cj08crm,https://www.reddit.com/r/Tunisia/comments/2axtkr/,1,well this is bad ,2014-07-17 19:29:08
cj0hmqq,https://www.reddit.com/r/Tunisia/comments/2awyd6/,1,Why?,2014-07-18 00:40:18
cj0souk,https://www.reddit.com/r/Tunisia/comments/2axtkr/,1,Celebrating what ? why ? links ?,2014-07-18 10:28:05
cj0tqtx,https://www.reddit.com/r/Tunisia/comments/2axtkr/,1,"http://www.africanmanager.com/169218.html

Edit: source isn't 100% reliable though. A cousin from Bizert told me nothing happened as it's spread.",2014-07-18 11:54:15
cj10np5,https://www.reddit.com/r/Tunisia/comments/2b23g0/,1,?????,2014-07-18 16:34:49
cj14edh,https://www.reddit.com/r/Tunisia/comments/2b23g0/,1,What is it? I can't see the video on mobile. Can youpost a mirror link if possible please?,2014-07-18 18:32:26
cj1mo6c,https://www.reddit.com/r/Tunisia/comments/2am6l4/,1,"Hello there Mimo,

Our community is slowly growing but we have a bunch of Tunisian regulars who visit the subreddit frequently. If you would like to suggest another meeting, you are welcome to!",2014-07-19 06:52:32
cj1pwco,https://www.reddit.com/r/Tunisia/comments/2b4fvs/,1,"First things to do is to report that page, this is now the new trend for terrorist ...using social media for publicity to their murders...",2014-07-19 11:37:02
cj1q2lv,https://www.reddit.com/r/Tunisia/comments/2b4fvs/,1,That page was created a week ago (July 11th),2014-07-19 11:53:47
cj2chsa,https://www.reddit.com/r/Tunisia/comments/2aut1b/,1,"And now, it is easier for them (we all know who) to track us..",2014-07-20 05:05:32
cj2gauu,https://www.reddit.com/r/Tunisia/comments/2b4fvs/,1,"Yep, hope they would, I reported the page, it didn't get removed unfortunately. I hope other people do.",2014-07-20 09:27:10
cj2gqxg,https://www.reddit.com/r/Tunisia/comments/2b4fvs/,1,"They have an agreement with Facebook to hand out terrorist page admins or something like that, so Even if TT doesn't deliver I'm sure Facebook can.",2014-07-20 10:13:33
cj2hkya,https://www.reddit.com/r/Tunisia/comments/2b00ug/,1,"A group of highschoolers found a ""Hummer"" and they will use it to resist/fight zombies. So the dude mentioned Tunisia when he saw it, maybe referring to some pics like [this](http://graphics8.nytimes.com/images/2011/02/14/world/14reconstruct-timeline/14reconstruct-timeline-custom1.jpg) ?",2014-07-20 11:40:52
cj3uqtb,https://www.reddit.com/r/Tunisia/comments/2b8khv/,1,sorry about that  ,2014-07-21 22:27:44
cj3v93f,https://www.reddit.com/r/Tunisia/comments/2b8khv/,1,it s ok :) just try to avoid those comments from now on.,2014-07-21 22:44:33
cj4asvx,https://www.reddit.com/r/Tunisia/comments/2b8khv/,1,"Thank you! I'm actually here to work. I have an internship teaching english. I will be going to Tunis this weekend if you have any suggestions! (Besides Sidi Bousaid, which is GORGEOUS!)
",2014-07-22 09:30:50
cj5tixh,https://www.reddit.com/r/Tunisia/comments/2bhrc0/,1,Any explanation about this? Looks like a troll of a website/action.,2014-07-23 20:44:49
cj8jcr2,https://www.reddit.com/r/Tunisia/comments/2bslha/,1,"Sorry bro. You're a couple years late. The bitcoin fad ended ages ago. You can't really trust crypto-currencies if they aren't really cryptic. A security breach caused the bankruptcy of the most famous bitcoin exchange (mtgox) last year and after hearing about about the hundreds of thousands of unprocessed refund requests, I can confidently say that crypto-currencies have no future.
",2014-07-26 19:26:26
cj8s9nn,https://www.reddit.com/r/Tunisia/comments/2bslha/,1,"It's a VERY, VERY high risk investment, there are far safer and better things to invest in.",2014-07-27 01:26:38
cj9fvng,https://www.reddit.com/r/Tunisia/comments/2bslha/,1,"Added to the fact that BitCoin is an opensource protocol so anyone can look and find fixes and tweaks, and that the protocol version is still in beta version (0.86 currently, not even 1) 
",2014-07-27 21:39:34
cj9lr0b,https://www.reddit.com/r/Tunisia/comments/27z6xv/,1,"It was actually a great trip! I just wrote a long message to someone who asked me about it, but I really had a blast.

I'm glad I went with my friend and stayed with his family though, I don't think I would have felt so comfortable if I was there on my own. I'm an American and my friend is half Tunisian (but can pass as full Tunisian) + everyone else we were hanging out with was Tunisian so.. I really stuck out like a sore thumb. If I was by myself I think I would have had problems, but because I was 1) with other men and 2) with people who look like they belong in Tunisia only one person ever gave me a hard time.

But the people were so great, the food was delicious, and the beaches were beautiful. It was a lot of fun to experience a culture so different from my own, and I plan on going back to Tunisia with my friend next year :)

Despite my irrational fear, I've always believed that people everywhere were mostly normal. Going to Tunisia definitely confirmed that for me. No one harassed me because of how I was dressed (well one guy, but he was a dick), no one tried to kidnap or rape me, no one tried to recruit me to some crazy extremist cult, or any of the other 1,001 terrible things the media told me would happen. I went, I had a lovely trip, met some great people, and ate delicious food :)

10/10, would definitely go again!",2014-07-28 01:22:35
cj9stzg,https://www.reddit.com/r/Tunisia/comments/2bslha/,1,"Based on what economic theory does a currency increase in value, just because it is used somewhat more frequently or by a larger number of people?

If you want to profit from a rise in popularity, you have to invest in a company that does something Bitcoin-related - mining is probably a bad choice, so something else - or start one yourself. Simply buying some Bitcoin is not gonna do the trick, I would not expect more than the rate of inflation in fiat terms there.",2014-07-28 06:07:04
cja9g2c,https://www.reddit.com/r/Tunisia/comments/2bslha/,1,"I do not claim to be an expert in economics, neither did I study economics in high school. But I look up internet for information and that's my main source.

One of the factors for a currency increase in value is the network used by it. Now let's take the example of Facebook. Imagine if there were only 3 users connecting to it, how much value will those people give it ? Practically none, because it is hard to convince more people to join etc.. It reminds me of Google+ and how little users use it (it has grown mostly because Google is forcing people to use it (by welding Youtube accounts with Google+ for example)
Now that's the same for BitCoin. The Bitcoin was practically valueless in the beginning, valuing some $0.1 at most. But since more people joined, and more services were accepting bitcoins, more people gave it value and had faith in it therefore joined. And it is reflecting on the exchange rate now (1BTC~594USD)

And that is without taking account all the other benefits of BitCoin, whether it is speed of transactions, the anonymity, the decentralization etc..

BitCoin is no different than fiat currency in the sense that one is digital, the other is analog. For those who say bitcoins cannot be backed by gold, how is that true ? I can right now purchase some gold with my bitcoins and keep it in a safe then sell it whenever I like.

(If I have made mistakes, please correct me, as I am learning too :) )",2014-07-28 19:12:00
cjaenuz,https://www.reddit.com/r/Tunisia/comments/2bslha/,1,"I don't think you can base the price increase of Bitcoin, over that time, on fundamentals.

The network is certainly one factor for a ""small"" currency, but after a certain point, the effect of this on value levels off. I think Bitcoin might already be past that point.

Think about this: There is no reason why it wouldn't be possible to have 10x, 100x, or a 1000x of the current activity in BitCoin, while still having the same exchange rate to the Dollar. (Or even a lower rate to the Dollar, actually.) 1 BTC just needs to be ""flipped"" more often, for that to happen. An increase in adoption, at this point, doesn't have to lead to an increase in price anymore.",2014-07-28 21:48:55
cjafk3x,https://www.reddit.com/r/Tunisia/comments/2bslha/,1,"An increase in adoption may not lead to an increase in price but leads to more activity and more diversified services available. An increase in adoption also ""smooths"" out the market and makes it more stable to be efficiently used as not just a payment service but a currency as a whole.",2014-07-28 22:17:56
cjagz0z,https://www.reddit.com/r/Tunisia/comments/2bslha/,1,"Yes, so... if you believe in that, invest in something that makes use of BitCoin - but not BitCoin itself.",2014-07-28 23:04:49
cjah51g,https://www.reddit.com/r/Tunisia/comments/2bslha/,1,"That is what I am trying to achieve. It is quite challenging to introduce a new currency although I can see a benefit in the use of BitCoin in Tunisia.
We need to convince small business to accept BitCoin payments. With a word-of-mouth, we will draw more enthusiasts of the currency.",2014-07-28 23:10:32
cjahcxc,https://www.reddit.com/r/Tunisia/comments/2bslha/,1,"To make small businesses accept BitCoin, you need to create (or promote) a payment solution that makes it easier for them. Them setting up wallets, just because BitCoin is somewhat popular, is probably not the way it's going to work.",2014-07-28 23:18:15
cjahozc,https://www.reddit.com/r/Tunisia/comments/2bslha/,1,The problem is that there are no local traders buying/selling bitcoins. Overseas it's easier because there are ATMs and banks accepting bitcoin trades. Business can use BitPay to convert in fiat money easily for example.,2014-07-28 23:29:57
cjdaicq,https://www.reddit.com/r/Tunisia/comments/2b8khv/,1,[deleted],2014-07-31 19:38:44
cjh6brn,https://www.reddit.com/r/Tunisia/comments/2cjld9/,1,"I live in djerba , a very touristic island, there have been no terrorist attacks here ,it´s a very peaceful place and tourists usually enjoy their stay. To be honest there are talks of guns going around town but i have seen none and our counter-terrorist division are doing their job well. I've seen them make arrests and they are very serious about their jobs so no wrries there. Here in djerba we have many Libian refugees who mostly come here for cure because of the lack of good hospitals in libia for the time being ( source : parents are doctors here ) sonthey are not dangerous,  just reckless drivers. Your only concern is that ,if you want to enjoy the culture , most hotels are shit at it and eating out is much better and more othentic than their food. ",2014-08-05 02:33:50
cjh6lvl,https://www.reddit.com/r/Tunisia/comments/2cjld9/,1,"A related enough question so I figured making my own thread was useless.

I'm currently in Algeria and was hoping to take a taxi across the border and eventually get to Hammamet, but my family here is saying that it isn't safe. I'm sure the cities are fine, but is travel by car across the Algerian border okay?",2014-08-05 02:43:28
cjhza7m,https://www.reddit.com/r/Tunisia/comments/2cjld9/,1,"yeah tunisia is going through some trouble near the border
some terrorist attacked the army and the the interior ministers house months ago and since then the police and the army have stepped up their operations and managed to apprehend hundreds of them and killed some too and so far it looks all clear.
As for the troubled areas they are limited in the midwest in Kasserine and Kaff
and some in jendouba but the northern and coastal areas are all good and there is no issue at all.
and as an advice for you if you are going to vist is september then Hammamet sousse and jerba are great places to go and explore and generally have fun.",2014-08-05 22:49:06
cjk48jh,https://www.reddit.com/r/Tunisia/comments/2cvy8v/,1,"The only significant event that took place in 1967 was the six day war between the arabs and israel. Tunisia's involvement was peripheral and as far as i know, troops were never deployed. The arabs lost the war and that marked the decline of arab nationalism which habib bourguiba had heavily opposed even before hand. ",2014-08-08 01:49:39
cjk49ul,https://www.reddit.com/r/Tunisia/comments/2cvy8v/,1,"http://en.wikipedia.org/wiki/Six-Day_War

http://en.wikipedia.org/wiki/Arab_League

http://en.wikipedia.org/wiki/Foreign_relations_of_Tunisia

I hope these links give you more perspective.",2014-08-08 01:50:56
cjlgpjb,https://www.reddit.com/r/Tunisia/comments/2cjld9/,1,"As of today it's very safe to go to Tunisia, Tourist zones are very secure. So far all the terrorist attacks happened in the borders with Algeria, and it's all against the military force.",2014-08-09 15:49:44
cjpiv9w,https://www.reddit.com/r/Tunisia/comments/2bslha/,1,Bt cost a lot ...,2014-08-13 23:12:02
cjpwek8,https://www.reddit.com/r/Tunisia/comments/2dgzym/,1,"Hey,
I would recommend you to contact the U.S Embassy in Tunis, they are active in Tunisia (Hosting seminars, social events, scholarships/business opportunities...) I'm pretty sure they will guide you through anything you want to do.

And for English teaching, I would also recommend you Bourguiba School.",2014-08-14 09:35:37
cjqxc1v,https://www.reddit.com/r/Tunisia/comments/2cjld9/,1,"Tunisia is very peaceful.
Source: http://www.visionofhumanity.org/#page/indexes/global-peace-index/2014

Even going back to the years of the revolt in 2011, Tunisia compares better to southern European countries than to the rest of the African/Arab-speaking world.",2014-08-15 12:11:57
cjr1vx8,https://www.reddit.com/r/Tunisia/comments/2djbyx/,1,may I ask where you from? :),2014-08-15 15:27:12
cju8686,https://www.reddit.com/r/Tunisia/comments/2cnio8/,1,Thanks for the advice!,2014-08-19 03:14:23
cjufpr4,https://www.reddit.com/r/Tunisia/comments/2dhcpt/,1,tortillas is mlewy here  i never ate actual tortillas but from the pic they look the same. They're pretty common just ask for an empty one. I never saw guacamole in tunisia but you can sometimes find avocados in carrefour and such. Rice and beans are common too.,2014-08-19 10:36:11
cjzfcxv,https://www.reddit.com/r/Tunisia/comments/2egxde/,1,"I'm so sorry, a friend told me about it today's morning and it's the second day of that event...

I wish I knew about this sooner!",2014-08-24 21:50:48
cjzg0fe,https://www.reddit.com/r/Tunisia/comments/2egxde/,1,I think it's gonna be next year :/,2014-08-24 22:14:17
ck0rnca,https://www.reddit.com/r/Tunisia/comments/2ek4r5/,1,I'm in.,2014-08-26 09:38:18
ck0txky,https://www.reddit.com/r/Tunisia/comments/2ek4r5/,1,"I knew about [r/MURICA](http://www.reddit.com/r/MURICA) before but [r/canadia](http://www.reddit.com/r/canadia) , [r/rance](http://www.reddit.com/r/rance) ...
and why is Thailand circlejerks [r/5555555](http://www.reddit.com/r/5555555)

I have a lot of mysteries to solve, and catching up to do",2014-08-26 12:38:46
ck2w3ul,https://www.reddit.com/r/Tunisia/comments/2ek4r5/,1,[deleted],2014-08-28 16:12:00
