id,url,score,body,date
cpiqw09,https://www.reddit.com/r/Tunisia/comments/2zgmfg/,12,"we were supposed to go to the museum today (to study how to display exibits in our desing class), but i woke up late we decided to do it tomorrow , lazyness saved me from this , my heart goes out to all who were effected by this , i hope they dont trash the museum ",2015-03-18 13:56:58
csjbomy,https://www.reddit.com/r/Tunisia/comments/3b6lrq/,12,"My legs are shaking, I just got back from Tunisia with my girlfriend, we were in the same town (Port el Kantaoui), we walked the same beach. What the fuck is happening here",2015-06-26 12:32:15
csjbt11,https://www.reddit.com/r/Tunisia/comments/3b6lrq/,11,"This country can't catch a breath, so sad.",2015-06-26 12:37:32
cs5kymy,https://www.reddit.com/r/Tunisia/comments/39preu/,8,"[More pictures!](http://imgur.com/a/bj67S#0)

I want to think everyone who came today.  I had a fantastic time and stay tuned to an announcement soon about future (possible) meetups.

I was hoping a few more people would be able to make it out but I know sometimes things don't work out.  Everyone who came signed our table sign too but it's late and i'm tired and I have a meeting in 45 minutes.  So, that will be posted in the morning.

Thanks again for everyone who showed.  The night was great.  I suddenly have so many more friends.  I only wish we could have finished watching the movie there :(",2015-06-13 21:15:03
csjbrbw,https://www.reddit.com/r/Tunisia/comments/3b6lrq/,8,"Called being stuck between two shit countries.  Tunisia is the lone country out of the entire revolution that was able to keep its shit from falling apart completely and that means Daesh has had no success in setting up camp here.  They've recruited from here but had little to no success in taking over and moving in.

They're trying but they're about to fuck up.  Tunisia and the US just had talks and contracts signed that aligned the two countries and the talks went VERY well.  Kerry has been here a couple times just in the past year.",2015-06-26 12:35:32
csjc1gz,https://www.reddit.com/r/Tunisia/comments/3b6lrq/,8,"It won't. We've been there, we'll gather our shit up. Thanks for the kind words buddy. ",2015-06-26 12:47:12
cpm8ume,https://www.reddit.com/r/Tunisia/comments/2zr78y/,7,"I think the terrorists misjudged this country.  This isn't a weak country.  It will not only rebound from this, it will be stronger and strengthen the resolve to fight the ISIS cowards even more.  Tunisia is an amazing country and if you hit it, it will hit back.  This is a country loved by England, France, the US, Germany, it's a tourist destination for all of Europe.

The attacks by ISIS may affect the tourism in the short term (maybe not), but what it won't affect is the power of the people here.  I am from the US and moved here in July and all the time I'm finding beautiful things about this country.  The culture, the people, the food, the scenery, and the history.

Tunisians will stay strong and though I am not Tunisian by birth, I feel I've become one by adoption.",2015-03-21 19:24:04
cr0968r,https://www.reddit.com/r/Tunisia/comments/34vf9k/,6,"I am/was in poor health.  I'm much better now, still not great.  Sometimes when flying you can form blood clots.  Well, I formed one in the main artery to my lungs.  On top of it, I got bronchitis.  Me being a Male and stupid, I ignored the first warning signs of being constantly fatigued and short of breath to just having traveled such a long freakin' distance.

It got worse and worse until I was in the shower and nearly passed out.  I was coughing up stuff already but I nearly went down in the shower.  I crawl out, barely make it to the bed and my then fiance starts freaking out as I got no color to my face and looked dazed.  I honest to God thought I was dying.  I had that thought running through my head as I felt the life quickly fade as I started to slump over.  The only thing I thought of ""Just look at her face, you're dying, make that the last thing you see"" over and over.  Some reason, I didn't quite pass out.  She called an ambulance and it took nearly an hour to get me to it as I'd take 3 steps and need to sit down.  Diagnosed with severe bronchitis and blocked artery so what little blood WAS getting to my lungs, wasn't getting oxygenated because there was so much fluid in my lungs it was horrible.

After 5 days in the hospital I finally check out.  I was getting better and would cough up whole mouth fulls of water.  Like, it wasn't mucus I would cough and blech full of water.  So they put me on some blood thinners to help with the clot.  Again, very big guy, not much they could do here as they aren't equipped for fat people.  Well, I was shedding weight as I was barely eating and losing weight fast. The blood thinner was being absorbed into my fat and not into my system as much.  After being home a few days I started feeling very sick.  Come to find out as I'm losing lots of weight (fat) the medicine was being released into my system in gigantic doses.  I started pissing blood and rushed to the hospital again.  There I started puking up straight blood.  They were having to do transfusions from the get go.  I was in the ICU and my previous doctor busts through the door at full sprint because he saw my blood clotting numbers and said it was the lowest he'd seen in 30 years of medicine and by all account, should be bleeding out of every hole and through my skin.  

Things got better though and I'm down about 140 pounds.  I was doing well but gained some back as I got out more I could find stores with shitty food again.  I'm back on track however and lost probably 10 pounds or so in the past week+.

It was incredible the amount of shit I had to go through right as I got here and the amount of shit I put her through.  I was so bad, maybe TMI so be warned and stop reading here, that I couldn't shit alone.  I had to have her wipe and shower me when needed and hold a jug for me to piss in.  Even at 3am I'd have to wake her up from a dead sleep to go get the jug and help me pee.

I wifed her up the SECOND I could.",2015-05-06 14:52:00
csjc264,https://www.reddit.com/r/Tunisia/comments/3b6lrq/,6,"I'm American living here but I've been here nearly a year.  This feels like my Home though.  I think it will have an impact which sucks because this is a GREAT country.  When i got here I was in awe of some of the great views here but honestly, the greatest resource of this Country is the people.

I was scared as hell coming here as an American as we're not liked in most countries, especially Arab countries but I've had nothing but warm greetings and well wishes.  Taxi drivers who are happy to see an American to people who speak English happy to be able to have someone to practice with.  A local shop owner has even learned some English because I go in there at least once a day and he can greet me in English and I can say some stuff in English and he understands.

And God help you if you get a Taxi driver who speaks English.  They'll want to know all about you and just want to converse the ENTIRE ride lol.",2015-06-26 12:48:00
cthnb2l,https://www.reddit.com/r/Tunisia/comments/3er3yd/,6,"Just my 2-cents as a non-Tunisian who knows many Tunisians. I have the Impression that many Tunisians have been rather disconnected to the religion under the French/Bourgheba/Ben Ali and now a strong trend towards religiousness makes the young and jobless easy Targets for demagogism and ""pied pipers"".

On the other Hand: dw.de is campaign journalism at best...",2015-07-27 11:38:52
cx17hto,https://www.reddit.com/r/Tunisia/comments/3sw42s/,6,"I've been in Tunisia as a tourist recently. Don't worry about terrorism, the traffic is way more dangerous. ;) I felt safe (I've been in Tunis, Monastir and Sousse).",2015-11-15 19:53:39
cpf80b3,https://www.reddit.com/r/Tunisia/comments/2z1fie/,5,"Well, as a network engineer, there are many reasons and it's kinda complex:
First of all, bad phone cables and bad installations. Generally these cables are hanged by poles and they are directly esposed to heat in summer and cold in winter. As a result, the electric signal gets jammed and the internet speed gets slower. This phenomenon is called micro-cuts (Web pages / Videos can't fully load)

Second fact : Network saturation, generally it's hard/impossible to get a good internet connexion in crowded places which has many internet subscribers. Sadly, Tunisie Telecom knows about that but can't figure out a great solution  to this issue because the network itself isn't evolutive and can't handle this growth and (of course) they don't want to pay for a new installation.

Third reason, ISPs : Well it depends from the location too. In my area, Globalnet are the best.

So long story short, internet works perfectly in enterprise / fancy zones like northern suburbs in Tunis (major access networks uses fiber there) but in most rural/popular places it sucks hard (old/bad networks)

I know what you're dealing with man, I had this issue before and I switched to mobile 3G for a time .Try to call your ISP and complain about it. They will call Tunisie Telecom to check the line's signal and try to fix it. If the problem is still there, terminate your contract and switch to another ISP.

Feel free to PM me if you have any questions, cheers ;)",2015-03-15 02:24:37
crd2jwo,https://www.reddit.com/r/Tunisia/comments/36cvxb/,5,"Some advice from a fellow visitor who was there in the spring... If you stick to the tourists area just be yourself, it's all good. If you're going to visit the desert or cities that are away from the regular tourists stuff, don't show too much skin... A t-shirt is fine, but your GF shouldn't be walking around in a bikini top. Also, kissing and holding hands in public outside of tourists areas may not be well received by some.

Also, don't call it ""Arab culture""... Tunisia has it's own culture and history, and they may speak Arabic, but it's mixed with French and Berber... Maybe read a bit about the country before you visit it, it will help you appreciate it even more!",2015-05-18 16:35:45
crjb59x,https://www.reddit.com/r/Tunisia/comments/36vgpf/,5,"cool idea. 
there is this new geek-themed café [Mokayshi Spirit](https://www.facebook.com/pages/Mokayshi-Spirit/1389135698082431) (and when I say 'geek' I mean the owners are truly into geek culture, not just as a marketing strategy) and [this page](https://www.facebook.com/TFCommunityPage) . 
They are most likely on reddit also.
So I don't know how you see it, but maybe if you contact them they could gather more people and/or suggest activities and a more adequate place for the meetup.
Cultural/Historic/excursion-type places would have been interesting, but some of them are a pain to reach (especially for students) and to be realistic, you'd have nowhere to play board games in there :D ",2015-05-24 13:54:47
cs5puwl,https://www.reddit.com/r/Tunisia/comments/39preu/,5,now it is late to join us .,2015-06-14 00:10:53
cs61arj,https://www.reddit.com/r/Tunisia/comments/39preu/,5,Thank You.  I am the Dude.,2015-06-14 09:11:36
csjbyx1,https://www.reddit.com/r/Tunisia/comments/3b6lrq/,5,"I'm so sorry for you guys. I have no words, seriously. I got to like you guys so much, I really hoped that Tunisia recovers soon from the March attack, I heard how much it meant to the average Tunisian that tourists disappeared and how hard you have been trying to reinvite people to your country. I really hope that this attack will not bring Tunisia and Tunisians to their knees. ",2015-06-26 12:44:23
cskbvq1,https://www.reddit.com/r/Tunisia/comments/34vf9k/,5,well its happened ,2015-06-27 07:49:17
cun023h,https://www.reddit.com/r/Tunisia/comments/3j7o1r/,5,"Masta means ""not funny"" when referring to a joke.

When referring to food it means ""tasteless"".

Also this is the feminine form. The masculine form is ""Maset"".",2015-09-01 14:18:47
cy5jd8l,https://www.reddit.com/r/Tunisia/comments/3xglfj/,5,"Easy. ""Tourist Attractions""",2015-12-20 15:54:22
cy61u7p,https://www.reddit.com/r/Tunisia/comments/3xma59/,5,"I think those are orange fruits, IIRC this is in Nabel which is famous for orange trees
",2015-12-21 00:37:09
cnie99p,https://www.reddit.com/r/Tunisia/comments/2rqb92/,4, med amine,2015-01-08 15:03:12
cohurqz,https://www.reddit.com/r/Tunisia/comments/2vbmra/,4,**until further notice,2015-02-11 04:54:08
cp6oedb,https://www.reddit.com/r/Tunisia/comments/2y6bb0/,4,"* the payment is low but that's what you'd expect from an internship and probably wont be enough for rent depending on where you'll be staying
* foreigners are treated well, and as for the mindset of the people, we're open minded and have a really rich and beautiful culture
* tunisia is a whole other country in the summer, it got all sorts of activities that you can do mainly because tunisia is a tourists destination
* there's no need for vaccination.  We don't bite. But repellant for mosquitos is highly recommended. They don't carry any diseases but are really annoying, ",2015-03-06 21:53:19
cpiqpp6,https://www.reddit.com/r/Tunisia/comments/2zgmfg/,4,[deleted],2015-03-18 13:50:43
cpjhvp6,https://www.reddit.com/r/Tunisia/comments/2zj00b/,4,"First, congratulations!  As an American now married to a Tunisian woman, I gotta say I approve =).

1.) I'm not aware of any customs or traditions but have heard that typical Tunisian women date to get married.  Even some of the more progressive ones.  My wife dated 1 guy for 2 months before me.  Her sister dated a few guys very quickly before finally dating one for a year and married him.  Since it is conservative, public displays of affection are rare here.  They happen but not typical.  I'm married and we still rarely do much more than holding hands in public.  We will sit close to each other and kinda be flirty and such but no kissing or anything like that.

2.) I think for this, let her dictate the trip.  I mean, she has the home court advantage right?  One place I'd highly recommend is the ruins of Carthage.  Absolutely beautiful scenery there and you will learn a lot.

3.) If you buy stuff from street vendors like collectibles or really anything, negotiate prices.  It's pretty much a national sport here to haggle over prices.  Also, be aware, they may say ""Oh want to take a picture with a monkey? 2 Dinar"" then you snap a few pictures ""Oh that's 10 dinar"".  So, be careful about that.

Try the local cuisine as much as you can.  A lot of it is spicy as all damnation but it's delicious.  If you meet her parents, she has intentions =)  Another place to check out is Sidi Bou Said.  If you're over that way there is a place called Cooks that has some great food.  It's not Tunisian but still good.  

Prepare for wind.  Seriously, I live in lac 2 and this place has wind like I've never seen.  I've seen stronger winds (I grew up in Hurricane territory in the US) but day in and day out it's just... wind.  Strong winds.  If it's raining, typically, just wait 5 minutes and there will be sun.  But do whatever you need to do because in 5 minutes that could change again.

Due to recent events, be vigilant about your surroundings and let your embassy know where you will be staying and register with them for email alerts and phone numbers.  If up for a double date with some other Redditors, let me know.

Mind if I ask your nationality?",2015-03-19 02:40:46
crj866p,https://www.reddit.com/r/Tunisia/comments/36vgpf/,4,"uni student , so not mush money , just anything in the capital and am in ",2015-05-24 10:45:13
crjcz2w,https://www.reddit.com/r/Tunisia/comments/36vgpf/,4,I'm in too,2015-05-24 15:06:23
crzbj6z,https://www.reddit.com/r/Tunisia/comments/38y6nm/,4,"They had 3 the first one, 4 the second, i'm trying to get more than those combined as it's my first one here.  I've been in charge of some meetups when I lived in the states and we started the first one with like 8 but last one I helped plan in the US was about 17.  I think more than 30 attend it now.

Granted, they had about 1000% more readers than we have here.  So if we really get about 10-11, that's pretty fantastic.",2015-06-08 10:58:55
cs856p6,https://www.reddit.com/r/Tunisia/comments/39preu/,4,"Saturday is Shabbos the Jewish day of rest. That means that I don't work, I don't drive a car, I don't fucking ride in a car, I don't handle money, I don't turn on the oven, and I sure as shit don't fucking roll!",2015-06-16 07:14:14
csjbno4,https://www.reddit.com/r/Tunisia/comments/3b6lrq/,4,http://www.bbc.com/news/world-africa-33287978,2015-06-26 12:31:02
ct208sn,https://www.reddit.com/r/Tunisia/comments/3d5mw6/,4,"Well cops have been beating up Tunisians for years, kids women, whatever, and on daily basis, why do Algerians have to be so special? i don't get it, its just a normal day in Tunisia i guess, or wait a sec, we do look like each other a lot, maybe they mistaken him for a Tunisian? yeah i think this is what happened, because they know they only hit Tunisians, [o wait they just beat up an ambassador in front of his 6 year old kid,](http://kapitalis.com/tunisie/2015/07/11/diplomate-senegalais-agresse-la-tunisie-parle-dun-cas-isole/) well i guess i dont know what to say buddy, it seems a normal Tunisian day to me, you will get used to it too i guess :)",2015-07-13 18:57:44
cti2z1y,https://www.reddit.com/r/Tunisia/comments/3er3yd/,4,"A few elements to take into consideration:

* In Tunisia, as in many places around the world, there's a good proportion of people who see and hate the way some countries police the world. These people would very much like to change that. Some opted for ideologies like communism or nationalism to help stick it to the imperialist oppressors.

* After the Iranian Islamic revolution, some Tunisians came to the conclusion that Islam can in fact be a way to fight western hegemony and repeated humiliations.

* The Ben Ali and Bourguiba regimes fought the spread of Islamist ideologies as they constituted a political threat. They fought the teachings of the Maliki school of Islamic thought which for centuries was the main religious sect. Pushing it out of the scene meant that people had to find somewhere else to get their religious ideals.

* Golf countries put ridiculous amounts of money into spreading their view of Sunni Islam: As-Salafiyyah, AKA Al-Wahhabiyya by its detractors. Their main way of spreading it being the satellite channels which where hard to censor. This started during the Ben Ali regime.

* Come the revolution, people thought they are now free to practice their religion. During the Ben Ali regime everyone remotely religious was a suspect. I'm talking they find a Qur'an at your house you're screwed. Head scarves where prohibited, beards were too etc. You could get arrested if you go to the mosque too much.

* A new idea was starting to take root. Why not create an Islamic state with real Sharia as its constitution and law. This wasn't going to happen in Tunisia. The constituent assembly drafted a civil constitution which wasn't good enough for those who want to create the Islamic state AKA the Khilafa.

* Meanwhile the war rages on in Syria. And it started to take deeper, more sectarian aspects to it. There's one thing that the Salafiyya hate more than the oppressors: the Shias. And with the correct indoctrination, the blood of sunnis in far away Tunisia could be made to boil in rage.

* Unemployment and corruption made many young men lose any hope in Tunisia. They are better dead in the fighting than alive here.

* Also worth mentioning: most young people whom I've known and who had radical thought weren't even religious before the revolution. Quite the opposite actually. [This guy](https://www.facebook.com/emino.0fficiel) was actually a rapper before leaving for Syria a few months ago. 

* Also, ISIS has many engineers or engineering students in its ranks. These people are generally the more religious students in my country.

* Final point (I don't know if this is a factor): ISIS pays well.

TL;DR: Old regime doesn't allow you to practice religion, doesn't let people teach you religion, you find extremists on TV who teach you religion, you are poor and jobless which makes you lose all hope of your country, you hate the western oppressors who humiliate you, recruiters keep talking to you about the glorious days of the Islamic Khilafa when Muslims were never humilated, you decide to go ( and maybe get paid handsomely).

**EDIT: formatting**",2015-07-27 19:11:36
cuojc65,https://www.reddit.com/r/Tunisia/comments/3japgl/,4,On dirait hamadi jebali..,2015-09-02 20:31:01
cvtnlvx,https://www.reddit.com/r/Tunisia/comments/3o2wa4/,4,This is so cool.  Congratulations Tunisia!,2015-10-09 13:31:24
cnirwxd,https://www.reddit.com/r/Tunisia/comments/2rqb92/,3,Hamadi Ben Ali.,2015-01-08 21:24:26
coh67ad,https://www.reddit.com/r/Tunisia/comments/2vbmra/,3,*sorta free,2015-02-10 17:14:29
coj3wy3,https://www.reddit.com/r/Tunisia/comments/2vbmra/,3,"... unless you are openly gay or atheist or, god forbid, both.

Don't get me wrong I am happy with the improvement on that report, but can't be truly free while one can't register an LGBT or Freethinking/Humanist NGO in the country. At the very least you will be hit by article 1 of the constitution (Islam = State Religion).",2015-02-12 10:01:08
coyq3e9,https://www.reddit.com/r/Tunisia/comments/2x8qtd/,3,"Szia,
If you're going to live in an isolated village, you should rent a car as soon as you land and bring a GPS with you. There are three types of villages in Tounes: fishing, agricultural and ""desert"" villages. They have one thing in common, which is the lack of young men and women. They usually spend most of their time in the city where they study or work. This is very important because you are going to be surrounded by the elderly. These people only communicate in the regional dialect and are very conservative. My advice to you is to stay close to the cities and not spend a long time in the same place. It is a culturally rich country and there is a lot to discover. I can't recommend any Arabic phrases because the dialects are different depending on the region. Instead, you should ask your host for their local phrase(s).",2015-02-27 06:48:54
cozdpwz,https://www.reddit.com/r/Tunisia/comments/2x8qtd/,3,depends on where you will be visiting ,2015-02-27 22:23:00
cp6yd7r,https://www.reddit.com/r/Tunisia/comments/2y6bb0/,3,"* The payment is low.  Quite low in fact but it's an internship

* Rent in Tunis you're going to be looking at minimum 300 a month.  You might can find a place for 350-375 with utilities but bare minimum.  [Search here](http://www.tunisie-annonce.com/AnnoncesImmobilier.asp)

* I'm an American in Tunisia so take that for what it is.  Everyone i've come across fall into two catagories.  They don't give a shit or are fascinated and ask me questions.  Not a lot of Americans come here.  Most Europeans (French, Germans, British)  KNowing French or Arabic is a must if you don't have a wife who translates everything like I do =)

* Foreigners are treated very well.  Again, the majority, don't care.  Just know that they're not one for pleasantries.  So don't expect warm welcomes from people

* I live in the higher up area so my views are skewed but crime isn't a huge issue here.  

* Tunis is hot.  It's not horrible and they are actually worse in the US but it gets toasty

* No vaccinations probably but get some mosquito repellant plug ins.  Also, I had to learn this the hard way.  During the summer and there's that strong summer breeze?  CLOSE THE WINDOWS!  In the US that means it's time to air out the place.  Here, it's not.",2015-03-07 03:32:13
cpdidv9,https://www.reddit.com/r/Tunisia/comments/2yvrgc/,3,"
maalej provided you with the translation


lol , i pretty sure that she's about to kick your ass

this song is from a comedic sitcom back in the 90 but still very popular , 

the spoiled brat, who is a guest at his aunt keep demanding stupid things from the cleaning lady , and she keep repeating this song to control her rage , when she had enough, she kicked the shit out of him 

https://www.facebook.com/video.php?v=237758539601597

send this back to here :

danie liya elbouza kima ta3milha ommie fi franca ",2015-03-13 09:35:52
cpg5xua,https://www.reddit.com/r/Tunisia/comments/2z1fie/,3,"I'm fortunate enough to be in one of the very select and small areas of Tunis with Fiber and the speed is great but the connection/modem/service in general sucks.  The modem is bad and my wife tried to take it back.  They tested it, said it works, refused to give her another.  Found it's a recurring issue with that modem so we're screwed.

We went to center Tunis last weekend and I (an American) was amazed that bootleg shops have these large storefronts and are selling these things with impunity.  I asked her ""Why can't people just download these like everyone else?"" She then told me that DSL is the main source of internet here and even in the best of situations it's pretty crap.

Evidenced by the fact her parents in Sousse have it, and it's pretty crap.",2015-03-16 01:52:52
cpiudto,https://www.reddit.com/r/Tunisia/comments/2zgmfg/,3,"17 tourists, 2 Tunisians",2015-03-18 15:42:39
cpivrnj,https://www.reddit.com/r/Tunisia/comments/2zgmfg/,3,"This is fucking crazy, I can't believe it. To think I was going to go to this very museum in the summer...",2015-03-18 16:20:31
cpjhxao,https://www.reddit.com/r/Tunisia/comments/2zgmfg/,3,They were Tunisian so they were probably Muslim yes.  Motives of their killings are not known currently but believed to be to destabilize the country.,2015-03-19 02:42:07
