id,url,score,body,date
cmdlphd,https://www.reddit.com/r/Tunisia/comments/2nh5u5/,8,"I'm usually all for following your heart and that kind of crap, but I do believe that this is a huge mistake... Perhaps a mistake she needs to make to learn a good life lesson.

What was this guy doing there in Paris exactly? And is she planning on moving to Tunisia for good after they get married? If she is, she needs to know a few things: 

- Only 15% - 20% of the population can speak English. Unless you're going to a touristic areas (near hotels and resorts etc..) you're not gonna be able to communicate with most merchants, cab drivers, government workers etc..

- Marijuana is 100% ILLEGAL. Selling, cultivating, or trafficking marijuana can lead to 10 years in jail.

- Her ""crystal healing"" scheme won't earn her a single Dinar here

- Most of these marriages happen just because the unemployed Tunisian guy is sick and tired of living here and wants to move to the girl's country (""these marriages""=unemployed guy suddenly falls in love with foreign girl, usually older than him, and they decide to get married ASAP)",2014-11-26 15:23:37
cgx9ams,https://www.reddit.com/r/Tunisia/comments/22vj7u/,7,"It actually is, but why would we tell you?",2014-04-20 12:57:13
cgqu2l3,https://www.reddit.com/r/Tunisia/comments/22vj7u/,5,it's a letter from someone from kairawan in tunisia named Moamed ben Slama to a friend of his in stokholm sweden called  abdelrazzak djrad asking him to look into a work contract so he could follow him and find a job in sweden,2014-04-12 21:45:26
cj2w4fa,https://www.reddit.com/r/Tunisia/comments/2b8khv/,5,I'm from the US but I'm in Sfax!,2014-07-20 22:49:26
cj3a7kz,https://www.reddit.com/r/Tunisia/comments/2b8khv/,5,I am from djerba. ,2014-07-21 09:25:32
cj3ori8,https://www.reddit.com/r/Tunisia/comments/2b8khv/,5,Sfax here!,2014-07-21 19:31:29
cj3xowq,https://www.reddit.com/r/Tunisia/comments/2b8khv/,5,I'm from Bizerte !,2014-07-22 00:06:23
cjgjolk,https://www.reddit.com/r/Tunisia/comments/2cjld9/,5,Vacationing in Tunisia currently and really enjoying it. Tourism has never been this vibrant and there is a real sense of security (Been visiting every year since 2002). Don't worry about what you hear on the news. Things on the street seem very ordinary.,2014-08-04 14:24:13
ckhdsox,https://www.reddit.com/r/Tunisia/comments/2gb4th/,5,coufraj,2014-09-13 19:50:47
ckhy14s,https://www.reddit.com/r/Tunisia/comments/2gb4th/,5,[How come](http://i.imgur.com/4aFQGYn.jpg)?,2014-09-14 13:49:21
cmdo72k,https://www.reddit.com/r/Tunisia/comments/2nh5u5/,5,"Yes I agree with the above. 

Depending on where she ends up in Tunisia both socially and geographically she can get away with religious contempt if she keeps it low key, and her crystal healing stuff can get viewed as an eccentricity, but wont earn her an income... what she won't get away with is her marijuana use.

Also from what you say the guy probably just views her as a ticket to Western citizenship, and just as such, will discard her when the destination is reached.",2014-11-26 16:46:02
cn1mjbs,https://www.reddit.com/r/Tunisia/comments/2pvm0z/,5,"&gt; especially that he wasn't in a position of power during Ben ali

Although I might be late to correct this mistake, Moncef Marzouki was [the president of human rights league](http://fr.wikipedia.org/wiki/Ligue_tunisienne_des_droits_de_l'homme) under ZABA and one of his main supporters during the beginning of his reign. 

Here is a link to a forum thread containing [some old newspaper articles](https://www.tunisia-sat.com/vb/showthread.php?p=1045264140) about Moncef Marzouki and ZABA. 

There is even one article written by Moncef Marzouki **himself** encouraging Tunisians to vote for ZABA: ""حتى تنجح التلميذة تونس بجدارة""

[This website](http://www.samibenabdallah.info/2012/04/23/la-verite-sur-les-3-mois-de-prison-de-moncef-marzouki-sous-ben-ali/) contained  many source materials proving how Moncef Marzouki became a professor (using his connections with ZABA) and why he was held prisoner in 1994 (Basically, he was running for presidential elections. In Arabic and French press, he said he was doing so to prove that we have real democracy in Tunisia and that anyone was free to run for presidential election if he was eligible to do so. However, he declared to a Spanish newspaper that he was running for presidential because there was no human rights in Tunisia. He was held for defamation).
This website was taken down two weeks ago. I am wondering by whom? However, here is a [cached version of this site](http://webcache.googleusercontent.com/search?q=cache:zydWb8YPMMoJ:www.samibenabdallah.info/+&amp;cd=1&amp;hl=en&amp;ct=clnk&amp;gl=tn) if you want to read more about the subject.

Next time before you spread wrong information, please do your research thoroughly.

**N.B:** When I was searching google to write this answer, I noticed that many sites content has been altered in favor of Moncef Marzouki and that some other sites have been taken down. Moncef Marzouki talks about freedom of press and tries to alter his own history. What a scumbag!!!",2014-12-21 21:52:27
cn1q49y,https://www.reddit.com/r/Tunisia/comments/2pztae/,5,"As an American, it is awesome to be here during one of the more exciting times in Tunisia.  You guys are not only doing a great job but you're a shining example of what can happen when revolutions go right.  Hopefully the economy will become more stable and there will be job growth.  I know the US has invested a lot of money to help but it takes great leadership to make it happen.

Mabrouk Tunisia!",2014-12-21 23:52:30
ci27049,https://www.reddit.com/r/Tunisia/comments/27jhj4/,4,"YES!
The festival is a good idea but i doubt everyone is interested in going.
I hope the number of  attendants  would be greater than 3 &gt;.&gt; ",2014-06-08 15:10:10
ciocggt,https://www.reddit.com/r/Tunisia/comments/29rc99/,4,"[Maktoub](http://www.youtube.com/watch?v=_YEQfZ-2MdA) is over rated  
[Dlilek mlak](http://www.youtube.com/watch?v=HQJtlKfeqsg) is frustrating and hard to watch  
[Nsibty l'a3ziza](http://www.youtube.com/watch?v=tppjxoFLg4A) is meh now
  
There are a couple more shows, you should watch and make your own assesments.
",2014-07-04 12:03:14
ciwznzb,https://www.reddit.com/r/Tunisia/comments/2am6l4/,4,['Sup?](http://4.bp.blogspot.com/-wXpWYD7h-7U/UZRk0ERm96I/AAAAAAAAEiw/3bCZB2pPO0k/s640/supdog1.jpg),2014-07-14 12:47:40
cj38htn,https://www.reddit.com/r/Tunisia/comments/2b8khv/,4,I'm from canada,2014-07-21 07:13:08
cj395b0,https://www.reddit.com/r/Tunisia/comments/2b8khv/,4,M'saken :) We're neighbors :p,2014-07-21 07:57:40
cn19gd7,https://www.reddit.com/r/Tunisia/comments/2pvm0z/,4,"Neither. As a friend of mine said : ""It's like being caught between a dick and a wall"".",2014-12-21 13:23:44
cexzpj7,https://www.reddit.com/r/Tunisia/comments/1w0x12/,3,I would be absolutely stunned if you can find a bar/cafe/anywhere that shows american football games.,2014-01-24 20:29:44
cf8waf3,https://www.reddit.com/r/Tunisia/comments/1x6f5x/,3,"Lentils not lenses.
Tu ne manges pas des lentilles de contact",2014-02-06 22:45:10
cfch6il,https://www.reddit.com/r/Tunisia/comments/1xllpp/,3,"He is probably a hero to some.
Should that opinion be illegal? Should that opinion be suppressed? 
The price of living in a democracy is that sometimes people say things you don't agree with. IT's up to you to show them why they're wrong.",2014-02-11 11:17:19
cfmh0um,https://www.reddit.com/r/Tunisia/comments/1ymkw7/,3,"Bonjour /u/Siouz ,
Alors je vais essayer de répondre à la plupart de tes questions mais pour ce qui est des loyers Je peux te recommender un autre site comme [celui-ci](http://www.tunisie-annonce.com/).

Pour ce qui est de la ligne de téléphone mobile, je pense que toutes les lignes disponibles en Tunisie sont sans engagement, vous n'aurez qu'à acheter une puce(carte SIM) et la recharger chez n'importe quelle epicerie mais vous pouvez aussi acquérir une ligne à facture, pour cette ligne je n'ai pas beaucoup d'information la concernant je vous laisse donc la tâche de chercher par vous-mêmes. 

Pour ce qui du meilleur opérateur, je ne peux pas les comparer mais voici quelques noms Tunisie Telecom, Tunisiana ou Orange.

Alors comment s'habillent les filles à Tunis? Et bien comme à Paris ou tout autre ville de France. Mais ça dependra ensuite de votre lieu de résidence, tout ce que je peux vous dire c'est que vous pouvez mettre tout ce que vous voulez du moins que ce ne soit pas trop osé.
Voilà, et si vous avez d'autres questions n'hesitez pas à me contacter.",2014-02-23 10:40:59
chkjdin,https://www.reddit.com/r/Tunisia/comments/25msfw/,3,drug use in this country is just some lame ass excuse to lock ppl up ,2014-05-17 20:55:20
ci2atzj,https://www.reddit.com/r/Tunisia/comments/27jhj4/,3,I very much hope so. None responded so far. If you know any Tunisian redditors try to get them to come ;),2014-06-08 18:00:57
ci3pmv7,https://www.reddit.com/r/Tunisia/comments/27jhj4/,3,Guys u had my attention and now u have my curiosity. ,2014-06-10 07:23:23
ci3tq77,https://www.reddit.com/r/Tunisia/comments/27jhj4/,3,Yeah but we are still not growing in numbers yet. :/,2014-06-10 13:03:43
ci4t7hg,https://www.reddit.com/r/Tunisia/comments/27jhj4/,3,"not the case for me, would be disappointed if one of us ain't coming :D",2014-06-11 14:49:58
ci4u7xf,https://www.reddit.com/r/Tunisia/comments/27jhj4/,3,oh i AM coming. But are we going to the festival ?,2014-06-11 15:28:11
ci598ed,https://www.reddit.com/r/Tunisia/comments/27jhj4/,3,There are dozens of us! Dozens!,2014-06-12 00:05:24
ci59xqg,https://www.reddit.com/r/Tunisia/comments/27jhj4/,3,"The idea is pretty [neat](http://giant.gfycat.com/AbleAmbitiousBluetonguelizard.gif), although I won't be able to go to the festival since I'm already going to see my friends' band playing at an event the exact same day.

Still up for some coffee though.

-A fellow Tunisian redditor : )

EDIT: glad to see that you liked my -indirect- proposition. See you there dudes &amp; duderinas !",2014-06-12 00:33:58
ci5h8h4,https://www.reddit.com/r/Tunisia/comments/27jhj4/,3,"Hello fellow tunisian redditor! I think that we are eventually just going for the coffee for the time being. The festival would have been a nice idea if we were more in number. We will come up with some ideas on what to do on the meet up day. We are all open for suggestions, don't hesitate to come up with some!",2014-06-12 05:46:27
ci5j3nq,https://www.reddit.com/r/Tunisia/comments/27jhj4/,3,"Well, as I said, there's a concert Saturday. Here's the [fb event](https://www.facebook.com/events/489868531112598/?ref=29&amp;ref_notif_type=like&amp;source=1). As you can see, it is supposed to start at 3PM (but we all know music concerts never start on time in Tunisia haha) and I really don't know if my friends and I are gonne stay for the whole show or if we'll leave after our friends' band performance.
All in all, I'll be downtown for the most part of the afternoon and have no idea where will I end up afterward.

Apart from that, I'm the only active redditor I know among my friends and acquaintances. A few friends know reddit but neither they have active accounts nor do they browse it daily.

Anyway, let me know when everythung is set-up (place, time, etc...)

8-)",2014-06-12 08:11:19
ci5nbud,https://www.reddit.com/r/Tunisia/comments/27jhj4/,3,literally a *Dozen*,2014-06-12 13:39:30
ci5s9sl,https://www.reddit.com/r/Tunisia/comments/27jhj4/,3,How about attending spacelord's event? I mean joujma old cars local rock bands sounds pretty cool no? We can go have some coffee later on too? I think that can be fun!,2014-06-12 16:45:11
ci5zti8,https://www.reddit.com/r/Tunisia/comments/27z6xv/,3,"I think the best way to do it is to always think about travelling as an adventure and that fear could come from both sides. A co-worker of mine went to California a month ago and was terrified at the thought of going to the USA alone for her vacation. She was scared at the thought that she would be around total strangers, that she could easily get lost , that there are so many criminals around who could rape/kill/rob. She was very excited at the thought of going there but very afraid of what she could be facing. Eventually, she had lots of fun and met great friendly people there. 

What I am trying to say is that fear is natural, but if you stay in your comfort zone you would never get to explore and adventure.

As long as you will be hanging around the right areas, that you will have a trustworthy escort/company, I think you will be fine. Try to get as much fun as possible. You will be meeting great people! Let us know where you will be around perhaps I could recommend some nice places to visit!",2014-06-12 20:53:05
ci64ib8,https://www.reddit.com/r/Tunisia/comments/27z6xv/,3,"&gt;Would you recommend I go to Tunisia? 


Yes.
&gt;What should I expect when I get there?    

Tunisia from a geographical standpoint has seen a lot of  cultures come and go due to its position in the Mediterranean so there are a lot of ruins and landmarks (e.g. the biggest collection of mosaic in Bardo museum, the last Carthaginian city and a Colosseum).
   
I personally advise you to stay away from hotel food and eat out. Sure restaurant food isn't as good as homemade food but it's good enough as an insight to the culture, hotel food is dull and has no relation to Tunisian food except the bowl of harissa they put on the side and the occasional grilled salad. Try Tunisian fast food (tabouna, Brik, tunisian plate, lablebi ect ). go to the souk   the  closest one works well, but be careful the vendors in the souvenir selling parts can be really grabby sort of so have your friend with you at all times because you may get lost easily in the narrow passages, witch are a characteristic of tho old Tunisian architecture that exists in most big cities like Tunis and Bizerte and are a must visit.   
Do not fear diseases there are more than enough doctors in this country. Wash your hands regularly as usual and you're going to be fine.  

It is indeed the world cup season so expect all cafes with a functional TV that airs the world cup full during match hours. People would be too preoccupied to even think about kidnapping you.
   
Hope this helped. Have a nice trip and don't hesitate to PM me for any needed help.

",2014-06-12 23:40:26
ci6ctu5,https://www.reddit.com/r/Tunisia/comments/27z6xv/,3,"I could give you some perspective from a western tourist point of view
 because I've been born in The Netherlands yet I've visited Tunisia many times due to the fact my father was born there.


I think you'll love it. The mentality of the people seemed very modern/western. Especially in the bigger touristic cities (Sousse and Tunis) a lot of things feel western. Now hopefully you'll stay with the family of said friend because in that case you'll have a blast. You'll get an inside perspective instead of doing the obligatory walk around the market beforing heading to the pool of your hotel. Which sadly seems to be what a lot of tourists do.

Don't drink the tap water though
",2014-06-13 05:30:59
ci7bu5b,https://www.reddit.com/r/Tunisia/comments/27jhj4/,3,"I updated the post, I m still not giving up man, Hell no!",2014-06-14 12:25:27
ci7czmj,https://www.reddit.com/r/Tunisia/comments/284gtf/,3,"We can't just make overall judgments on an aberrant case such as this one. Women are far from equality with males in the developed countries as well. The male and female wages disparities in the US for example or domestic abuse in the western world. There are certainly many gaps that are still to be brought out and solved for sure. But when it comes to the Tunisia or any other arabic country I still think that the matter goes in deeper since it is related to cultural and religious roots. The only way to change that is education.  

This man has done a horrible deed, the society would never accept something like this and will consider it as a crime. I am a Tunisian woman who grew up in a moderately open-minded family, we are not well off financially but my parents married each other out of love. I do think of myself as a person who has always been enjoying her freedom and has always had as many rights or freedoms as my brother had.

I remember though this one time that Dad saw me coming back from School with two male classmates/neighbors I was having my arms I think very close to their shoulders , almost like hugging, I was very young back then, maybe 8 years old or so and he told me this: "" Don't be leaning too much to guys, especially in public, walk straight and keep your head up, be friendly but not too friendly, it is for your own protection, your true friends are your pen and your Book, one day you will understand how important they are"". I think the way he reacted to it had a positive impact on his ""parenting"", he didn't push me to do anything behind his back and made me never fear his reaction because I knew that his love and acceptance were unconditional. I just knew then that he was putting me on the right track because he knows better given his experience. I am grateful for having a very special dad that way.
 
PS: Bunch of redditors are meeting, at the 716 café in LAC2, we could discuss this a bit more if you would like to join us over a nice coffee and very nice view, more on [this post](http://www.reddit.com/r/Tunisia/comments/27jhj4/reddit_global_meet_up_day_2014_it_has_been_a_year/)!",2014-06-14 13:52:50
cia0mxo,https://www.reddit.com/r/Tunisia/comments/27jhj4/,3,"Damn, I sincerely apologise for not attending to the meet up and my absence of reply. I went out early on Saturday and didn't go home until late Sunday afternoon (can't access Reddit on my so modern phone /s).

How was the meet up? Have you planned anything else ?

Sorry again for being MIA :/",2014-06-17 18:41:24
cies9k3,https://www.reddit.com/r/Tunisia/comments/28nkk3/,3,That's sarcastic!,2014-06-23 12:50:35
ciocq9k,https://www.reddit.com/r/Tunisia/comments/29rc99/,3,[Naouret Lahoué](http://www.youtube.com/playlist?list=PLJWCyE-zSTHXhJ7Rczbi6LYc_r5Ig2pXy) isn't bad.,2014-07-04 12:25:39
cioh7te,https://www.reddit.com/r/Tunisia/comments/29rc99/,3,"these 3 are actualy the only ones i  know about :D
maktoub is nice, dlilek mlek is boring and nsibti lazizi i feel it is made for retarded people.
Thanks a lot for the reply. I haven't been in Tunisia for 10 years...so I kinda reminisce with these stuff. ",2014-07-04 16:17:14
ciq0vla,https://www.reddit.com/r/Tunisia/comments/29rc99/,3,"best show Naouret Lahoué 
",2014-07-06 19:21:27
ciwm8so,https://www.reddit.com/r/Tunisia/comments/2am6l4/,3,Welcome !,2014-07-14 00:12:20
ciwmnup,https://www.reddit.com/r/Tunisia/comments/2am6l4/,3,"Quite a few. I'll be one soon. They have had two meetups too. 3 showed last year, 4 this year.",2014-07-14 00:29:32
ciwxbk9,https://www.reddit.com/r/Tunisia/comments/2am6l4/,3,Here I am :D ,2014-07-14 09:37:20
ciywb1k,https://www.reddit.com/r/Tunisia/comments/2am6l4/,3,another Tunisian here :),2014-07-16 11:08:35
cj0tig1,https://www.reddit.com/r/Tunisia/comments/2b00ug/,3,What's the name of the anime?,2014-07-18 11:37:06
cj1ozeb,https://www.reddit.com/r/Tunisia/comments/2b4fvs/,3,"[**@MeriemTN**](https://twitter.com/MeriemTN):
&gt;[2014-07-19 09:33:36 UTC](https://twitter.com/MeriemTN/status/490429235434373120)

&gt;[#Facebook](https://twitter.com/search?q=%23Facebook) page Fajr/dawn of Kairowine publishes details of [#chaambi](https://twitter.com/search?q=%23chaambi) attack against the army by Okba Ibn Nafaa brigade [*pic.twitter.com*](http://pbs.twimg.com/media/Bs5ayg2IQAATjkB.jpg) [^[Imgur]](http://i.imgur.com/5AlbYMT.jpg)

----

[^[Mistake?]](http://www.reddit.com/message/compose/?to=TweetPoster&amp;subject=Error%20Report&amp;message=http://reddit.com/2b4fvs%0A%0APlease leave above link unaltered.)
[^[Suggestion]](http://www.reddit.com/message/compose/?to=TweetPoster&amp;subject=Suggestion)
[^[FAQ]](http://np.reddit.com/r/TweetPoster/comments/13relk/)
[^[Code]](https://github.com/buttscicles/TweetPoster)
[^[Issues]](https://github.com/buttscicles/TweetPoster/issues)
",2014-07-19 10:03:29
cj2lvf2,https://www.reddit.com/r/Tunisia/comments/2b00ug/,3,"That's so cool!
I also happened to come across a Green Lantern issue entitled ""[TURMOIL OUT OF TUNISIA](http://archive.facetasm.com/bundles/bilderundworte/uploads/catalog/product/117001/item117285.1.jpg)"".",2014-07-20 16:01:35
cj2zo9c,https://www.reddit.com/r/Tunisia/comments/2b8khv/,3,Tunis.,2014-07-21 01:04:23
cj326ht,https://www.reddit.com/r/Tunisia/comments/2b8khv/,3,k,2014-07-21 02:33:08
cj3czny,https://www.reddit.com/r/Tunisia/comments/2b8khv/,3,from djerba,2014-07-21 12:57:18
cj3gj9k,https://www.reddit.com/r/Tunisia/comments/2b8khv/,3,Sfax. Living in Indiana. ,2014-07-21 15:21:58
cj3ubrc,https://www.reddit.com/r/Tunisia/comments/2b8khv/,3,"Hey there! I have been seeing quite a few Americans lately, actually I just had a nice dinner with a co-worker and a Chinese Texan tonight lol I didn't know that Tunisia was a known destination for American visitors.

Enjoy your stay :) if you happen to have any questions or asking for recommendations on places to visit in Tunis/Sousse, don't hesitate to ask us!

edit :missing words/ long monday night ",2014-07-21 22:14:00
cj3vbul,https://www.reddit.com/r/Tunisia/comments/2b8khv/,3,i'm from djerba ,2014-07-21 22:47:03
cj63qxl,https://www.reddit.com/r/Tunisia/comments/2bhrc0/,3,"Nope, it's not a troll action.. It's because of this [""bill""](http://a2t.tn/Projetdeloi.pdf).. ",2014-07-24 02:32:20
cj7sam7,https://www.reddit.com/r/Tunisia/comments/2bhrc0/,3,There is a new bill that allows the government to access your private information and web history in case they feel the need to ..they basically can spy on you and they are justifying it by anti terrorism #-_-,2014-07-25 20:51:40
cj8siqc,https://www.reddit.com/r/Tunisia/comments/2bslha/,3,"I am very confident that the currency will stabilize in the near future and will be used everywhere. Sometimes high risks mean high yields. Just look at those who believed in BitCoin and bought hundreds of them when they practically were valueless.. Now they have the equivalent of thousands of dollars.

Besides, BitCoin has very appealing characteristics that are nonexistant in traditional ""fiat"" money.

I wish there were BitCoin traders in Tunisia who accept cash.",2014-07-27 01:37:13
cj92oto,https://www.reddit.com/r/Tunisia/comments/2bslha/,3,"The first wave of enthusiasm and hype certainly definitely has ended. 

However, it's quite normal for new technologies to go through this cycle. Some technologies simply stagnate and/or died out eventually, true, but here I think it's more likely that it will take another 5 to 10 years to pick up again. (But by that I don't mean the price of Bitcoin, it could very well be a completely new system that is re-engineered from scratch and takes into account the flaws of Bitcoin. Even with wider adoption of Bitcoin, the price doesn't necessarily increase.)",2014-07-27 11:57:55
cjgddqr,https://www.reddit.com/r/Tunisia/comments/2cjld9/,3,"Hmmm. Just based on the news, I would think Tunisia is considerably safer than Egypt right now.",2014-08-04 07:15:58
cjze6in,https://www.reddit.com/r/Tunisia/comments/2egxde/,3,"Wow, man, I wish we would have known about this sooner or we woulda rode out.  We were already sort of settled in when you sent the text.  Any information on another Con soon?",2014-08-24 21:07:50
cjzea3s,https://www.reddit.com/r/Tunisia/comments/2egxde/,3,omg I feel so bad I couldn't attend this :( almost in tears.... I wish I have known about it beforehand. :/,2014-08-24 21:11:22
ck0dzqz,https://www.reddit.com/r/Tunisia/comments/2ek4r5/,3,"Hey there Tafcha (and by no means I very much didn't mean to belittle you, you chose one of a kind nicknames there). 
Which subs do I usually go to... hmm pretty much science, worldnews, anime, funny, adviceanimals, gaming, aww... etc 
 discussed subjects? anything that you would like to talk about as long as you don't start a hate/racist/violent or seemingly inviting to hatred/racism/violence speech. 

We already had meet ups, actually two of them already during the annual Global Reddit Meet up day, you can look up some of the pics posted on this subreddit for that matter. We also attended an event together which was a Zelda special symphony concert in June. 

As for stories about reddit and how amazing of a place it is, I was baffled by so many stories but have not really spoke of it to friends, I showed the website to some to see if they could be interested in joining, but I don't think that they were as nearly as interested as I was. 

Welcome again to this subreddit Tafcha! Hopefullly we will meet one day? ",2014-08-25 22:54:38
ck0edfe,https://www.reddit.com/r/Tunisia/comments/2ek4r5/,3,"I think people are put off by the look of reddit
the first time i visited this site I didn't think I would come back yet here I am 2 years later still lurking.",2014-08-25 23:08:10
ck0p7tb,https://www.reddit.com/r/Tunisia/comments/2ek4r5/,3,Yeah I don't comment as much now just lurking around most of the time too.,2014-08-26 06:14:14
