id,url,score,body,date
cpdtmih,https://www.reddit.com/r/Tunisia/comments/2yvrgc/,1,"hahaha!!! thanks a lot. hey what does ""danie liya elbouza kima ta3milha ommie fi franca"" mean? (i just want to know before i tell her this and get my ass handed to me) hahah
",2015-03-13 17:07:58
cpe2krv,https://www.reddit.com/r/Tunisia/comments/2yvrgc/,1,hahaha! cool Thanks,2015-03-13 21:17:32
cpfse1t,https://www.reddit.com/r/Tunisia/comments/2z1fie/,1,[deleted],2015-03-15 18:47:57
cpg5tdw,https://www.reddit.com/r/Tunisia/comments/2z0rge/,1,"Where are/were you visiting from?

*edit*

Just stalked you and saw that you're Canadian.  You were probably near where I live then at some point.  I live across the street from the Canadian Embassy.",2015-03-16 01:49:03
cpg8k9p,https://www.reddit.com/r/Tunisia/comments/2z0rge/,1,"Not sure about that... I only visited Carthage, not Tunis per say... I stayed in Sousse...",2015-03-16 03:21:41
cpgdwxf,https://www.reddit.com/r/Tunisia/comments/2z0rge/,1,"Oh, Sousse is great too.  My wifes family is there.  We're going there this weekend.  We spent a week at the Movenpick hotel.  I got some pictures of the ruins of Carthage, is there where you went?",2015-03-16 07:42:01
cpiozhn,https://www.reddit.com/r/Tunisia/comments/2zgm03/,1,"Guys, please all be very careful out there today.  These idiots have already killed 8 people and they don't care who you are.  They seem to be targeting tourists specifically but they shot and killed a Tunisian apparently too.",2015-03-18 12:39:29
cpiqjer,https://www.reddit.com/r/Tunisia/comments/2zgmfg/,1,Killing tourists is not going to end well for them. Tunisia will go after the terrorists now to help their very importatn tourism industry adn the country of every tourist who was killed will also probably want blood and spend more to fight terrorism. ,2015-03-18 13:44:15
cpiu6w8,https://www.reddit.com/r/Tunisia/comments/2zgmfg/,1,[deleted],2015-03-18 15:37:22
cpj3qp0,https://www.reddit.com/r/Tunisia/comments/2zi4yh/,1,jaime le sex,2015-03-18 19:48:21
cpj4ee3,https://www.reddit.com/r/Tunisia/comments/2zgmfg/,1,Sad news. I hope Tunisia recovers quickly and any remaining murderers are apprehended/put down soon.,2015-03-18 20:05:31
cpj6jgd,https://www.reddit.com/r/Tunisia/comments/2zgmfg/,1,"From Morocco ..deeply sad for what happened today, were they from Isis, alqaida or another organization ?",2015-03-18 20:59:46
cpjcl53,https://www.reddit.com/r/Tunisia/comments/2zgmfg/,1,If this doesn't convince Tunisians to fight Islamists nothing will. Tourism will take a huge hit after this.,2015-03-18 23:53:04
cpjhy37,https://www.reddit.com/r/Tunisia/comments/2zgmfg/,1,I don't think they've said.  They were Tunisian from what i've heard on the news.  ,2015-03-19 02:42:46
cpjzsn3,https://www.reddit.com/r/Tunisia/comments/2zj00b/,1,"Thanks for the detailed response and tips. They are quite useful. 

I've booked a hotel in Carthage for my stay so I'm definitely looking forward to exploring the area. Visited Sidi Bou Said last time I came to Tunisia so maybe I'll skip it this time around but Cooks sounds interesting so I may go just for that.

I'm sending you a private message with more details and questions. 

Cheers.



",2015-03-19 16:17:53
cpluvu5,https://www.reddit.com/r/Tunisia/comments/2zr78y/,1,thank you :),2015-03-21 07:38:27
cpmvfzv,https://www.reddit.com/r/Tunisia/comments/2x8qtd/,1,"Interresting, I am Algerian and I have never heared of Tozeur. I have heard of all the other cities but never of Tozeur. ",2015-03-22 12:35:52
cpo7nus,https://www.reddit.com/r/Tunisia/comments/300o3q/,1,"yeah am aware about all of that :p that's why i am asking about *Law advice* i am looking for the **exact rules** about receiving a ""thing"" from outside the country, i actually received tons of small values items and never had a problem, i always ha a mail and then took it from the post office in my city (Benzart) but people warned me about buying a high value item so i just want to know my rights and duties about this subject. ",2015-03-23 18:50:07
cpw1nwd,https://www.reddit.com/r/Tunisia/comments/300o3q/,1,Actually I'd be really interested in reading that detailed post. I've spent my whole life scared of having stuff shipped here.,2015-03-30 22:59:43
cq0sfu3,https://www.reddit.com/r/Tunisia/comments/31da9s/,1,"I think everyone on this planet is a livable human being and personal beliefs don't make any difference.

They're just personal, people need only to show respect and improve their social skills instead of declaring such useless debates.",2015-04-04 07:29:59
cq0xdxz,https://www.reddit.com/r/Tunisia/comments/300o3q/,1,"My friend (in spain) just bought the tablet from Amazon, he will receive it on the 7th of April and ship it to me, it's should arrive between 13th and 17th of this month, will keep you updated.  ",2015-04-04 13:38:47
cq0xmg6,https://www.reddit.com/r/Tunisia/comments/31da9s/,1,"They are human, which mean you will find some really good (smart) atheists just like you can find a lots of fucked up ""religiophobic"" who just hate religion. 

Am an atheist and every time this subject is brought i got a lot of bad reactions (nothing violent)  funny part is that all those who consider me ""on the side of the devil"" are the kind of hypocrites who spend the entire year doing things that are supposed to be forbidden by their religion and then they do the stop-eating thing in Ramadhan lol 

But, interesting enough, i have few friends who are religious but they try to prove that their religion is not as bad as i think, these are the kind of people who are totally in love with the first 200 years of Islam, their arguments has some logic in it and they doesn't look at you as Satan-little-helper.",2015-04-04 13:49:34
cq1adrj,https://www.reddit.com/r/Tunisia/comments/300o3q/,1,so what happened ? ,2015-04-04 21:03:46
cq1tsbj,https://www.reddit.com/r/Tunisia/comments/300o3q/,1,"he will do the shipment this Tuesday or Wednesday, i'll let you know what happens when the item is here.  ",2015-04-05 10:43:38
cq1tyk1,https://www.reddit.com/r/Tunisia/comments/2zr78y/,1,Very well said. Cheers! :) ,2015-04-05 10:58:40
cq236q1,https://www.reddit.com/r/Tunisia/comments/31da9s/,1,meh.,2015-04-05 17:41:27
cq4v0z3,https://www.reddit.com/r/Tunisia/comments/31sj1t/,1,[deleted],2015-04-08 01:58:47
cq5a2fg,https://www.reddit.com/r/Tunisia/comments/31sj1t/,1,"Don't take his [bait](https://encrypted-tbn3.gstatic.com/images?q=tbn:ANd9GcS6dqYVG_o7iOQ-Dg72lyyunoJbN3ESacVBZACPcgt3Ip64Jh0H) cmone it's pretty obvious , just look at his comment history",2015-04-08 13:18:45
cq6lnv2,https://www.reddit.com/r/Tunisia/comments/31y8ea/,1,Go to Kelibia ! It's in Nabeul (close to the capital),2015-04-09 15:22:55
cqmm7og,https://www.reddit.com/r/Tunisia/comments/32553a/,1,"enfinn, j'espère qu'il aura pas un retard ",2015-04-24 00:13:19
cqst5dk,https://www.reddit.com/r/Tunisia/comments/33l62o/,1,"http://www.amazon.com/Sony-Computer-Entertainment-Playstation-System-3/dp/B00E369SDM/ref=sr_1_4?s=videogames&amp;ie=UTF8&amp;qid=1430326707&amp;sr=1-4&amp;keywords=ps3

Are you in the right subreddit?",2015-04-29 16:58:55
cqsvn3d,https://www.reddit.com/r/Tunisia/comments/33l62o/,1,Amazon doesn't ship to Tunisia so yes.,2015-04-29 17:59:46
cqt8ui4,https://www.reddit.com/r/Tunisia/comments/33l62o/,1,"Ah, gotcha.  I didn't know.  Sorry!
Are you sure they don't ship to Tunisia? (http://www.amazon.com/gp/help/customer/display.html?nodeId=596186)

You could try http://www.amazon.fr/, too.",2015-04-29 23:35:22
cqtmyfn,https://www.reddit.com/r/Tunisia/comments/33l62o/,1,"Yep, i've tried them all, .fr, .de, .it, .co.uk, all of 'em.  I actually have to have things shipped to my Dad in the US and have HIM mail stuff to me.  Just with a PS3 it's going to be rather expensive to pay for it, pay to ship it, then they're going to charge me import taxes too.  I found some used ones on announce for ~400 TND so going to talk to a couple of people on there, see if I can work a deal with someone.  Most have games I'm not interested in though and are hacked which I'm not interested in either so, who knows.  I figured I could get it cheaper sans games and not hacked.",2015-04-30 07:48:36
cqvy2g3,https://www.reddit.com/r/Tunisia/comments/3455yk/,1,"Hiking shoes or boots if you're going to hike, otherwise any sports shoes will do.",2015-05-02 11:29:22
cqz4zbh,https://www.reddit.com/r/Tunisia/comments/31da9s/,1,Atheists are rare these days. There are many anti-theists out there who think they are atheists and sadly confuse the definitions. ,2015-05-05 15:16:51
cqz94dc,https://www.reddit.com/r/Tunisia/comments/34bu5o/,1,[deleted],2015-05-05 17:07:38
cqz95ou,https://www.reddit.com/r/Tunisia/comments/34bu5o/,1,[deleted],2015-05-05 17:08:37
cqz99gz,https://www.reddit.com/r/Tunisia/comments/30iyus/,1,Oooh The Classics :D,2015-05-05 17:11:21
cqzj1sz,https://www.reddit.com/r/Tunisia/comments/33l62o/,1,"Try to search in websites like ballouchi.net or tayara.tn (They're in french) and beware of scams.

You can still find new ones in Carrefour / Géant / Game stores but I doubt that their price are the same as in US/EU (Taxes right ?)

And you have to know that Hacked PS3s are generally much expensive compared to unvoided ones.

Good luck ;)",2015-05-05 21:25:56
cqzj9s9,https://www.reddit.com/r/Tunisia/comments/33l62o/,1,"Thanks, i was looking on announce tunise and yeah they're about 500+ Dinar.  I found one for 350 (unhacked) but the guy said he only had it for about a week and his story just didn't add up.  I may give another call in a week or so if it's still unsold.  I gotta imagine an unhacked one here isn't in high demand.  We have some PS3 games but the one we're wanting to play the most is FFXIV (it's the only reason we had the one we had).

Thanks for the heads up.  Her brother is leaving again in a month and is giving it back then so we may just wait.  We've been playing it a bit too much anyways and weather is getting nicer so we may just use the opportunity to go out instead.",2015-05-05 21:32:03
cr06cgb,https://www.reddit.com/r/Tunisia/comments/34vf9k/,1,"Aw, that's sweet. I hope it goes well. 
Do you speak Arabic/French? That has always been my concern about going there. And those cultural changes would be great to see for a short amount of time (visiting, studying, etc). 

",2015-05-06 13:24:39
cr06ie7,https://www.reddit.com/r/Tunisia/comments/34vf9k/,1,"I read your first comment and i was gonna tell you ""why you here anyway bro? just get the hell out of dodge!"" but Damn you left the US to come and live here! That's love no question about it, i don't know what could be more proof of love than that, that is as love as it gets. :D",2015-05-06 13:30:18
cr08h07,https://www.reddit.com/r/Tunisia/comments/34vf9k/,1,"I do not speak Arabic or French.  I speak very little French at least but I'm starting to learn and pick stuff up and actually found a site that is great and has things phonetically spelled out since I'm hard of hearing and can't pick up some of the nuances of words sometimes.  My wife is Tunisian however and it helps.

Also, a good portion of people here (especially in the mid to upper scale areas) speak English.  My wife, her brother, sister, mother, father and most of her relatives all speak it and they come from what most would consider upper lower class as far as income levels.

The cultural differences that I found most shocking is stuff being ""out of season"".  Something foreign to me in the US.  However, the food tastes  SO much better and fresher because the stuff grown here travels VERY little distance to get to the stores.  You also have lots of open area markets where people just grew them and sell the stuff on the sides of the roads.

One that still irks me a bit is that people litter here.  A lot.  I live in a pretty upper class area surrounded by high scale cafe's and hotels and embassies EVERY where and trash in the streets is just a thing.  I've seen countless people just dispose of a water bottle or bag of chips by just letting it drop; no shame.

My wifes father says the people here aren't very nice however I've been greeted with an overwhelming positive response.  It reminds me of NYC a bit in that people generally won't say ""Hello"" like I'm used to in the southern US (which I was born and raised) just walking by you.  People tend to just move along and not pay attention to you.  At least in the big city of Tunis.  In Sousse where my Wife is from and we visit a lot, people are so very friendly and get a good chuckle at my broken Arabic but not in a condescending way.  A lot of people here really try to use English if they know you speak it Native just to ""stretch their legs"" so to speak.

Honestly, I've fallen in love with the place and if I can find employment here, I have no intentions of leaving.",2015-05-06 14:31:49
cr08iuu,https://www.reddit.com/r/Tunisia/comments/34vf9k/,1,"It was certainly love.  Absolutely 0 regrets too.  We wanted her to go to the US but that wasn't going to work so I up and sold my house, packed my shit, sold my car, flew 28 hours on 3 planes and 4 cities to nearly die a week later (twice).  Still, 0 regrets and would do it again.",2015-05-06 14:33:17
cr08qfk,https://www.reddit.com/r/Tunisia/comments/34vf9k/,1,"(twice)?!! You have to give more details now, don't leave me hanging bro :(",2015-05-06 14:39:28
cr0avg5,https://www.reddit.com/r/Tunisia/comments/34vf9k/,1,Sounds like I would fit in being a New Yorker haha. I'm glad you enjoy it. ,2015-05-06 15:38:39
cr0uioo,https://www.reddit.com/r/Tunisia/comments/34vf9k/,1,"nothing serious will happen here. various ""little"" attacks may still occur but it's almost impossible for Tunisia to live the same scenario of Libya, Syria or even Egypt. The main reason why Libya and Syria were fucked up is because they don't have real allies.

Tunisia have an excellent diplomatic connections and the latest visits made by more than one country representative including ""big"" countries presidents like Germany and France prove that the country won't have any major conflict in the next few years. 


&gt;ISIS declared that they were moving toward Tunisia 

They are bluffing, they love to bluff, they are a collection of fucked up teenagers and adults who've been mentally damaged through their entire life (too poor, too ugly, too stupid, too shy or a mix of all that).  I am sure that they will destroy each other very soon, specially in Libya. 
",2015-05-07 00:03:58
cr0ured,https://www.reddit.com/r/Tunisia/comments/34vf9k/,1,"&gt; Probably not as bad if you just visit but living here has been a complete change over life in the US my previous 36 years of living.

Try to hangout in Bars/Restaurant and look for people who you may ""agree"" with, i don't like to categorize humans but 90% of rich teenagers/young adults, metalheads, cannabis consumer, Gamers, ""hippies?"", (you get the idea?)  are people who you wont have any problem with, since most of them are atheist they don't have those barriers build up by religious beliefs. However, it's always going to be hard to act like you want in public, but things are changing ;)        ",2015-05-07 00:11:46
cr1nhdo,https://www.reddit.com/r/Tunisia/comments/34vf9k/,1,"&gt;  cannabis consumer

There aint no cannabis here. They only have that afghani shit they call zatla.",2015-05-07 18:25:30
cr1nvja,https://www.reddit.com/r/Tunisia/comments/34bu5o/,1,"Just kids playing around, you know tunisians.
This will be over in about a year.",2015-05-07 18:35:29
cr1px9o,https://www.reddit.com/r/Tunisia/comments/34vf9k/,1,"&gt;There aint no cannabis here. They only have that afghani shit they call zatla. 


Really :O !!?? 
i never tried it, but are you sure ? isn't the same thing ? if not what's the real name of ""zatla"" ? ",2015-05-07 19:27:07
cr1q5z7,https://www.reddit.com/r/Tunisia/comments/34vf9k/,1,.,2015-05-07 19:33:13
cr1qy2g,https://www.reddit.com/r/Tunisia/comments/34vf9k/,1,and what is the name of the shit they are selling ? i want to read about it,2015-05-07 19:51:57
cr1rikp,https://www.reddit.com/r/Tunisia/comments/34bu5o/,1,hhhhh shittiest gov ever bro !! this country is ruled by a bunch of old peaple .. they don't know the importance of internet and online-work !,2015-05-07 20:05:56
cr3r8cd,https://www.reddit.com/r/Tunisia/comments/31da9s/,1,"I am atheist and go to high school and everyday I try to push the limits ever so slightly more and test the reactions of my friends, some of them were like dude why do you ask these questions in Islamia, or did you really eat pork before or I get the ""A3oudh belleh3"" stuff sometimes.

Their comments are funny, slightly annoying sometimes. I just hope no one will spread the information and get a ""bad rep""",2015-05-09 18:07:29
cr3sgt8,https://www.reddit.com/r/Tunisia/comments/31da9s/,1,Nice.,2015-05-09 18:48:20
cr3ti0p,https://www.reddit.com/r/Tunisia/comments/31da9s/,1,"Are you Tunisian ?
",2015-05-09 19:24:34
cr3tqbd,https://www.reddit.com/r/Tunisia/comments/31da9s/,1,No Kuwaiti. Just wondering how it is over there after the revolution. ,2015-05-09 19:32:57
cr4e5wy,https://www.reddit.com/r/Tunisia/comments/34vf9k/,1,"The area you live in is actually really fine, plenty of new buildings, western architecture, I just love spending time there ! :-)",2015-05-10 10:41:46
cr4fztk,https://www.reddit.com/r/Tunisia/comments/34vf9k/,1,"Plenty of buildings being built.  Which means TONS of noise.  It's funny because coming back from Carefour I once counted 12 cranes building stuff.  There's 1 behind us, 1 to the side, 1 to the other side, a couple on the next block and one finished across the street like a year ago but no one has rented anything.

I'm hoping that within the next year it'll be similar to how Lac 1 is with a lot of stuff to do around except Cafes.  I know Tunisia has a lot of cafes but we have probably 15 within a very short walking distance.",2015-05-10 12:52:55
cr59fcx,https://www.reddit.com/r/Tunisia/comments/31da9s/,1,Exactly! They drink and smoke and lie and watch porn etc then call you a kefer. Lol,2015-05-11 06:07:39
cr7qnyh,https://www.reddit.com/r/Tunisia/comments/35t3t7/,1,Is it available only for professionals or for all?,2015-05-13 14:13:30
cr7smc7,https://www.reddit.com/r/Tunisia/comments/35t3t7/,1,"Same , if it's for all i'm soooo going to buy Gta V for this summer",2015-05-13 15:10:54
cr80ngy,https://www.reddit.com/r/Tunisia/comments/35t3t7/,1,"I think its available for public, since they sell them for about 10 DT in banks.",2015-05-13 18:40:41
cr8ea3f,https://www.reddit.com/r/Tunisia/comments/30iyus/,1,Shouldn't he be sat in a cafe listening to oum kalthoum? Hahaha loved it. 10/10,2015-05-14 00:50:54
cr98j43,https://www.reddit.com/r/Tunisia/comments/35acgt/,1,Love the username!,2015-05-14 20:01:54
crbtkuj,https://www.reddit.com/r/Tunisia/comments/365xpq/,1,"And you can't buy shit with it, hurray !",2015-05-17 10:22:26
crcttys,https://www.reddit.com/r/Tunisia/comments/36cvxb/,1,"We are not planning to go naked to a restaurant, but hey, if we can, why not? Just kidding, any advice is welcome.",2015-05-18 11:16:21
crcw3kl,https://www.reddit.com/r/Tunisia/comments/36cvxb/,1,Thanks. I can't hardly wait! I think the Arab culture is fascinating. ,2015-05-18 13:13:14
crd2qco,https://www.reddit.com/r/Tunisia/comments/36cvxb/,1,"Yeah, that's what I'm doing right now :) 

Thanks for the info though. What towns did you visit?",2015-05-18 16:40:59
crd4md2,https://www.reddit.com/r/Tunisia/comments/365xpq/,1,Why?,2015-05-18 17:32:29
crd4oox,https://www.reddit.com/r/Tunisia/comments/36cvxb/,1,"If you're planning to visit touristic areas then nothing is off limits basically.  
Which cities are you visiting?",2015-05-18 17:34:13
crd8a23,https://www.reddit.com/r/Tunisia/comments/36cvxb/,1,[deleted],2015-05-18 19:18:45
crdogej,https://www.reddit.com/r/Tunisia/comments/36cvxb/,1,"Our hotel was in Sousse, we also went to Carthage, Sidi Bou Said, Monastir, Mahdia, Sfax, Gabes, Kebili, Douz, Nefta, Tozeur, Gafsa, Jilma, and Kairouan... In between all of those was also the salted lake, the biggest in Tunisia, and the El Jem colosseum, very much worth visiting...

Hope you as much fun as I did!",2015-05-19 02:58:36
crduril,https://www.reddit.com/r/Tunisia/comments/365xpq/,1,"You can only buy hosting and books or something, your purchases are monitored.",2015-05-19 07:48:11
crduu3o,https://www.reddit.com/r/Tunisia/comments/35t3t7/,1,"You can't, there are specific stuff you can buy with it.",2015-05-19 07:53:09
crdwx5x,https://www.reddit.com/r/Tunisia/comments/365xpq/,1,E-commerce in Tunisia is one fucked up system.,2015-05-19 10:29:54
crdwyfh,https://www.reddit.com/r/Tunisia/comments/36cvxb/,1,"Walking around in a bikini top  away from the beach won't be apreciated pretty much anywhere. Even in a Country like Germany where nudism is a thing even the (female) chancelor likes to do, it would be considered weird to run arround in a bikini top in a city/town center...

About the ""arab culture"", this will be seen different by a large portion of the tunisian public, on the other hand a large portion of the tunisian public will agree with you...",2015-05-19 10:32:20
crf0g1m,https://www.reddit.com/r/Tunisia/comments/3455yk/,1,"I disagree. Wear sandals. The sand is EXTREMELY fine and will roll right out. If you wear shoes, it can get stuck in there and cause blisters.",2015-05-20 07:50:46
crheboo,https://www.reddit.com/r/Tunisia/comments/36vgpf/,1,[deleted],2015-05-22 13:20:39
crj9xzq,https://www.reddit.com/r/Tunisia/comments/36vgpf/,1,"Well, my goal is to try to keep it as cheap as possible.  Some coffee, tea, some cards, free things that would just require traveling to.  If we get about 6 or 7 people I can try to make up a small lunch for us to picnic with.",2015-05-24 12:52:51
crjp6r0,https://www.reddit.com/r/Tunisia/comments/374uoy/,1,"For further reading, press releases, videos, etc. Scroll through [this](http://tunisia.usembassy.gov/resources/president-beji-caid-essebsi-official-visit-to-the-united-states.html) ",2015-05-24 22:16:02
crkbxll,https://www.reddit.com/r/Tunisia/comments/36vgpf/,1,I'm in.. I guess.,2015-05-25 15:30:33
crkhug4,https://www.reddit.com/r/Tunisia/comments/36vgpf/,1,You sound excited lol,2015-05-25 18:32:51
crl99wk,https://www.reddit.com/r/Tunisia/comments/374uoy/,1,"So glad that Tunisia and the US are getting together.  As an American living here, it gives me some comfort that if things go bad here, we can help out.",2015-05-26 12:40:04
crlgx1f,https://www.reddit.com/r/Tunisia/comments/374uoy/,1,"I mean in my opinion, this is really just all for political show and necessity. We can't NOT support the ""success story"" of the Arab Spring. If you watch the [speech BCE gave to USIP](https://youtu.be/6oc8KFd_N3c) or read the [WashPo BCE-Obama co-authored article](http://www.washingtonpost.com/opinions/us-helping-tunisia-to-make-sure-democracy-delivers/2015/05/20/05b029e4-fe75-11e4-833c-a2de05b6b2a4_story.html) and you know even a little bit about post-revolution Tunisian politics, you know that its a lot of saving face and brushing things under the rug. But sure, being an American ex-pat in Tunisia, you won't be in too grave of danger in the event anything were to happen^which ^won't",2015-05-26 16:45:17
crmfz56,https://www.reddit.com/r/Tunisia/comments/37eai0/,1,"Most Tunisians on social networks are demanding to open the petrol and oil cases in Tunisia, and of course there are some people who always make things look satirical.
#وينو #البترول",2015-05-27 13:18:15
crn0pxh,https://www.reddit.com/r/Tunisia/comments/37eai0/,1,And What happened so far ?,2015-05-27 22:48:46
crnewjm,https://www.reddit.com/r/Tunisia/comments/36vgpf/,1,"/u/Stalked_Like_Corn yup, this must be done, this year's meetup will be in Ramadan so i don't drinking would be that easy in this city. and it could be timed at night (it's the only time everyone is ok after a long day of fasting :p)

At the moment i don't have any energy to think about a place, but La Medina would sound like a good idea since it's one of the best places to be in during Ramadan.

Just for the record, the last two meetups there were /u/theeldorrado (2013 and 1014) and /u/UR-ANUS (2014).

Anyway, this comment will definitely be updated. So Tunisian redditors, be more than 4!
",2015-05-28 06:58:15
crnfldc,https://www.reddit.com/r/Tunisia/comments/36vgpf/,1,"aww shite, your soul will be with us eldorrado.",2015-05-28 07:39:55
