id,url,score,body,date
crnge9s,https://www.reddit.com/r/Tunisia/comments/36vgpf/,1,"#####&amp;#009;

######&amp;#009;

####&amp;#009;
Section 3. [**The Flat Stanley Project**](https://en.wikipedia.org/wiki/Flat_Stanley#The_Flat_Stanley_Project) of article  [**Flat Stanley**](https://en.wikipedia.org/wiki/Flat%20Stanley): [](#sfw) 

---

&gt;

&gt;The Flat Stanley Project was started in 1995 by Dale Hubert, a third grade schoolteacher in [London](https://en.wikipedia.org/wiki/London,_Ontario), [Ontario](https://en.wikipedia.org/wiki/Ontario), Canada. It is meant to facilitate letter-writing by schoolchildren to each other as they document where Flat Stanley has accompanied them. Dale Hubert received the [Prime Minister](https://en.wikipedia.org/wiki/Prime_Minister_of_Canada)'s Award for Teaching Excellence in 2001 for the Flat Stanley Project.

&gt;The Project provides an opportunity for students to make connections with students of other member schools who have signed up with the project. Students begin by reading the book and becoming acquainted with the story. They create paper ""Flat Stanleys"" (representative drawings of the Stanley Lambchop character) and keep a [journal](https://en.wikipedia.org/wiki/Diary) for a few days, documenting the places and activities in which Flat Stanley is involved. Each student's Flat Stanley and its respective journal are mailed to other people who are asked to treat the figure as a visiting guest and add to his journal, then return them both after a period of time. The project has many similarities to the [travelling gnome prank](https://en.wikipedia.org/wiki/Travelling_gnome_prank) except, of course, for the Flat Stanley Project's focus on literacy.

&gt;Students may find it fun to plot Flat Stanley's travels on maps and share the contents of the journal. Often, a Flat Stanley returns with a photo or postcard from his visit. Some teachers prefer to use [e-mail](https://en.wikipedia.org/wiki/E-mail) for its quicker travel time.

&gt;

---

^Interesting: [^The ^Flat ^Stanley ^Project](https://en.wikipedia.org/wiki/The_Flat_Stanley_Project) ^| [^Sara ^Pennypacker](https://en.wikipedia.org/wiki/Sara_Pennypacker) ^| [^Chapter ^book](https://en.wikipedia.org/wiki/Chapter_book) 

^Parent ^commenter ^can [^toggle ^NSFW](/message/compose?to=autowikibot&amp;subject=AutoWikibot NSFW toggle&amp;message=%2Btoggle-nsfw+crnge9s) ^or[](#or) [^delete](/message/compose?to=autowikibot&amp;subject=AutoWikibot Deletion&amp;message=%2Bdelete+crnge9s)^. ^Will ^also ^delete ^on ^comment ^score ^of ^-1 ^or ^less. ^| [^(FAQs)](http://www.np.reddit.com/r/autowikibot/wiki/index) ^| [^Mods](http://www.np.reddit.com/r/autowikibot/comments/1x013o/for_moderators_switches_commands_and_css/) ^| [^Magic ^Words](http://www.np.reddit.com/r/autowikibot/comments/1ux484/ask_wikibot/)",2015-05-28 08:34:17
crnnzfo,https://www.reddit.com/r/Tunisia/comments/37eai0/,1,[deleted],2015-05-28 14:38:32
cropxe6,https://www.reddit.com/r/Tunisia/comments/37pn98/,1,"Welcome .
i can meet you but it depends on where you will land . I m at Monastir contact me if you want.",2015-05-29 12:22:06
crp4usb,https://www.reddit.com/r/Tunisia/comments/37pn98/,1,"Try and contact http://www.tunisia-live.net/
",2015-05-29 19:08:01
crpbtt1,https://www.reddit.com/r/Tunisia/comments/36xsah/,1,No comments yet?,2015-05-29 22:14:13
crq5vtu,https://www.reddit.com/r/Tunisia/comments/36vgpf/,1,Count me in!,2015-05-30 20:07:49
crqrhc8,https://www.reddit.com/r/Tunisia/comments/374uoy/,1,Tunisia got cucked into hosting a US base,2015-05-31 12:23:52
crrvrp6,https://www.reddit.com/r/Tunisia/comments/2y6bb0/,1,[deleted],2015-06-01 15:05:42
crswnn7,https://www.reddit.com/r/Tunisia/comments/385oi5/,1,"kay...

thnx bro 
",2015-06-02 12:41:57
crsx4qn,https://www.reddit.com/r/Tunisia/comments/385oi5/,1,Large supermarkets like Géant usually sells them.,2015-06-02 13:00:57
cryc8t2,https://www.reddit.com/r/Tunisia/comments/36vgpf/,1,"Hey guys, what's the status of the meetup?? ",2015-06-07 11:27:20
cryccfv,https://www.reddit.com/r/Tunisia/comments/37eai0/,1,"A silly irresponsible ""campaign"" ignited by the false hope that a natural resource is the magic solution to the country's issues.

70%* of the supporters believe they are in to get their ""share"" haha

Yesterday, they organised a rally downtown, they were outnumbered by policemen :p

^(*personal estimate.)
",2015-06-07 11:35:04
crydahh,https://www.reddit.com/r/Tunisia/comments/36vgpf/,1,Looking forward to hearing from you guys!,2015-06-07 12:40:27
crys1nx,https://www.reddit.com/r/Tunisia/comments/385oi5/,1,"As an American who has to import his Peanut Butter, it's not all shit just the ones here aren't good.  I have my dad send Peanut Butter with care packages pretty regularly.  I always get Jiff (you can google it :D) and it's good.  I wanted to get some here because /u/enti_san had never tried it and she grabbed some.  It was an oil slick nightmare.  That's when I said ""Screw it"" and just ordered some on amazon that my Dad sent.",2015-06-07 21:35:38
crys67n,https://www.reddit.com/r/Tunisia/comments/36vgpf/,1,"By the way, they are Redditors too :P  So good call on that. I contacted them and they are happy to have us and this will be the place we are meeting at.  You made a great suggestion so thank you.",2015-06-07 21:39:43
cryskj5,https://www.reddit.com/r/Tunisia/comments/38y6nm/,1,"Not that it matters much but can I find out more about the ages/gender of those who are coming?

This week is my exams week, I finish on Saturday so I'll try to make it, not 100% sure though.",2015-06-07 21:52:44
cryspgb,https://www.reddit.com/r/Tunisia/comments/38y6nm/,1,"No, just curious, I am 21-year-old Tunisian male myself :)",2015-06-07 21:57:07
crysswr,https://www.reddit.com/r/Tunisia/comments/38y6nm/,1,"Most redditors are about your age.  I think flesmih is 25ish, I'm 37, enti_san is 28.",2015-06-07 22:00:12
crysw5m,https://www.reddit.com/r/Tunisia/comments/38y6nm/,1,"I see. Looking forward to meeting you guys! Hope I can make it!  

Mokayshi Spirit is a great choice by the way, a couple of friends recommended it but I've never got to visit it.",2015-06-07 22:03:10
crzazg2,https://www.reddit.com/r/Tunisia/comments/38y6nm/,1,"ill be there , talll guy 6.3 , chubby ",2015-06-08 10:20:03
crzbdh4,https://www.reddit.com/r/Tunisia/comments/38y6nm/,1,ofcourse anything that will boost our numbers up ,2015-06-08 10:47:57
cs02beu,https://www.reddit.com/r/Tunisia/comments/36vgpf/,1,[deleted],2015-06-09 00:45:41
cs0ap49,https://www.reddit.com/r/Tunisia/comments/385oi5/,1,Usually in small stores which sells imported stuff we have two stores in lac2 that I know of and sell them let me know what area you are staying and perhaps could  help you find one.,2015-06-09 05:17:34
cs0at3w,https://www.reddit.com/r/Tunisia/comments/37pn98/,1,"If I had seen your comment I would have recommended a very cool young journalist , I m not sure if you are still in Tunis if you are around this Saturday perhaps you can join in for the meetup.",2015-06-09 05:22:13
cs0itp9,https://www.reddit.com/r/Tunisia/comments/385oi5/,1,"the only one i could found (Bizerte) is [this](http://www.butter-nutty.com/) and it literally taste like ""kakweya mta3 l'9léybi"" and the shitty part is that i only was able to found the salted one... ",2015-06-09 13:05:33
cs0itu8,https://www.reddit.com/r/Tunisia/comments/385oi5/,1,kay thanks i'll check it ,2015-06-09 13:05:42
cs0iv8k,https://www.reddit.com/r/Tunisia/comments/385oi5/,1,"[this](http://www.butter-nutty.com/nos-produits.html) the only one i was able to find in my city (Bizerte), i could order it too and have a friend send it but it usually take too much (i've waited about 1 month to get my graphic tablet from Amazon-&gt;Friend in Spain-&gt;Tunisia",2015-06-09 13:07:09
cs0jd4n,https://www.reddit.com/r/Tunisia/comments/385oi5/,1,"I had a package ""lost"" in customs.  Had Peanut Butter.  They think I don't know but I do.  Which store was it in?  I've seen some in Carrefour and debated trying a couple.  Most of the ones I see are ""Crunchy"" though and I like creamy.  ",2015-06-09 13:25:15
cs0k9q3,https://www.reddit.com/r/Tunisia/comments/385oi5/,1,"&gt; kakweya mta3 l'9léybi

LOL",2015-06-09 13:55:12
cs0kf0y,https://www.reddit.com/r/Tunisia/comments/385oi5/,1,"&gt; I had a package ""lost"" in customs. Had Peanut Butter. 
&gt; They think I don't know but I do. 

another reason why i buy all my electronic devices for double price from local stores...

&gt;I've seen some in Carrefour 

same one that i [posted](http://www.butter-nutty.com/nos-produits.html) or another brand ?

One last question please : 
How does it taste :3 ?? compared to the real peanut how close is it ? the one that i bought is **exactly** like [this](http://www.philippefaur.com/img/dyn/img-1293031563.jpg) i don't know if you are familiar with the word ""kakaweya"", it's a cheap salty  peanut that you can get anywhere, i don't ever remember eating a non-salty version of it though.  ",2015-06-09 13:59:47
cs0kn13,https://www.reddit.com/r/Tunisia/comments/385oi5/,1,"How does Jiff taste?  It tastes like peanuts.  Slightly salty but a little sweet too.  I've actually debated trying to make my own.  It's not very hard to do.  All you need is some oil, peanuts, and a little sugar.  if I do make some and it turns out okay, i'll let you know.  

As far as the brand?  I don't recall but they looked cheap so I never bothered.",2015-06-09 14:06:42
cs0lq13,https://www.reddit.com/r/Tunisia/comments/385oi5/,1,"&gt; It tastes like peanuts. Slightly salty

hmmm, am going to all supermarket here and try to find a non-salty version (i know it needs to be a little bit salty but the one i found is **very** salty), and i'll see how it goes, i don't think am going to get used to it but the thing is that am gonna put it in a [shake](https://www.youtube.com/watch?v=iN6zeDI2Dwg&amp;spfreload=10) so hopefully everything goes fine. thanks man :) ",2015-06-09 14:37:56
cs0m5jg,https://www.reddit.com/r/Tunisia/comments/385oi5/,1,"In the US they have reduced salt.  The one I typically eat has salt but not overly so.  (The US Brand I mean)  No more than you'd probably find on salted peanuts from a small store or even carrefour.  

There is this recipe you might wanna try making your own.  Control your own ingredients is always the best way to go. http://www.thekitchn.com/how-to-make-homemade-peanut-butter-cooking-lessons-from-the-kitchn-199110",2015-06-09 14:49:29
cs0yrzf,https://www.reddit.com/r/Tunisia/comments/385oi5/,1,"soo i got another one, same brand but not very salty, it taste a lot like peanuts (duh..) i think the only difference between this and the ""famous"" western one is that this is more ""liquid"" but since am just gonna use if for shakes it doesn't matters how it looks :) i just need the nutrition value  ",2015-06-09 20:07:56
cs2zfu0,https://www.reddit.com/r/Tunisia/comments/38y6nm/,1,"deRat here, 

While I'm a resident of /r/arabs it will be nice to come. I'm 26 with a mustache (male). I'll try my utmost to come. 

See you soon.

EDIT: PS: There are few Tunisians in /r/arabs , do you mind letting them know about the meetup?",2015-06-11 13:26:38
cs2zkmu,https://www.reddit.com/r/Tunisia/comments/38y6nm/,1,Will do!,2015-06-11 13:30:59
cs2zohn,https://www.reddit.com/r/Tunisia/comments/38y6nm/,1,[deleted],2015-06-11 13:34:34
cs57y1t,https://www.reddit.com/r/Tunisia/comments/38y6nm/,1,We  are already there!  Three already waiting for you. Guys!,2015-06-13 13:10:17
cs57z7a,https://www.reddit.com/r/Tunisia/comments/38y6nm/,1,Hey! We are already there guys waiting up for you!,2015-06-13 13:12:04
cs59zb0,https://www.reddit.com/r/Tunisia/comments/38y6nm/,1,"Drat - I just saw this, and I'm over in Marsa. How late will people be there? I might be able to get my act together and head that way later.",2015-06-13 14:45:37
cs5bkt0,https://www.reddit.com/r/Tunisia/comments/38y6nm/,1,Probably until about 6 or more.,2015-06-13 15:48:35
cs5bs69,https://www.reddit.com/r/Tunisia/comments/38y6nm/,1,We are still around come join us!,2015-06-13 15:56:05
cs5ebw8,https://www.reddit.com/r/Tunisia/comments/38y6nm/,1,We are still here. This will go probably to 8 at latest. We just had another show up so you should come if you can.,2015-06-13 17:24:50
cs5eraq,https://www.reddit.com/r/Tunisia/comments/38y6nm/,1,"I got pulled into a work thing, but I'll see if I can close it out and head over. Not sure if I can, but I'll see what I can do.",2015-06-13 17:39:26
cs5f2ah,https://www.reddit.com/r/Tunisia/comments/38y6nm/,1,Hope you can. Having a blast. Entisan and I will be leaving at 8 as I have a work commitment tonight.,2015-06-13 17:49:44
cs5j555,https://www.reddit.com/r/Tunisia/comments/38y6nm/,1,Yeah sorry man we didnt get to meet today. We are already out. Perhaps next time.,2015-06-13 20:11:29
cs5lgrb,https://www.reddit.com/r/Tunisia/comments/38y6nm/,1,Entirely my fault. I should have checked to see what was going on before today...,2015-06-13 21:32:03
cs60s0c,https://www.reddit.com/r/Tunisia/comments/38y6nm/,1,I couldn't make it sadly! :(,2015-06-14 08:30:11
cs6k54m,https://www.reddit.com/r/Tunisia/comments/39lkpu/,1,[deleted],2015-06-14 22:20:43
cs73bfa,https://www.reddit.com/r/Tunisia/comments/39svgn/,1,"Interesting, but I can't find my family name :(",2015-06-15 11:42:18
cs7qufw,https://www.reddit.com/r/Tunisia/comments/39preu/,1,Damn dude it doesnt make sense that you guys didn't go bowling! lol,2015-06-15 23:15:23
cs8eumg,https://www.reddit.com/r/Tunisia/comments/3a1nu3/,1,[deleted],2015-06-16 15:11:28
cs8wyqk,https://www.reddit.com/r/Tunisia/comments/39svgn/,1,I'm a Amaimi from Sidi Bouzid but in the map it's a little off to the south,2015-06-16 22:47:56
cs9gjon,https://www.reddit.com/r/Tunisia/comments/39z868/,1,What's that team? ,2015-06-17 12:04:33
cs9iph4,https://www.reddit.com/r/Tunisia/comments/39z868/,1,Man they are from China!,2015-06-17 13:30:37
cs9likw,https://www.reddit.com/r/Tunisia/comments/39z868/,1,"Okey so if we suppose that the best players in the world have the rate of 10/10, Tunisians are like 4/10 in average, and Moncer could possibly be 3/10.",2015-06-17 14:57:05
csahkd6,https://www.reddit.com/r/Tunisia/comments/3a7chr/,1,I will try to do do some workout. But this can be challenging as I work full time also. ,2015-06-18 07:31:22
csai7no,https://www.reddit.com/r/Tunisia/comments/3a7chr/,1,I have to imagine that's hard when you can't eat.  I'm going to be moving my walking/exercise to the evenings.,2015-06-18 08:13:40
csaidq0,https://www.reddit.com/r/Tunisia/comments/3a7chr/,1,Mostly eating and sleeping.,2015-06-18 08:25:06
csjasl0,https://www.reddit.com/r/Tunisia/comments/3b6lrq/,1,"It's on the radio, it's also on /r/worldnews",2015-06-26 11:49:24
csjdn7o,https://www.reddit.com/r/Tunisia/comments/3b6lrq/,1,"I am not saying that.

My point, which is more of a rant honestly, is that Tunisia *had* an effective domestic intelligence infrastructure. Where is it now?!",2015-06-26 13:45:47
csjj1vr,https://www.reddit.com/r/Tunisia/comments/3b6ajm/,1,"Mostly staying at home watching movies and whatnot.  
There isn't much to do, even if there is, not in this heat.",2015-06-26 16:12:41
csjnydo,https://www.reddit.com/r/Tunisia/comments/3b6lrq/,1,"Yeah haha our taxi drivers love talking.
Great to see you're settling in well in our country, we really have no grudge against anyone, all our welcome. :)",2015-06-26 18:15:11
csjp0fh,https://www.reddit.com/r/Tunisia/comments/3b6ajm/,1,[deleted],2015-06-26 18:41:59
csjy2sa,https://www.reddit.com/r/Tunisia/comments/39preu/,1,Where did you meet? ,2015-06-26 22:50:14
csjyxwk,https://www.reddit.com/r/Tunisia/comments/3b6lrq/,1,It's now sitting at 38 dead and 39 injured ,2015-06-26 23:17:18
cskbqct,https://www.reddit.com/r/Tunisia/comments/3b6lrq/,1,"Prime minister calls the army reserve and declares multiple mountainous regions ""military areas"".",2015-06-27 07:39:15
cskekqt,https://www.reddit.com/r/Tunisia/comments/3b6lrq/,1,"Hey guys, questions.

What happened to the gunmen? How many were there? Did they just like roll up in vans and jump out and shoot up the place? Did they get away or did the police catch them? Massive manhunt? ",2015-06-27 11:22:27
cskko1y,https://www.reddit.com/r/Tunisia/comments/3b6lrq/,1,"Turns out it was a one man act, second man is innocent and was released around 10pm last night. ",2015-06-27 16:13:58
cskn1if,https://www.reddit.com/r/Tunisia/comments/3b6lrq/,1,I was wondering why they hadn't said anything on the radio about others.  It's hard to imagine THAT many people dead is because of one douche canoe.,2015-06-27 17:33:11
csl1wna,https://www.reddit.com/r/Tunisia/comments/3bd45q/,1,hamma ,2015-06-28 02:13:44
csl8w14,https://www.reddit.com/r/Tunisia/comments/3b6lrq/,1,"Well, it is a choice for Tunisia, either foster muslim extremism or join the modern world. They're incompatible.",2015-06-28 07:34:07
cslqknk,https://www.reddit.com/r/Tunisia/comments/34vf9k/,1,[deleted],2015-06-28 21:16:21
csmedzv,https://www.reddit.com/r/Tunisia/comments/3bhmvh/,1,[deleted],2015-06-29 14:34:44
csmvym2,https://www.reddit.com/r/Tunisia/comments/3bhmvh/,1,"Thanks for the response, its making me feel more confident in the trip. I guess I look silly asking if my money is really enough, but in the US I am the most poor person. My rent for my one room is 600 dollars and this is a deal. For utilities, eating, drinking, traveling and everything I can't spend more than that. 
",2015-06-29 22:20:45
csn6ruk,https://www.reddit.com/r/Tunisia/comments/3bl9zs/,1,"I would say 25% idiocy (idiots easy to manipulate, i think i can make a fight club here), 25% poverty (maybe not that much, no one sleeps hungry here), 50% anger (getting beat up by cops, by teachers, by parents, seeing people getting favors in front of you all the time while you stand in a line, taking your spot in jobs or college, that would do it for some people). i hope this helped :)",2015-06-30 03:48:12
csn8ean,https://www.reddit.com/r/Tunisia/comments/3bl9zs/,1,"You have to keep in mind that in spite of the decent education system in Tunisia, there were still plenty of structural factors that lead the people to believe that a revolution was necessary. The revolution hasn't necessarily solved their problems and that frustration with the entire system is building. ISIS has a powerful message that legitimately sells in conditions like these. It isn't just meant to appeal to the poor and uneducated masses, and not everyone who joins ISIS is stupid. ISIS is attracting economists, engineers, writers, cosmopolites, statesmen; you can see it in the sophistication of their ""state"" apparatuses.  
  
Tunisians aren't going to be impervious to the ISIS message just because of education - there needs to be legitimately believable alternatives, with actual progress and not just the illusion of it, in which they can invest their idealism. If anything, education makes Tunisians harder to fool in this regard - they can't just be pumped full of propaganda telling them that the state is forging a perfect path towards a better future, unlike the Egyptians.",2015-06-30 04:46:30
csn9ulq,https://www.reddit.com/r/Tunisia/comments/3bl9zs/,1,"&gt; no one sleeps hungry here

I lol'd",2015-06-30 05:47:29
csn9xdy,https://www.reddit.com/r/Tunisia/comments/31sj1t/,1,You fortune teller you,2015-06-30 05:51:14
csn9yjw,https://www.reddit.com/r/Tunisia/comments/31sj1t/,1,Thanks for the advice my friend :) lucky i listened,2015-06-30 05:52:49
csn9zwo,https://www.reddit.com/r/Tunisia/comments/3bl9zs/,1,Thats some next level english right there! lol,2015-06-30 05:54:36
csna0d7,https://www.reddit.com/r/Tunisia/comments/3bl9zs/,1,"&gt; Thats some next level english right there! lol

haha",2015-06-30 05:55:10
csnkmdy,https://www.reddit.com/r/Tunisia/comments/3bhmvh/,1,"Haha thank you, I love your story. Your wife is very kind to give you a pre-written card like that! I think I'm pretty relaxed as far as my standards go, I grew up camping in the mountains (think uncomfortable) and part of my interest in heading to Tunisia is to distance myself from Americas mega products like coke or processed foods. I work in the farmers market in San Diego and I'm fine with the temporary nature of fresh seasonal foods. 
It sounds like I'll just miss my family. 
Unless it's all squat toilets there with no toilet paper. Any bathroom tips? ",2015-06-30 14:55:17
csnl2ob,https://www.reddit.com/r/Tunisia/comments/3bhmvh/,1,"I've not seen a single squat toilet.  All bathrooms I've seen have toilet paper and if not, you can ask for some.  They all have the hose thing but I'm not for that.  One thing I would suggest is carry a backpack if you go to a cafe or something like that and grab some baby wipes.  The toilet paper here, in general, leaves a lot to be desired and I get better results with the wipes.

You'll still find some mega products here.  Most of it is snack foods though like Cheetos, Bugles, Coke, you can find Pepsi in some places but not 100% of the time.  Also, it's not just seasonal foods that disappear.  Sometimes it's water you may prefer (Always buy bottled water.  Out of the spigot tastes like pool water.  Okay to cook with but has a strong chlorine taste) or crackers or even hamburger or fish or something along those lines.

Oh, also with bathrooms, I've found that most are REALLY tiny.  I've been in probably 8 or 9 and only 1 has been of a good size.  You got enough room for a toilet, for you to stand, and a sink immediately behind you.  Just make sure the first month or so you go out to cafes or whatever you go with your friend.  There are some things that may be new to you.  You'll be asked by people selling flowers if you want to buy some.  Up to you if you want to buy some.  I think they smell good but I don't always buy them.  Also, nothing is free in cafes.  If you ask for cards, you get charged and you don't get to keep the cards (I found this out recently &gt;.&gt;), tipping is minimal.  You can leave just a couple dinar (which is about $1) and that's good.  You'll notice that some things are EXTREMELY cheap here.  I can buy a 20oz Coke Zero, a bag of chips and some fresh, still hot bread, and a can of tuna for about $3.50 USD.  Makes for a great lunch btw.",2015-06-30 15:07:29
csnmfju,https://www.reddit.com/r/Tunisia/comments/3bhmvh/,1,"Here's a question, what kind of small portable gifts could I bring for people from the U.S.? I was thinking mini colognes from a famous brand or something. Makeup, glasses, anything? ",2015-06-30 15:42:45
csnmnp2,https://www.reddit.com/r/Tunisia/comments/3bhmvh/,1,"Colognes can be bought here everywhere.  Same with makeup and glasses.  Depending on the person they may want food items.  Or if you're from Seattle, maybe some Seattle shirts (not sports teams just nice shirts with ""Seattle"" on them somehow) somewhat like [this](http://s3-us-west-2.amazonaws.com/hypebeast-wordpress/image/2011/05/stussy-space-needle-t-shirt-0.jpg).  I think you said you're from Seattle, if I'm wrong then just a t-shirt similar from your state.

Shirts with the American flag are worn here too (surprising to me) but they seem to love the US Flag.  Or a Yankees Hat?  Seen QUITE a few of those.",2015-06-30 15:48:34
csnotuv,https://www.reddit.com/r/Tunisia/comments/3bhmvh/,1,Ok so America shirts and San Diego hats. I guess I was thinking they would think that was cheesy but I can round up like 20 California caps and hand em out if that's what the people want!,2015-06-30 16:43:50
csnp8ki,https://www.reddit.com/r/Tunisia/comments/3bhmvh/,1,"Well I don't have 600 for rent, I have a budget per month of 600 total for rent, utilities, food, entertainment, life. I'm hoping I can get a 2 bedroom apartment so I can offer guests to stay. ",2015-06-30 16:53:42
csnt2d9,https://www.reddit.com/r/Tunisia/comments/3bhmvh/,1,I'd go with California shirts.  Nice ones that are fairly stylish.  Or maybe like SD Zoo ones.,2015-06-30 18:27:29
csolh9i,https://www.reddit.com/r/Tunisia/comments/3bqjlh/,1,I don't think you can. Candidates with the baccalaureate as the last  degree start from the beginning ( i'm talking about ESPRIT),2015-07-01 12:12:06
csolvdo,https://www.reddit.com/r/Tunisia/comments/3bqjlh/,1,"okay thank you, do you have any other recommendation ? ",2015-07-01 12:30:51
csom5jt,https://www.reddit.com/r/Tunisia/comments/3bqjlh/,1,what are you studying in ISET Bizerte ?,2015-07-01 12:43:29
csp0yk8,https://www.reddit.com/r/Tunisia/comments/3bl9zs/,1,"ISIS is a horrid terrorist group that none of us support in our country, they have repeatedly killed our soldiers, police officers and staged terrorist attacks like last week's.

I'm a university student and the first reason that comes to mind from these statistics is the high unemployment rate here and if you can't succeed in your studies you're doomed to stay unemployed unless you get lucky.

They use people like them who have no hope left and brainwash them, promising them money, a purpose(a stupid one) and glory(glory my ass).

You have to keep in mind, education over here is not that bad and ISIS isn't a bunch of idiots running around with guns, they have engineers, educated people, people that studied in the US and all across Europe joining them, they're a well organized terrorist group who knows who's funding all of that.",2015-07-01 19:24:04
csp9ask,https://www.reddit.com/r/Tunisia/comments/3bqjlh/,1,"""Technologie de l'informatique : systèmes embarqués et mobiles"" 

i like IT but i was kinda forced to choose that specialty, hardware programming is not my thing. ",2015-07-01 23:03:52
csppnmi,https://www.reddit.com/r/Tunisia/comments/3bu4qv/,1,Well. The Manar campus isn't that far if you come to think about it.,2015-07-02 10:03:52
csrhkz1,https://www.reddit.com/r/Tunisia/comments/3c1stv/,1,[deleted],2015-07-03 23:42:44
