id,url,score,body,date
cpotelb,https://www.reddit.com/r/Tunisia/comments/300o3q/,2,"Check the website post.tn, i remember that I saw something about how much you have to pay for the weight of the package.  They shouldn't be allowed to see its content. ",2015-03-24 05:06:37
cpt83z2,https://www.reddit.com/r/Tunisia/comments/300o3q/,2,"yeah that's what i did, my friend will send me the tablet next week and we'll see what happens, i will make a detailed post once i have it (or not) in case someone else needed these info. Thanks ",2015-03-28 02:52:34
cq4jl28,https://www.reddit.com/r/Tunisia/comments/31sj1t/,2,[deleted],2015-04-07 20:51:31
cqrm1xc,https://www.reddit.com/r/Tunisia/comments/3455yk/,2,"Do NOT wear sandals. The sand is burning hot, I'm not sure if you are aware but the Sahara is hot. I was only there for a day excursion in Tunisia and I wore tennis shoes and was fine. If you're out there awhile then probably hiking boots to minimize the amount of sand that gets in your shoes. 

I'm sure you know this because it's obvious but bring a ton of sunscreen. Tunis will probably be your last chance to get some. You burn quickly out there. Have fun, it was one of the most memorable moments of my life! ",2015-04-28 16:59:10
cqz1caa,https://www.reddit.com/r/Tunisia/comments/34vf9k/,2,"That's been my assumption as well, i'm glad to hear that people feel safe. ",2015-05-05 13:21:21
cqz97ds,https://www.reddit.com/r/Tunisia/comments/34bu5o/,2,"**آي توتالّي أڨري ويذ يو**

الظاهر بش يرزونا فيها الكريديت كارد",2015-05-05 17:09:52
cr04fwi,https://www.reddit.com/r/Tunisia/comments/34vf9k/,2,"I'm a bit worried about it.  I'm from the US and here living so if they do get here, I may be a little more at risk than others.  However, I live surrounded by security with cameras, locks, etc so it would be difficult to get in here.  Also, the US Embassy (sanctuary) is as easy as getting in the car and driving for about 45 seconds.",2015-05-06 12:06:11
cr05ih1,https://www.reddit.com/r/Tunisia/comments/34vf9k/,2,"Do you work in the embassy there? 
",2015-05-06 12:53:17
cr05mrn,https://www.reddit.com/r/Tunisia/comments/34vf9k/,2,"Nope i just live very very close to it.  I could walk to it very quickly but, if shit got bad here fast, much rather drive.  I actually live across the street from the Canadian embassy and could probably seek shelter there if I had to.  It literally is across the street so I'd just need to run 30 feet.",2015-05-06 12:58:03
cr05tet,https://www.reddit.com/r/Tunisia/comments/34vf9k/,2,"Interesting. Do you mind if I ask what you are doing in Tunisia? I'm an American as well and have had an interest in going to Tunisia for some type of study abroad program myself. 
",2015-05-06 13:05:27
cr05y7p,https://www.reddit.com/r/Tunisia/comments/34vf9k/,2,"I met a woman online and she was having issues trying to get into the US so, I came here.  Been married for nearly 7 months now.  So, love? =)  It is a great place but living here brought on some cultural shocks that I've had to grow accustomed to.  Probably not as bad if you just visit but living here has been a complete change over life in the US my previous 36 years of living.",2015-05-06 13:10:31
cr0apak,https://www.reddit.com/r/Tunisia/comments/34vf9k/,2,"Damn i'm glad you are ok now, i'm happy for you, women like this are rare, really rare. :)",2015-05-06 15:34:02
cr0uxrw,https://www.reddit.com/r/Tunisia/comments/34bu5o/,2,"fuck it  -___- 
plus 1000dt/year, i can handle that without the ""government help"" ",2015-05-07 00:17:48
cr3gwm9,https://www.reddit.com/r/Tunisia/comments/35acgt/,2,"It was general carelessness; unemployment poverty strikes were all hidden and taboo
Tunisians lived in a kind of indifference.. every man for himself.",2015-05-09 10:32:52
cr3hfwa,https://www.reddit.com/r/Tunisia/comments/35acgt/,2,"What the revolution did was show our society for what it truly is.

During Ben Ali everything was kept hidden. Corruption was everywhere, the police could do literally anything they wanted to you and people couldn't talk about a lot of things out of fear of being arrested.

Some people would disagree with me but i'm convinced the revolution is a good thing",2015-05-09 11:15:41
crcvqb4,https://www.reddit.com/r/Tunisia/comments/36cvxb/,2,"In most touristic cities  you'll be regarded as tourists so no one what you are wearing. You'll probabl get away with anything. Although you shuld refrain from kissing in old towns, if you happen to be visiting one, it's seen as impolite. But mostly enjoy your stay.",2015-05-18 12:57:24
crhthj3,https://www.reddit.com/r/Tunisia/comments/36vgpf/,2,Cool! Anything you'd like to do?  Got any cards?  Any board games?,2015-05-22 21:00:08
crigjro,https://www.reddit.com/r/Tunisia/comments/36vgpf/,2,"Well Obviously I am in, so hopefully this year we will break a record of 4 from last year. I m still rethinking what we could do as a fun activity... other than meeting up in a cafe...karaoke anyone ?",2015-05-23 15:01:02
crj86ni,https://www.reddit.com/r/Tunisia/comments/36vgpf/,2,y why not ,2015-05-24 10:46:19
crja4mk,https://www.reddit.com/r/Tunisia/comments/36cvxb/,2,"Hey!  I'm an American currently living here and some things to do/don't do.  Some are already covered:

Holding hands or sitting close to each other at a table is perfectly fine.  Don't be overly affectionate though.  Kissing in public isn't done much here either.  I think you could do it and no one would say anything but the locals don't do it.

I'm not sure what part of Tunisia you're going to be in but I'm assuming Tunis.  Make sure to go to the pier in Lac 1 and Lac 2 (Lac 1 has more things like bowling and amusement park rides and such as Lac 2 is just now still being built up).  I'd try some of the cafes.  Golden Cafe in Lac 2 is good as well as the new Omega Cafe, also in Lac 2.  Cooks in Sidi Bou Said is freakin' amazing.  Sidi Bou Said itself is pretty nice too.  Lots of blue and boats and all that so if you're up for walking, it's gorgeous.

I'm not sure if you're into geocaching but if you are, try to find some geocaches and they will help you pick some destinations that most likely have some great cultural or scenic things to view.  

Go see the Ruins of Carthage.  There is a tour guide there that speaks French, English, I think German, Arabic, and Tunisian.  She does charge but she's great.  Her English leaves a little to be desired and you may need her to slow down a little to understand her.  She gets really excited about the history so she may talk quickly.  She will tell you a LOT of stuff and though the ruins aren't very large, It'll be about an hour just having her showing you around and explaining things.

If you see street vendors (Not stores, but just random makeshift places selling stuff), haggle with them.  Don't try to get away with a steal but most will be willing to go a little lower in prices and maybe throw in a few things for the money.  

If you're from the US (doubtful but, possible lol) let me know when you're here.  Would be great to meet you.  Don't get a lot of Americans here so I miss them.  Also, there is a place here, not sure if you want to visit it, called The Family Place.  They have a special breakfast on the first sunday of every month.  It's an all American breakfast with some really great food.  I look forward to it every month now as everyone speaks English (most people who run it are Americans) and makes me a little less home sick =)

I'm not sure how fit you are but Lac 1 and Lac 2 are connected via a boardwalk.  It's REALLY really long.  If you're up for a really long walk, it's great to be on the sea side and see a lot of people and things.  Lots of great restaurants up and down the boardwalk too in both Lac 1 and 2.

If you want to visit other places like Bezert or Sousse /u/Enti_San can probably give you more information than I can on what to see/do when visiting.

Oh, also, don't go to the southern region of the country.  Also, register with your embassy while here for any sort of emails or warnings and all that noise.",2015-05-24 13:03:29
crjcwq5,https://www.reddit.com/r/Tunisia/comments/36vgpf/,2,An amazing suggestion.  I will definitely look into this and see what we can do about meeting up here.  I'm sure they'd be okay with us playing cards and hanging out and such too.,2015-05-24 15:03:56
crjdlkr,https://www.reddit.com/r/Tunisia/comments/36vgpf/,2,great :),2015-05-24 15:30:07
crjgtfz,https://www.reddit.com/r/Tunisia/comments/36vgpf/,2,Just looked at some of the pictures and they have Moe Syzlack hanging up.  This is where the meetup will be happening.  I'm a HUUUUUGE fan of The Simpsons.,2015-05-24 17:22:55
crjoqe0,https://www.reddit.com/r/Tunisia/comments/36vgpf/,2,*excellent*,2015-05-24 22:00:06
crnfdsm,https://www.reddit.com/r/Tunisia/comments/36vgpf/,2,Sadly I won't be coming this year cuz I'm abroad.,2015-05-28 07:26:33
crngclm,https://www.reddit.com/r/Tunisia/comments/36vgpf/,2,"From what i'm seeing, Ramadan isn't predicted to be until 18th so we should be fine.  The predictions aren't usually off by 5 days right?  Usually it's just a day or two that I've seen.  Going to start a modmail after sending this so we can do some planning.  I'm hoping we get 10 people to come.  Blow the doors off the previous records.",2015-05-28 08:30:56
crngdm9,https://www.reddit.com/r/Tunisia/comments/36vgpf/,2,Oh man that sucks.  When are you coming back?  My goal is to use this as a jumping point to get these things to happen more often.  It just takes a lot of planning and I've not had the time/resources to do it.  So hopefully you can come to something in the future.,2015-05-28 08:32:58
crnge77,https://www.reddit.com/r/Tunisia/comments/36vgpf/,2,We'll carry around a picture of him lol.  Take funny pictures of him doing silly stuff.  Sort of like [Flat Stanley](http://en.wikipedia.org/wiki/Flat_Stanley#The_Flat_Stanley_Project),2015-05-28 08:34:09
crsuj29,https://www.reddit.com/r/Tunisia/comments/385oi5/,2,"I see it sometimes in ~~stores~~ markets like Monoprix , and bought it 

It tasted like shit and i really REALLY don't recommend it, it probably wasn't the true taste of peanut butter i don't know i never tasted a legit one before but that one tasted awfully like a bitter medicine.

If you can't find it anywhere try making your own at home",2015-06-02 10:49:24
cryd7wa,https://www.reddit.com/r/Tunisia/comments/36vgpf/,2,Meetup announcemnt will be posted tonight.  I'm currently in Sousse with /u/enti_san with her parents but there will be a post later tonight when we're back in Tunis.,2015-06-07 12:35:51
crysmxq,https://www.reddit.com/r/Tunisia/comments/38y6nm/,2,Male and Female (at least 1) age ranges probably 20-38.  Is there a particular reason you need to know?,2015-06-07 21:54:54
crzb3wm,https://www.reddit.com/r/Tunisia/comments/38y6nm/,2,"I'll out chub ya chubs :D

Good to know more will be there!  The person I spoke to on Facebook said they were excited about the meetup being at their place since they're fellow Redditors so, do they count as coming to the meetup do you think?",2015-06-08 10:29:02
cs0lkfr,https://www.reddit.com/r/Tunisia/comments/385oi5/,2,ti berrasmi :p ,2015-06-09 14:33:41
cs5loyb,https://www.reddit.com/r/Tunisia/comments/39pb7s/,2,"People are seriously going to watch the 2017 Africa Nations Cup after what happened in the last one, what a depressing sport, i don't why Tunisians keep watching it, addicted to heartbreak i guess :s",2015-06-13 21:40:04
cs5ns8j,https://www.reddit.com/r/Tunisia/comments/39preu/,2,[deleted],2015-06-13 22:54:09
cs5onsv,https://www.reddit.com/r/Tunisia/comments/39lkpu/,2,Collective bipolarism. Allright then:),2015-06-13 23:26:00
cs60sjy,https://www.reddit.com/r/Tunisia/comments/39preu/,2,Nice shirt! Dude!,2015-06-14 08:31:22
cs60u0l,https://www.reddit.com/r/Tunisia/comments/39lkpu/,2,"Feel free to wear it! People won't be concerned about what you are wearing .

It is worth noting that the number of Tunisians who used #JeSuisCharlie on social media, probably, surpassed that of French people haha",2015-06-14 08:34:20
cs64dww,https://www.reddit.com/r/Tunisia/comments/39preu/,2,"It was great to meet you all, I hope in the next ones, more people will come. ",2015-06-14 13:03:06
cs8o49r,https://www.reddit.com/r/Tunisia/comments/39z868/,2,Are you Mohamed Moncer?,2015-06-16 18:59:38
csahega,https://www.reddit.com/r/Tunisia/comments/3a7chr/,2,"This weekend /u/enti_san and I are going to visit her Parents.  I'm not sure what else we're doing.  This is my first full Ramadhan here as well as my first as a Muslim.  I am ""cheating"" a bit as I'll be drinking water (doctors orders) but will be abstaining from eating.",2015-06-18 07:21:34
csahheq,https://www.reddit.com/r/Tunisia/comments/3a2tzy/,2,"I have to say I'm amazed at some of the daring acts people do around trains here.  The article states how the infrastructure is ""run down"" causing accidents but I'm betting that this is a case of the truck driver being on the tracks.

I've seen people run right in front of trains, people stay parked on tracks and the train having to stop.  I think it's a lack of people understanding the devastation.",2015-06-18 07:26:23
csanaml,https://www.reddit.com/r/Tunisia/comments/39z868/,2,"he's more like a winger. fast enough to be dangerous in the area. And yes he is in the National team, scored once or twice i guess.",2015-06-18 13:13:21
csayg73,https://www.reddit.com/r/Tunisia/comments/3a2tzy/,2,"i don't think its ""lack of people understanding the devastation"", because this happens a lot, even to people on foot, i'm not saying i know what it is but trust me, its not ""lack of people understanding the devastation"".",2015-06-18 18:09:32
csbe6h8,https://www.reddit.com/r/Tunisia/comments/3a7chr/,2,"Check if your gym opens after fasting , because some of them open from 21:30 to 23:00 so it's easier working out once you've eaten and drank enough",2015-06-19 01:20:03
csjcn1d,https://www.reddit.com/r/Tunisia/comments/3b6lrq/,2,"I can't see a solution to this. The cops have been catching extremists for a long time now and yet it's only been 3 months since the last major attack. Not to mention the western mountains which have become some sort of a front line with the army entrenched and bombarding every now and then.
We have to find a new approach to this.",2015-06-26 13:10:57
csjd4ys,https://www.reddit.com/r/Tunisia/comments/3b6lrq/,2,You would have the cops interrogate mosque goers again?,2015-06-26 13:28:47
csjo3p9,https://www.reddit.com/r/Tunisia/comments/3b6ajm/,2,yes! I messaged some in the area on Facebook to ask their hours and they close at 3am.... I am SO going to a cafe at like 2am.  I might go tonight for shisha.,2015-06-26 18:18:52
csjotn4,https://www.reddit.com/r/Tunisia/comments/3b6ajm/,2,Haha that's the spirit!,2015-06-26 18:37:09
cskelvu,https://www.reddit.com/r/Tunisia/comments/3b6lrq/,2,1 was shot dead.  1 was captured.  I think 2 were on the loose but haven't heard anything yet.  They came from the beach area.  Just walked upu and started shooting.  There was/is a manhunt for the others and the people who helped them.  Will update with more information later when wife gets home.,2015-06-27 11:24:47
csl8x38,https://www.reddit.com/r/Tunisia/comments/3ba9o3/,2,"Well,  Tunisia can wave goodbye to tourism until the country gets its act together.",2015-06-28 07:35:56
csl9t36,https://www.reddit.com/r/Tunisia/comments/3b6lrq/,2,"Oh no, Tunisia doesn't have to foster muslim extremism or join the modern world, Tunisia needs to stop giving youngmen reasons to fuck shit up :)",2015-06-28 08:38:51
csmaltq,https://www.reddit.com/r/Tunisia/comments/3bhmvh/,2,"hi jojotunis 

, concerning your security , do not worry , i mean that tunis is a big city ,you can get mugged if you are in the wrong place and the wrong time as every other big city in the world but there is no threat for your person because you are American  , if your Tunisian friend could show you around and help you to find an apartment you will be ok .

""I've ended up with an extra 600 dollars a month (this is enough right?)"" , dude! that more than the income of 75% of Tunisians",2015-06-29 11:57:53
csmk03o,https://www.reddit.com/r/Tunisia/comments/3bhmvh/,2,"Dude, you will be incredibly fine. And having a Tunisian friend around would make a better experience for you, and I guess more secure. Tunisians will show you the right places to go and I think that is not as scary as we see in the news, once you get there and walk in the street, you will understand what I mean. Terrorists are just recreant and they fooled all the people before, but I don't think that they will be able to do it again because they made everyone extremely vigilant. I hope that you will enjoy your stay and don't worry about the language, English is a third language and probably is beginning to compete with french in Tunisia. ",2015-06-29 17:10:43
csmk2iy,https://www.reddit.com/r/Tunisia/comments/3bhmvh/,2,"&gt; Bien, merci. Ca Va? Bonjour, bon voyage, menage a trois

Man, that escalated quickly !",2015-06-29 17:12:24
csmz78m,https://www.reddit.com/r/Tunisia/comments/3bhmvh/,2,"Hey there! I live 3 minutes from Bourguiba School and I can assure you everything will be alright. The area is a bit noisy but you get used to that. Concerning your budget, you'll live like a prince with those extra $600. If you need any help finding an appartment or getting to know the city, I'll be more than happy to help. Welcome to Tunisia buddy!",2015-06-29 23:55:48
csn0bxq,https://www.reddit.com/r/Tunisia/comments/3bhmvh/,2,"600$ is more than enought for rent , actually you can find a pretty good spacy villa/apartment for that in rich areas.",2015-06-30 00:29:00
csnh88c,https://www.reddit.com/r/Tunisia/comments/3bhmvh/,2,"Well hello fellow American!

I have been here since July 25th last year and let me tell you, you're in for a treat.  When I first arrived I felt like a fish out of water.  Hell, I felt like a monkey in a fish tank that's how out of place I was.  Fast forward to nearly a year later and I fucking LOVE it here.  I miss the US, don't get me wrong.  But when I think about it what I miss are my family and friends the most, that's it.  I've tried very hard to acclimate myself to the culture and traditions here and it's been a great thing.  I now go to cafes at midnight and smoke Chicha (spelling may be wrong, it's Hookah).  I talk to people as best as I can.  My wife, thankfully, has helped me by making some cards so I can go to the store, her work, a pharmacy, or the hospital pretty easily just by handing them a card.  I've picked up some Arabic, Tunisian, and French with my stay here.

Have you friend teach you a few things.  Get used to life on a tougher difficulty mode though.  In the US you can live without leaving your house, ever.  Not so here.  Where as you can have groceries, food, amazon, whatever, deliver stuff to your house it's not as rampant here.  You can have food but no amazon, no shipping from websites generally, you gotta go to Carrefour, Geant, or Monoprix to get actual food.

Also, if you find something you like food wise, don't get attached.  It may be gone soon and never to return, or it could be restocked tomorrow, or next week, you just never know.  If you drink soda, Coke Zero is ""Coca Zero"" here.  Learn to use clear hand signals.  With my broken French/Arabic/Tunisian and some peoples broken English, I can carry on a pretty good conversation with someone.

If you need any other advice or help, let me know.  I can give you my number and try to help as much as possible.",2015-06-30 13:06:59
csnhd9n,https://www.reddit.com/r/Tunisia/comments/3bg1j6/,2,And THIS is why terrorists will lose here.  The fucking country is filled with Heroes.  Bravery is if you save someone you love by sacrificing yourself.  Heroism is sacrificing yourself to save random strangers.  ,2015-06-30 13:12:22
csom4ho,https://www.reddit.com/r/Tunisia/comments/3bhmvh/,2,$600 for all of that is enough.,2015-07-01 12:42:11
cspqcj7,https://www.reddit.com/r/Tunisia/comments/3bu4qv/,2,"thanks, but no more public education, i've seen enough bullshit xD ",2015-07-02 10:53:09
csw6xqm,https://www.reddit.com/r/Tunisia/comments/3chg39/,2,"Yasser Jradi's version of Dima Dima was always  nearly brought me to tears. It talks about the trouble and fatigue that a only the Tunisian Average Joe would, held through with me all through the revolution.",2015-07-08 14:19:40
csxn8f3,https://www.reddit.com/r/Tunisia/comments/3ckh1p/,2,"Just thought I would mention...
I live in the UK and currently on all the major news channels, all UK residents are being advised to leave now.

Very sad.

http://www.bbc.co.uk/news/uk-33469718",2015-07-09 17:52:20
csyzm1c,https://www.reddit.com/r/Tunisia/comments/3crzhz/,2,Terrorists win.,2015-07-10 20:30:49
ct2s9zy,https://www.reddit.com/r/Tunisia/comments/3d5mw6/,2,"Oh for fucks sake, Okay, do your best.",2015-07-14 11:01:56
ct5kxeg,https://www.reddit.com/r/Tunisia/comments/3d190n/,2,"cultural events :

[Hammamet International Festival - 51st edition](https://www.facebook.com/media/set/?set=a.735445216587908.1073742009.338471422951958&amp;type=3)

[EPHEMERE - music festival - 2nd edition](https://www.facebook.com/events/1646598665584424/)

[Elbazar - creators' market - 3rd edition](https://www.facebook.com/events/967584836597139/)

places :

[COZYBAR Opening Party](https://www.facebook.com/events/870455263025610/)

[Le Plug Hammamet](https://www.facebook.com/pages/Le-Plug-Hammamet/1587469121503541) or [Le Plug Hammamet](https://foursquare.com/v/plug-hammamet/55588f14498e6c7f9dbb97a5)

[Central Perk](https://foursquare.com/v/central-perk/515202ede4b04c8e585bb592)

[Barista's Sousse](https://foursquare.com/v/baristas-sousse/50c32997e4b0fb714329fe25)

[Café Journal](https://foursquare.com/v/caf%C3%A9-journal/4f686fdde4b0fef78fa6a04a)

or try searching foursquare/couchsurfing ",2015-07-16 17:41:07
ctache9,https://www.reddit.com/r/Tunisia/comments/3b6lrq/,2,I must add that the terrorits were born in the 9ties and 8ties. And we all know who was in charge then. Tunisia is the 1st provider of ISIS millitants despite being only 10 millions. If we want to blame someone we ought to blame the old regime who made Tunisia a fertile ground for terrorist recruitement.,2015-07-21 00:38:00
cti4z8g,https://www.reddit.com/r/Tunisia/comments/3er3yd/,2,"Excellent analysis, thanks!",2015-07-27 19:59:45
ctn2fg6,https://www.reddit.com/r/Tunisia/comments/3f9ucu/,2,walla tha7ek ween elkitha,2015-07-31 18:18:52
ctulkye,https://www.reddit.com/r/Tunisia/comments/3g35dw/,2,"If you're planning to interact with Tunisians , you can be sure that you won't have any trouble with the educated (majority) and people of high social status.",2015-08-07 08:19:21
ctulncc,https://www.reddit.com/r/Tunisia/comments/3g35dw/,2,"Not everyone will speak it fluently, but you will be able to communicate with the vast majority of the population using french ",2015-08-07 08:23:45
ctuvtv5,https://www.reddit.com/r/Tunisia/comments/3g35dw/,2,Everyone I've met under 60 years old has been able to speak fluent French including the uneducated but ymmv.,2015-08-07 15:44:15
ctvtbzx,https://www.reddit.com/r/Tunisia/comments/3g83hf/,2,can you tell me why youre calling them thieves? is it because they steal government tax money to do things for their own interests?,2015-08-08 11:16:38
ctwf858,https://www.reddit.com/r/Tunisia/comments/3g83hf/,2,"everything is shady , they didn't want to open older folders , because some rich people will get fucked. Oil deals with britain and other countries: same thing they didn't want to tell the truth about these deals  and kept giving contradictary numbers and it was obvious that they are lying. for a exemple in my city a fucking road who should hav been ended a year ago still unfinished. many projects they are not finished and left out...the goverement is weak you can tell that because they are not taking control.They took loans from EU and USA ,soo many fucking loans and they gave it to buisness men to do factories and shit, but it didn't happened , they wasted it.",2015-08-09 01:04:18
cu3vnr8,https://www.reddit.com/r/Tunisia/comments/3h1rvw/,2,"Well I don't consider Turkey and Serbia to be terror areas, but apart from these few countries she can go anywhere (provided the passport allows it of course).",2015-08-15 14:00:33
cui1h8c,https://www.reddit.com/r/Tunisia/comments/3imgvn/,2,Wled moufida is a very popular show in Tunisia ,2015-08-27 23:12:46
cunxz71,https://www.reddit.com/r/Tunisia/comments/3j7o1r/,2,"Yeah ! we also use it for the kind of person who insists when you say no. ""hadhak Samet"". We also have a popular saying that goes : ""El Samet yaghleb el qbi7"" : the one who insists will triumph over the guy with a attitude, like if someone insists long enough he will eventually get what he wants, even from a bad/bashing person.",2015-09-02 08:02:57
cv7salk,https://www.reddit.com/r/Tunisia/comments/3lns8f/,2,All is good thanks :D :),2015-09-20 10:40:03
cv7skae,https://www.reddit.com/r/Tunisia/comments/3lns8f/,2,Are you anis or his brother?,2015-09-20 11:02:20
cv90ovv,https://www.reddit.com/r/Tunisia/comments/3d5mw6/,2,"The police in Tunisia are know for they excessive use of force on a daily basis against Tunisian citizens, during Ben Ali's reign and after.
It's almost normal to be beaten up by cops in Tunisia if you stand up to them like the Algerian brother did. He was not beaten because he was Algerian but because he stood up to the police officer. 

Algerians and Tunisian are friends and will always be friendlyز",2015-09-21 14:27:02
cvcvr9d,https://www.reddit.com/r/Tunisia/comments/3m735a/,2,ಠ_ಠ,2015-09-24 19:06:00
cvdnpl1,https://www.reddit.com/r/Tunisia/comments/3kpe0c/,2,That's some classic Tunisian shit right there.,2015-09-25 12:22:17
